journey_id,reservation_requested_seats,journey_empty_spaces,reservation_text,user_id,journey_user_id
199d078e-4afb-4556-844f-e2b27593c5e2,3,5,"Magni dolorem dolores rem magnam. Fugit explicabo fugiat nesciunt explicabo. Facilis nostrum atque commodi.
Quaerat eligendi velit beatae tempore debitis fugiat dolorem.",9b70d827-b5eb-4f1a-a22a-bfebe58a5b64,ba516a17-7aff-4080-b0ab-5e6da78aa02b
7870a3f9-4b3f-4b57-b93d-da0b5be87a43,1,1,"Harum nobis sunt occaecati autem. Similique iure magnam dolor. Dolores magnam impedit esse veritatis accusamus.
Sunt sequi deserunt iure. Pariatur excepturi magni quasi dolor.",8b314542-118f-4ffc-ae4b-bf6da186ecfb,58d96f87-c364-4582-8e54-76b099a96ccd
7870a3f9-4b3f-4b57-b93d-da0b5be87a43,1,1,"Quia voluptatem quos est iusto.
Inventore quaerat delectus quia voluptatibus suscipit. Dolorum minus earum odit numquam nesciunt veniam enim.",c9c73437-2299-4f90-9104-c078dd6f3cc4,58d96f87-c364-4582-8e54-76b099a96ccd
199d078e-4afb-4556-844f-e2b27593c5e2,3,5,"Nobis soluta sit exercitationem. Inventore exercitationem magnam distinctio quaerat ea.
Sunt atque odio quos quod doloribus neque. Beatae voluptatum magni ea.",734a2fb2-f740-4d9f-945d-6360dd1ac6c6,ba516a17-7aff-4080-b0ab-5e6da78aa02b
199d078e-4afb-4556-844f-e2b27593c5e2,2,5,"Magni atque nesciunt maiores doloribus. Vel occaecati eaque nihil deleniti occaecati quis.
Atque quas rem modi quod tempore. Et quaerat labore hic impedit.",b05427f0-049f-4c63-b6f7-4274f229ecdd,ba516a17-7aff-4080-b0ab-5e6da78aa02b
8b18113d-9dc3-4fde-b17b-4f7dc8c7e56f,2,4,"Voluptates incidunt quasi adipisci nemo odio eligendi. Aut modi in assumenda aliquam.
Dolor tenetur adipisci iusto maxime.",b66e4a54-1509-44a2-a52a-84450710780e,9b70d827-b5eb-4f1a-a22a-bfebe58a5b64
7870a3f9-4b3f-4b57-b93d-da0b5be87a43,2,1,"Magnam mollitia molestias natus.
Praesentium ad fugit quisquam animi possimus. Totam laborum voluptatem odit.
Ea consectetur sed. Alias excepturi vel odit reprehenderit expedita labore.",de362257-35a5-427f-b5be-37f9e41a9d9c,58d96f87-c364-4582-8e54-76b099a96ccd
596a49a7-766d-4166-aebd-9d2551443543,1,5,"Totam odit unde architecto. Assumenda magni nostrum ipsam quod dignissimos ut.
Natus soluta doloribus debitis accusamus veniam. Animi molestias neque eum.",734a2fb2-f740-4d9f-945d-6360dd1ac6c6,60a3bcf6-1480-41e2-9c6f-eec7642a0f60
8b18113d-9dc3-4fde-b17b-4f7dc8c7e56f,1,4,Dolores consequuntur non magni optio. Omnis cum nostrum occaecati sed quae facere. Sunt molestiae ea nam cumque.,1fc167cc-80a0-469f-ac7a-0ceb811c3203,9b70d827-b5eb-4f1a-a22a-bfebe58a5b64
199d078e-4afb-4556-844f-e2b27593c5e2,3,5,Aspernatur quod maxime exercitationem et iusto ut. Placeat non repudiandae quod. Quisquam vel nostrum minima molestiae occaecati ducimus.,e77d26ba-472b-44d4-9dc0-e660461a28a2,ba516a17-7aff-4080-b0ab-5e6da78aa02b
596a49a7-766d-4166-aebd-9d2551443543,1,5,Autem enim sit sequi quibusdam iure cum. Totam rem veritatis cum nobis eos debitis error. Pariatur asperiores sint quidem necessitatibus accusamus doloremque. Magni repellendus voluptate.,0e2ef53a-7b77-4852-abb1-5a7e63c05c1c,60a3bcf6-1480-41e2-9c6f-eec7642a0f60
8b18113d-9dc3-4fde-b17b-4f7dc8c7e56f,5,4,Tenetur perferendis reiciendis praesentium nemo alias. Consectetur ipsam sed esse accusamus quam.,bd9c78bf-7db1-49d5-8479-59bdd48a93bf,9b70d827-b5eb-4f1a-a22a-bfebe58a5b64
8b18113d-9dc3-4fde-b17b-4f7dc8c7e56f,3,4,"Voluptatibus eligendi qui. Facilis est temporibus provident in quos laboriosam maiores.
Inventore qui nesciunt maiores quam eum magni. Beatae asperiores dolorum culpa. Alias laboriosam deleniti.",9bedea62-c758-4268-b279-22934532de30,9b70d827-b5eb-4f1a-a22a-bfebe58a5b64
596a49a7-766d-4166-aebd-9d2551443543,2,5,Delectus aut atque inventore necessitatibus accusamus. Iste facilis commodi tenetur assumenda. Cumque corrupti veniam soluta. Tenetur unde earum omnis nostrum cum.,40088021-f844-457a-98ce-b9fa89eedbf7,60a3bcf6-1480-41e2-9c6f-eec7642a0f60
8b18113d-9dc3-4fde-b17b-4f7dc8c7e56f,2,4,"Aliquid qui nam. Minus aut vel quod deserunt.
Eveniet a aliquid. Nesciunt temporibus reprehenderit praesentium quo cumque.",39142fc1-1c6d-4778-b091-40975831c5d9,9b70d827-b5eb-4f1a-a22a-bfebe58a5b64
7870a3f9-4b3f-4b57-b93d-da0b5be87a43,1,1,"Deleniti nobis dolor necessitatibus. Rerum enim asperiores minima. Voluptatibus id delectus beatae.
Odio inventore et aperiam officia. Nemo officia nostrum corporis eligendi.",5441b3a8-4a17-458a-bd6a-ec677d3d803b,58d96f87-c364-4582-8e54-76b099a96ccd
7870a3f9-4b3f-4b57-b93d-da0b5be87a43,3,1,Consequatur ipsam exercitationem error. Temporibus expedita quod. Voluptas at accusamus iure aliquid ducimus.,b6f9add8-297e-4886-9550-21a1275f4598,58d96f87-c364-4582-8e54-76b099a96ccd
8b18113d-9dc3-4fde-b17b-4f7dc8c7e56f,4,4,Debitis enim harum impedit aliquam voluptatibus ea fugit. Tenetur vitae inventore aut. Amet dolores cumque id id ipsa officia.,f9d82ec4-5acb-4d22-a1fe-8e08e09a56b6,9b70d827-b5eb-4f1a-a22a-bfebe58a5b64
596a49a7-766d-4166-aebd-9d2551443543,1,5,"Laudantium dolores delectus cupiditate unde. Neque ullam voluptate aliquid quas.
Vero repellat illo. Dolorum perspiciatis voluptatum laboriosam. Commodi provident officia id adipisci atque eius.",678e476f-1b8e-49aa-9479-be2485b10631,60a3bcf6-1480-41e2-9c6f-eec7642a0f60
596a49a7-766d-4166-aebd-9d2551443543,3,5,Incidunt recusandae alias molestiae quam harum repellat. Eveniet amet quidem totam reiciendis. Voluptatum dolorem ea optio officiis.,b05427f0-049f-4c63-b6f7-4274f229ecdd,60a3bcf6-1480-41e2-9c6f-eec7642a0f60
596a49a7-766d-4166-aebd-9d2551443543,2,5,Autem culpa provident temporibus neque repellat totam. Natus tempora illum sed occaecati delectus. Voluptates dicta deserunt atque consectetur quis. Tenetur suscipit nisi quos iure quia.,80b798bb-488b-479a-bd6c-472a886ac3f3,60a3bcf6-1480-41e2-9c6f-eec7642a0f60
199d078e-4afb-4556-844f-e2b27593c5e2,4,5,"Dolorum pariatur ducimus. Perspiciatis aspernatur autem sit. Cupiditate quo minima culpa amet praesentium.
Quia esse voluptate numquam. Aliquid cumque incidunt.",52040252-4a30-4c6f-bc62-044870129808,ba516a17-7aff-4080-b0ab-5e6da78aa02b
199d078e-4afb-4556-844f-e2b27593c5e2,2,5,Quos eius nostrum sapiente ut adipisci. Corrupti repellat totam molestias dolore molestias. Dolorum amet in beatae.,ba516a17-7aff-4080-b0ab-5e6da78aa02b,ba516a17-7aff-4080-b0ab-5e6da78aa02b
8b18113d-9dc3-4fde-b17b-4f7dc8c7e56f,4,4,"Nostrum modi ab saepe. Fuga harum deleniti eius. Qui minima facilis hic sunt ullam.
Debitis esse iusto dolore odio. Explicabo sed corporis esse eos.",4f3c2411-05a3-428e-9f26-166106469564,9b70d827-b5eb-4f1a-a22a-bfebe58a5b64
7870a3f9-4b3f-4b57-b93d-da0b5be87a43,4,1,Hic facilis veniam suscipit officiis ab perspiciatis. Temporibus voluptatibus asperiores. Eos quod corrupti eos temporibus.,370ce4eb-971c-4cab-86ba-dbea8d7fe270,58d96f87-c364-4582-8e54-76b099a96ccd
199d078e-4afb-4556-844f-e2b27593c5e2,3,5,Vel totam mollitia id ut expedita. Est eum quidem officia saepe cum harum. Dignissimos illum quas expedita vero facere accusantium reprehenderit.,b05427f0-049f-4c63-b6f7-4274f229ecdd,ba516a17-7aff-4080-b0ab-5e6da78aa02b
7870a3f9-4b3f-4b57-b93d-da0b5be87a43,5,1,Provident laudantium similique suscipit adipisci. Facilis minima commodi ea optio exercitationem autem. Repellendus corrupti quibusdam accusamus.,5441b3a8-4a17-458a-bd6a-ec677d3d803b,58d96f87-c364-4582-8e54-76b099a96ccd
7870a3f9-4b3f-4b57-b93d-da0b5be87a43,2,1,"Non laudantium earum laudantium doloribus. Officiis velit sed temporibus modi eos officia reprehenderit.
Consectetur quis odio provident vero.",3f898b70-1da0-443a-b11d-6198bfc5b52e,58d96f87-c364-4582-8e54-76b099a96ccd
199d078e-4afb-4556-844f-e2b27593c5e2,4,5,Laboriosam esse veniam distinctio. Nam ipsum doloribus aspernatur reprehenderit velit. Qui corporis cupiditate sed distinctio at neque. Enim nobis voluptatum molestiae laborum quisquam perferendis.,b66e4a54-1509-44a2-a52a-84450710780e,ba516a17-7aff-4080-b0ab-5e6da78aa02b
199d078e-4afb-4556-844f-e2b27593c5e2,2,5,Nobis neque voluptates excepturi libero at. Reiciendis quidem minima in. Expedita ad id autem unde.,3f898b70-1da0-443a-b11d-6198bfc5b52e,ba516a17-7aff-4080-b0ab-5e6da78aa02b
8b18113d-9dc3-4fde-b17b-4f7dc8c7e56f,1,4,Odit cum at eum dignissimos id. Dignissimos provident qui ea vitae facere.,a7cd15c9-dda8-486d-ba50-48e7c24bf994,9b70d827-b5eb-4f1a-a22a-bfebe58a5b64
7870a3f9-4b3f-4b57-b93d-da0b5be87a43,3,1,Nesciunt officia iusto deleniti amet molestiae molestias. Laudantium repudiandae accusantium numquam.,b05427f0-049f-4c63-b6f7-4274f229ecdd,58d96f87-c364-4582-8e54-76b099a96ccd
199d078e-4afb-4556-844f-e2b27593c5e2,1,5,Quia magnam quidem dolorem harum aliquam. Praesentium excepturi eligendi.,613aa5a3-f215-4066-ba1a-dc603fc0e6ad,ba516a17-7aff-4080-b0ab-5e6da78aa02b
596a49a7-766d-4166-aebd-9d2551443543,3,5,"Vel harum odio perferendis. Aperiam non veritatis ea.
Veniam earum dicta fugiat. Voluptatem sunt repellat eius nemo ad eaque.",26e23de3-b63f-4fa5-b1b8-841506960a64,60a3bcf6-1480-41e2-9c6f-eec7642a0f60
199d078e-4afb-4556-844f-e2b27593c5e2,2,5,Est quae enim minima. Et ratione labore ratione tempora. Eos voluptatibus tenetur dignissimos quae sunt.,090ecc33-f292-4626-a84e-86d83516ad76,ba516a17-7aff-4080-b0ab-5e6da78aa02b
199d078e-4afb-4556-844f-e2b27593c5e2,1,5,"Ullam itaque magni commodi cumque ab quo doloremque. Architecto illum facere. Ipsam iste quae.
Magnam mollitia harum provident. Cupiditate fugiat quidem aspernatur.",5c0e8357-2b51-44e4-8d43-38f58166be37,ba516a17-7aff-4080-b0ab-5e6da78aa02b
596a49a7-766d-4166-aebd-9d2551443543,1,5,"Accusamus inventore commodi.
Quae est nobis debitis exercitationem quaerat impedit. Qui magnam eius minima necessitatibus. Consequuntur placeat dignissimos earum delectus nisi.",4f3c2411-05a3-428e-9f26-166106469564,60a3bcf6-1480-41e2-9c6f-eec7642a0f60
596a49a7-766d-4166-aebd-9d2551443543,2,5,"Nihil vel quae veritatis at. Nihil error error saepe illum debitis.
Ratione necessitatibus quod voluptatibus illo ea beatae. Id culpa voluptate.",8581fab5-bbcf-4ffa-bac5-33e0aed58a93,60a3bcf6-1480-41e2-9c6f-eec7642a0f60
8b18113d-9dc3-4fde-b17b-4f7dc8c7e56f,2,4,"Neque consequatur dicta natus autem minima.
Quae placeat excepturi eius deserunt. Quis voluptas a eum perspiciatis nemo laudantium. Placeat esse consequatur.",a431eba4-7b68-4761-b82b-100acf19f6e8,9b70d827-b5eb-4f1a-a22a-bfebe58a5b64
7870a3f9-4b3f-4b57-b93d-da0b5be87a43,4,1,"Repellat illo illum possimus.
In deleniti nesciunt nesciunt illo dolor. In labore aperiam ex laudantium vero quisquam.",b05427f0-049f-4c63-b6f7-4274f229ecdd,58d96f87-c364-4582-8e54-76b099a96ccd
7870a3f9-4b3f-4b57-b93d-da0b5be87a43,4,1,Consequatur laborum saepe. Eveniet consectetur quisquam.,39142fc1-1c6d-4778-b091-40975831c5d9,58d96f87-c364-4582-8e54-76b099a96ccd
596a49a7-766d-4166-aebd-9d2551443543,4,5,Corrupti perferendis magni a dolorum nobis. Rem officia unde reprehenderit. Dolore tempore nobis quod sed laudantium voluptate.,ff65592c-fd29-4d18-a1e2-f5398ab4192d,60a3bcf6-1480-41e2-9c6f-eec7642a0f60
8b18113d-9dc3-4fde-b17b-4f7dc8c7e56f,5,4,"Beatae harum enim sit in eaque. Est nemo adipisci porro at ipsa. Ipsum ea neque cum nobis ex.
Rerum eos minima nobis explicabo quam. Adipisci libero facere quis expedita.",d76d4b5e-67e4-4a6e-8304-9a2c8e3a9fd0,9b70d827-b5eb-4f1a-a22a-bfebe58a5b64
596a49a7-766d-4166-aebd-9d2551443543,5,5,Quibusdam hic in perspiciatis necessitatibus praesentium. Nemo ad rerum. Quasi mollitia adipisci id natus aperiam. Nihil quam illum ipsa ipsum consectetur.,8b314542-118f-4ffc-ae4b-bf6da186ecfb,60a3bcf6-1480-41e2-9c6f-eec7642a0f60
7870a3f9-4b3f-4b57-b93d-da0b5be87a43,3,1,"Dolore iure debitis dolores sapiente soluta esse. Voluptates architecto rem ipsam.
Laudantium ipsam optio reprehenderit rem cupiditate alias. Culpa consequatur deserunt fugit.",5ded0e3b-8ef3-47a2-91f8-be61ca70b380,58d96f87-c364-4582-8e54-76b099a96ccd
8b18113d-9dc3-4fde-b17b-4f7dc8c7e56f,4,4,"Dolore perspiciatis porro explicabo excepturi.
Enim ratione blanditiis repellendus ullam neque veritatis. Architecto beatae aspernatur alias. Numquam debitis quam qui aspernatur.",c9349e4d-cdcc-4c91-9685-b1728579a9a7,9b70d827-b5eb-4f1a-a22a-bfebe58a5b64
199d078e-4afb-4556-844f-e2b27593c5e2,1,5,Animi molestias minus deleniti quod. Alias corrupti molestias possimus numquam asperiores voluptas.,80b798bb-488b-479a-bd6c-472a886ac3f3,ba516a17-7aff-4080-b0ab-5e6da78aa02b
8b18113d-9dc3-4fde-b17b-4f7dc8c7e56f,4,4,"Dolores placeat quo voluptate.
Magni velit quia occaecati sequi. Error ipsam magnam in ullam ut blanditiis. In cumque aspernatur facere occaecati facilis.",3dc7d1f1-8826-4c84-ba93-666594534718,9b70d827-b5eb-4f1a-a22a-bfebe58a5b64
7870a3f9-4b3f-4b57-b93d-da0b5be87a43,3,1,"Molestias assumenda ratione sed voluptatum ad. Nemo laudantium doloremque incidunt eos.
Tenetur corporis distinctio libero minima nihil magni. Porro pariatur mollitia eveniet doloremque.",5ded0e3b-8ef3-47a2-91f8-be61ca70b380,58d96f87-c364-4582-8e54-76b099a96ccd
596a49a7-766d-4166-aebd-9d2551443543,1,5,Corrupti ea cum occaecati modi dolore. Id dolorum optio ut culpa.,26e23de3-b63f-4fa5-b1b8-841506960a64,60a3bcf6-1480-41e2-9c6f-eec7642a0f60
8b18113d-9dc3-4fde-b17b-4f7dc8c7e56f,4,4,"Voluptatum quis molestiae expedita ullam asperiores quae illo. Nostrum impedit repellendus autem.
Voluptatem autem libero. Deserunt inventore voluptate cupiditate dolorem pariatur quidem.",4f3c2411-05a3-428e-9f26-166106469564,9b70d827-b5eb-4f1a-a22a-bfebe58a5b64
199d078e-4afb-4556-844f-e2b27593c5e2,5,5,Deleniti voluptate et qui aspernatur. Totam ab consequatur laboriosam. Ut et nobis dignissimos inventore iure esse.,e77d26ba-472b-44d4-9dc0-e660461a28a2,ba516a17-7aff-4080-b0ab-5e6da78aa02b
596a49a7-766d-4166-aebd-9d2551443543,3,5,"Fuga dicta consectetur rerum. Libero ut perspiciatis pariatur. Culpa cum quas vel qui ratione vitae reprehenderit.
Dolores vero qui. Alias corporis necessitatibus et. Distinctio mollitia ab corrupti.",2ae683b1-9546-49a9-af9f-6d9a87f166fe,60a3bcf6-1480-41e2-9c6f-eec7642a0f60
596a49a7-766d-4166-aebd-9d2551443543,5,5,"Explicabo harum aliquam necessitatibus. Labore reprehenderit iste occaecati deleniti.
Voluptatem nam sunt. Dolor adipisci earum atque facere cum. Dolorem fuga quisquam.",734a2fb2-f740-4d9f-945d-6360dd1ac6c6,60a3bcf6-1480-41e2-9c6f-eec7642a0f60
199d078e-4afb-4556-844f-e2b27593c5e2,4,5,"A unde qui eum voluptas. Itaque exercitationem unde repudiandae dolores optio nam fuga.
Saepe ullam accusantium voluptatum repellat ad vero. Molestias sequi sit dolore.",26e23de3-b63f-4fa5-b1b8-841506960a64,ba516a17-7aff-4080-b0ab-5e6da78aa02b
7870a3f9-4b3f-4b57-b93d-da0b5be87a43,5,1,Odio perferendis doloremque eum officiis ad enim. Placeat minus unde deleniti nobis porro veniam. Aliquam eligendi maxime. Velit sapiente fugit maiores iusto doloremque asperiores numquam.,5441b3a8-4a17-458a-bd6a-ec677d3d803b,58d96f87-c364-4582-8e54-76b099a96ccd
7870a3f9-4b3f-4b57-b93d-da0b5be87a43,1,1,Voluptatibus porro perferendis harum incidunt alias illo. Eaque doloribus quibusdam odio aut quidem natus.,de362257-35a5-427f-b5be-37f9e41a9d9c,58d96f87-c364-4582-8e54-76b099a96ccd
199d078e-4afb-4556-844f-e2b27593c5e2,4,5,"Ullam explicabo maiores corporis dicta magni vel. Maxime vel porro asperiores ratione. Ut debitis cum aliquid.
Alias aut officia minima perspiciatis. Laboriosam aliquid quo veritatis qui.",e77d26ba-472b-44d4-9dc0-e660461a28a2,ba516a17-7aff-4080-b0ab-5e6da78aa02b
199d078e-4afb-4556-844f-e2b27593c5e2,3,5,"Cupiditate placeat tempora tempore. Esse dignissimos accusantium doloremque.
Dolorem aspernatur dolorum facilis quibusdam. Doloribus iste ex fugiat enim dolor. Iste fuga illum reiciendis sunt magnam.",de362257-35a5-427f-b5be-37f9e41a9d9c,ba516a17-7aff-4080-b0ab-5e6da78aa02b
596a49a7-766d-4166-aebd-9d2551443543,4,5,"Quam autem suscipit ut eligendi facilis labore.
Atque modi optio optio qui possimus. Magni possimus labore placeat voluptatum atque. Alias quo doloremque neque delectus voluptates.",6ad91709-19a5-4c97-9a4d-9151862eddde,60a3bcf6-1480-41e2-9c6f-eec7642a0f60
199d078e-4afb-4556-844f-e2b27593c5e2,4,5,"Nisi quasi qui sunt. Labore ad unde aut rerum. Nam mollitia consectetur facere.
Molestias iste possimus unde ipsum dolorum quaerat. Neque ipsum odit sapiente. Sit voluptatum provident.",062a4cc0-8d3b-4618-aafc-787562f34e04,ba516a17-7aff-4080-b0ab-5e6da78aa02b
199d078e-4afb-4556-844f-e2b27593c5e2,5,5,Dolore recusandae dicta autem. Dolore necessitatibus omnis molestiae. Esse tempore vero minima officiis doloremque necessitatibus.,678e476f-1b8e-49aa-9479-be2485b10631,ba516a17-7aff-4080-b0ab-5e6da78aa02b
8b18113d-9dc3-4fde-b17b-4f7dc8c7e56f,4,4,Sint quae aperiam pariatur fugiat. Vero dignissimos suscipit corrupti tempore deserunt sapiente. Suscipit repudiandae corrupti voluptatibus sapiente.,7ae0da8a-abbc-46b9-8229-35b0fa2b1bd0,9b70d827-b5eb-4f1a-a22a-bfebe58a5b64
596a49a7-766d-4166-aebd-9d2551443543,4,5,Ex quas adipisci eveniet ipsa tempora sed distinctio. Laborum illo eveniet ullam explicabo. Voluptatibus ab est natus minima perferendis.,9bedea62-c758-4268-b279-22934532de30,60a3bcf6-1480-41e2-9c6f-eec7642a0f60
7870a3f9-4b3f-4b57-b93d-da0b5be87a43,1,1,Recusandae odit officia error ducimus. Soluta asperiores debitis quia animi. Cupiditate provident doloribus repudiandae minima occaecati totam. Omnis mollitia numquam accusamus dolores repellat.,d2bece4a-3b80-4a61-9c19-053938f4ce94,58d96f87-c364-4582-8e54-76b099a96ccd
8b18113d-9dc3-4fde-b17b-4f7dc8c7e56f,1,4,"Enim iusto rem voluptas. Quos veniam eum deserunt illo in debitis. Fugit iure ipsa sapiente excepturi repellendus quam.
Minima modi aliquid et mollitia. Expedita et maiores porro voluptas.",e77d26ba-472b-44d4-9dc0-e660461a28a2,9b70d827-b5eb-4f1a-a22a-bfebe58a5b64
199d078e-4afb-4556-844f-e2b27593c5e2,2,5,"Minus facere eos a similique. Hic doloribus in.
Voluptate iure voluptatum magni aut veniam magnam. Molestias libero aperiam natus expedita eius nostrum.",314934b5-f928-46e9-93c5-c209a90cc582,ba516a17-7aff-4080-b0ab-5e6da78aa02b
199d078e-4afb-4556-844f-e2b27593c5e2,5,5,Alias sequi alias quis eius dolor ut. Id consequuntur nemo nostrum.,df1ce7a6-f079-400d-81b1-4ddcc15351a3,ba516a17-7aff-4080-b0ab-5e6da78aa02b
8b18113d-9dc3-4fde-b17b-4f7dc8c7e56f,5,4,Exercitationem sapiente occaecati enim. Ad possimus iste dolores sapiente. Expedita earum necessitatibus nisi ipsa.,e928afc8-1e4d-49d0-8123-3b9f72122641,9b70d827-b5eb-4f1a-a22a-bfebe58a5b64
596a49a7-766d-4166-aebd-9d2551443543,4,5,"Eaque non asperiores laborum. Eligendi ab nam eum. Doloribus non ab eaque placeat eos accusamus. Facilis corrupti tenetur vero.
Eum ex facilis omnis.",3cd89c35-ef59-49f7-bcb8-922439b338af,60a3bcf6-1480-41e2-9c6f-eec7642a0f60
7870a3f9-4b3f-4b57-b93d-da0b5be87a43,2,1,Qui delectus laborum aspernatur. Tempore ex laborum rerum cumque. Quam dolores soluta officia optio eaque numquam.,3f898b70-1da0-443a-b11d-6198bfc5b52e,58d96f87-c364-4582-8e54-76b099a96ccd
8b18113d-9dc3-4fde-b17b-4f7dc8c7e56f,4,4,Cumque repellat perspiciatis libero natus minus architecto expedita. Vitae molestias autem minima incidunt eos autem. Eum quis reiciendis facilis nisi aliquam ipsam.,b6f9add8-297e-4886-9550-21a1275f4598,9b70d827-b5eb-4f1a-a22a-bfebe58a5b64
7870a3f9-4b3f-4b57-b93d-da0b5be87a43,4,1,Quod praesentium sunt unde voluptates fugiat porro soluta. Reprehenderit facere sed tempore sint molestiae. Dolores quo deleniti cum eaque.,8581fab5-bbcf-4ffa-bac5-33e0aed58a93,58d96f87-c364-4582-8e54-76b099a96ccd
7870a3f9-4b3f-4b57-b93d-da0b5be87a43,3,1,"Optio vel cum suscipit inventore doloribus modi. Explicabo facilis esse modi aut.
Distinctio saepe tempora non. Occaecati labore placeat atque ut.",cef51793-37ed-4486-bd5e-87fda582ef0b,58d96f87-c364-4582-8e54-76b099a96ccd
596a49a7-766d-4166-aebd-9d2551443543,2,5,Rem saepe reiciendis eaque vel inventore. Natus facere doloribus est.,7a0b396b-6dd5-4c46-8cb1-1759be881956,60a3bcf6-1480-41e2-9c6f-eec7642a0f60
199d078e-4afb-4556-844f-e2b27593c5e2,4,5,"Tempore voluptatum quo quia necessitatibus illo. Laboriosam voluptate est ipsa consequuntur error quos.
Possimus distinctio minus in amet doloremque. Labore totam quaerat sed qui reiciendis.",e8d0a594-c49a-4a56-bb99-45ebb5c01d4f,ba516a17-7aff-4080-b0ab-5e6da78aa02b
7870a3f9-4b3f-4b57-b93d-da0b5be87a43,1,1,A suscipit suscipit distinctio officiis numquam.,ec0467f6-711f-4ab3-8ada-f4f136fd7db0,58d96f87-c364-4582-8e54-76b099a96ccd
596a49a7-766d-4166-aebd-9d2551443543,4,5,"Laudantium porro libero ut occaecati. Possimus et assumenda ipsa vero.
Est assumenda dolorem repellat dolor cum. Alias cupiditate possimus maiores fuga.",5d68cdca-0448-479c-ad78-ad2c989d7c9c,60a3bcf6-1480-41e2-9c6f-eec7642a0f60
596a49a7-766d-4166-aebd-9d2551443543,5,5,"Necessitatibus aliquam vitae voluptatem.
Neque harum eos velit praesentium. Modi nisi sed ipsam quibusdam dolores quo.",b6f9add8-297e-4886-9550-21a1275f4598,60a3bcf6-1480-41e2-9c6f-eec7642a0f60
7870a3f9-4b3f-4b57-b93d-da0b5be87a43,3,1,Eum omnis quia impedit inventore veniam cumque. Sapiente mollitia tempore minus aut possimus.,55bbabb6-cffb-48f1-8f89-0abb11d5f9d1,58d96f87-c364-4582-8e54-76b099a96ccd
8b18113d-9dc3-4fde-b17b-4f7dc8c7e56f,3,4,"Iure laudantium architecto eveniet totam.
Iure harum architecto accusantium. Ab labore nostrum earum.
Debitis cum aliquam corporis. Molestias cum at placeat harum ducimus sequi.",a7cd15c9-dda8-486d-ba50-48e7c24bf994,9b70d827-b5eb-4f1a-a22a-bfebe58a5b64
8b18113d-9dc3-4fde-b17b-4f7dc8c7e56f,1,4,Quaerat possimus assumenda expedita. Optio quia explicabo. Ut temporibus temporibus magnam adipisci explicabo debitis modi.,a9c8a41c-b359-4eef-b6f4-0be0a8cc2ce8,9b70d827-b5eb-4f1a-a22a-bfebe58a5b64
596a49a7-766d-4166-aebd-9d2551443543,3,5,Nulla iusto dolores dolores ducimus ipsum accusamus. Magni inventore officiis mollitia inventore error maxime minus.,d5065c36-571b-4cbe-a42b-ee1234c99e38,60a3bcf6-1480-41e2-9c6f-eec7642a0f60
199d078e-4afb-4556-844f-e2b27593c5e2,5,5,"Alias adipisci voluptatem id non ea. Illo odio exercitationem quibusdam nam dignissimos maiores vitae.
Nam sint nisi eius. Temporibus nostrum perferendis eius veritatis.",16ab5725-c530-40a7-ab8d-91e679e02fc2,ba516a17-7aff-4080-b0ab-5e6da78aa02b
7870a3f9-4b3f-4b57-b93d-da0b5be87a43,1,1,Voluptas ea quia voluptates deserunt. Sed sapiente quia fugit voluptate fugit qui. Aspernatur consequatur voluptatem sunt. Libero exercitationem officia deleniti dolore.,1fc167cc-80a0-469f-ac7a-0ceb811c3203,58d96f87-c364-4582-8e54-76b099a96ccd
596a49a7-766d-4166-aebd-9d2551443543,2,5,Ea sed illum. Sunt repudiandae quia. Reiciendis a expedita sed. Dolore voluptatem at ratione laudantium facere inventore.,9b1618d3-225a-4ae3-9984-e192bb5640dd,60a3bcf6-1480-41e2-9c6f-eec7642a0f60
8b18113d-9dc3-4fde-b17b-4f7dc8c7e56f,2,4,Adipisci quam cumque suscipit asperiores. Eum minima assumenda esse.,dbde00fc-a75e-4e2c-a7d3-8231fca194f7,9b70d827-b5eb-4f1a-a22a-bfebe58a5b64
8b18113d-9dc3-4fde-b17b-4f7dc8c7e56f,5,4,Illo facere minus minima. Adipisci repudiandae consequatur voluptates libero aliquam.,5d68cdca-0448-479c-ad78-ad2c989d7c9c,9b70d827-b5eb-4f1a-a22a-bfebe58a5b64
7870a3f9-4b3f-4b57-b93d-da0b5be87a43,5,1,Molestias reprehenderit aut est nihil nihil harum. Nulla sint similique similique voluptatum neque iure. Nisi ex error eveniet doloribus minima sunt nulla.,c9349e4d-cdcc-4c91-9685-b1728579a9a7,58d96f87-c364-4582-8e54-76b099a96ccd
596a49a7-766d-4166-aebd-9d2551443543,4,5,Ducimus eaque cumque rem autem aperiam quisquam minus. Corrupti natus minus.,314934b5-f928-46e9-93c5-c209a90cc582,60a3bcf6-1480-41e2-9c6f-eec7642a0f60
7870a3f9-4b3f-4b57-b93d-da0b5be87a43,3,1,"Similique pariatur maxime explicabo. Commodi minima cupiditate ea ex.
Dolores quod rerum fugit a. Officia animi fuga ex facilis nemo exercitationem.",b88ab42a-3129-4916-9442-c310695c80d9,58d96f87-c364-4582-8e54-76b099a96ccd
7870a3f9-4b3f-4b57-b93d-da0b5be87a43,3,1,Eligendi illo error exercitationem laboriosam. Delectus fugiat eligendi reprehenderit vitae delectus.,d2bece4a-3b80-4a61-9c19-053938f4ce94,58d96f87-c364-4582-8e54-76b099a96ccd
8b18113d-9dc3-4fde-b17b-4f7dc8c7e56f,1,4,"Doloribus ducimus voluptatem. Qui quibusdam explicabo voluptatum.
Minima vel praesentium iusto doloribus. Tempore ducimus minus itaque incidunt sit facere. Consequatur minus odit tempore.",c9c73437-2299-4f90-9104-c078dd6f3cc4,9b70d827-b5eb-4f1a-a22a-bfebe58a5b64
8b18113d-9dc3-4fde-b17b-4f7dc8c7e56f,5,4,Eum dicta tenetur reprehenderit. Tenetur natus provident dolore. Numquam eos placeat eligendi error dolor aspernatur blanditiis.,24c57f2e-222d-4885-be3d-5e1330953e56,9b70d827-b5eb-4f1a-a22a-bfebe58a5b64
8b18113d-9dc3-4fde-b17b-4f7dc8c7e56f,5,4,"Ex labore ut accusamus architecto est. Sapiente aliquid voluptate dignissimos unde iure hic cumque.
Minus aut rem. Laboriosam doloribus adipisci iure dolorem ab inventore et.",734a2fb2-f740-4d9f-945d-6360dd1ac6c6,9b70d827-b5eb-4f1a-a22a-bfebe58a5b64
199d078e-4afb-4556-844f-e2b27593c5e2,2,5,"Quam doloribus corporis sit veritatis velit. Dicta at eos esse saepe praesentium quibusdam.
In hic vel. Ipsam laudantium eaque perspiciatis necessitatibus natus voluptas.",2050b9dc-7990-4304-a614-26192c3498f9,ba516a17-7aff-4080-b0ab-5e6da78aa02b
7870a3f9-4b3f-4b57-b93d-da0b5be87a43,2,1,"Ullam dolore nulla numquam blanditiis quos repellendus. Adipisci ea dicta.
Quis nostrum vitae asperiores error ex soluta ipsum. Rerum distinctio eos sunt.",9b70d827-b5eb-4f1a-a22a-bfebe58a5b64,58d96f87-c364-4582-8e54-76b099a96ccd
