reservation_id,journey_id,reservation_requested_seats,journey_empty_spaces,reservation_text,user_id,journey_user_id,reservation_money,reservation_status
5170f392-ed69-4329-8845-0e1bb5412bde,e715b7b5-254e-4fcd-8fbe-422e85530b9f,2,3,"Repellendus soluta reiciendis iusto harum sit asperiores. Fugit hic amet temporibus.
Voluptatibus sequi nihil a rerum. Nulla soluta natus sed quas aperiam modi.",8407ad54-f00f-4d43-8bda-869744abfb50,832f842e-de43-49e8-bac1-841c068cd825,1,pending
1413f3ea-fdf7-44f0-9308-f60630f46b6e,e715b7b5-254e-4fcd-8fbe-422e85530b9f,3,3,Eius animi laudantium. Molestiae aut aut vero labore.,8724ce02-851c-4664-9b92-c4706ecc0c61,832f842e-de43-49e8-bac1-841c068cd825,18,pending
7be0d3e3-013c-497e-96bf-eb771fcc291b,e715b7b5-254e-4fcd-8fbe-422e85530b9f,5,3,Maxime ad fuga nemo adipisci hic voluptas. Natus vel laboriosam similique.,cc8d6286-45bb-4966-8ed9-d52c197ed0f4,832f842e-de43-49e8-bac1-841c068cd825,10,pending
2fd76a3f-334d-4928-9c36-aa0cc31f3b59,e715b7b5-254e-4fcd-8fbe-422e85530b9f,2,3,Itaque quisquam harum rerum. Dolores explicabo saepe voluptates. Dolorem labore fuga ipsam.,2f9c88c6-19d4-4e4f-a782-05164883ba36,832f842e-de43-49e8-bac1-841c068cd825,9,pending
994420fa-938e-4db2-a1e5-8f1c9d2507e2,e715b7b5-254e-4fcd-8fbe-422e85530b9f,3,3,Consequatur deleniti non possimus placeat dolorem. Impedit dolorem aspernatur minus. Aspernatur sequi aspernatur recusandae sint omnis.,004bec3d-b893-4d4f-9dc1-2c3ab09d868f,832f842e-de43-49e8-bac1-841c068cd825,4,pending
75f5585f-7806-4ee8-8727-506fbbbb25f9,e715b7b5-254e-4fcd-8fbe-422e85530b9f,1,3,Soluta consequuntur ipsam sapiente numquam soluta. Mollitia ullam similique nobis animi labore. Veniam fuga iusto unde praesentium libero.,94fa4429-b772-4efa-a345-17266a923b6a,832f842e-de43-49e8-bac1-841c068cd825,9,pending
f53b3ffc-74fe-4a4b-a9d2-cdbfb2ec47f7,e715b7b5-254e-4fcd-8fbe-422e85530b9f,1,3,Itaque necessitatibus porro velit. Repudiandae expedita dignissimos. Earum eaque nobis. Commodi nemo nobis excepturi.,cc55d76b-b222-4842-8141-cb8132c812bb,832f842e-de43-49e8-bac1-841c068cd825,11,pending
4efdd33b-deee-4bdc-84eb-2586dc599942,e715b7b5-254e-4fcd-8fbe-422e85530b9f,1,3,Quas libero tempora mollitia quas doloremque magnam corporis. Reiciendis facilis molestias nobis.,c5b2ebfd-0fcc-445a-9647-7a52caf63787,832f842e-de43-49e8-bac1-841c068cd825,7,pending
d838d0c4-a72d-4d32-aa40-c795afd31b64,e715b7b5-254e-4fcd-8fbe-422e85530b9f,5,3,"Corrupti officiis neque deleniti ducimus totam. Asperiores cum quasi necessitatibus.
Perferendis veniam totam nihil perspiciatis. Illum atque dignissimos culpa pariatur sed.",49fb6b66-7826-4828-8c9b-1e6508ed0ab7,832f842e-de43-49e8-bac1-841c068cd825,16,pending
116fceaf-9caa-4187-af32-83058d070e35,e715b7b5-254e-4fcd-8fbe-422e85530b9f,3,3,Cum labore cupiditate excepturi sunt. Ipsam aut facilis facilis sed deleniti. Adipisci perferendis ab perferendis perferendis ea reprehenderit.,bf8d2d53-33b2-4828-b0fc-8a591444ebdc,832f842e-de43-49e8-bac1-841c068cd825,12,pending
048a942a-8ab5-438c-81e7-e8f9cbfbad28,e715b7b5-254e-4fcd-8fbe-422e85530b9f,4,3,Quis nobis quaerat nemo iusto ex quis.,94fa4429-b772-4efa-a345-17266a923b6a,832f842e-de43-49e8-bac1-841c068cd825,6,pending
f8688774-63c9-4a81-9751-08a51e1cd8a2,e715b7b5-254e-4fcd-8fbe-422e85530b9f,4,3,"Eligendi quam ducimus ratione rerum deserunt. Porro voluptatum cum explicabo cupiditate cupiditate iusto.
Tempora quo placeat. Corporis delectus ipsam in illo atque.
Dolorem et dolores iste laborum.",d5abcbf1-918d-4b1f-8c6f-2f427f28cbf7,832f842e-de43-49e8-bac1-841c068cd825,7,pending
254e966b-f29f-4fe1-8fc5-eaaad4b4d020,e715b7b5-254e-4fcd-8fbe-422e85530b9f,5,3,Unde dolorum architecto quibusdam. Dolorum maxime rerum adipisci neque occaecati labore.,d5abcbf1-918d-4b1f-8c6f-2f427f28cbf7,832f842e-de43-49e8-bac1-841c068cd825,24,pending
2089a6d6-492a-4de0-b4a5-58fa6be86f31,e715b7b5-254e-4fcd-8fbe-422e85530b9f,5,3,"Exercitationem excepturi distinctio ratione excepturi vitae nobis.
Occaecati dolores itaque quo fugit repellat. Expedita occaecati expedita. Sequi repudiandae dignissimos quasi.",cc8d6286-45bb-4966-8ed9-d52c197ed0f4,832f842e-de43-49e8-bac1-841c068cd825,0,pending
7cfda0db-3c78-4b04-96e4-f2299c50287a,e715b7b5-254e-4fcd-8fbe-422e85530b9f,4,3,"Ab est aperiam impedit ducimus. Facere accusamus optio.
Deleniti ea provident magnam. Suscipit quam accusantium incidunt velit vero. Expedita sunt quaerat saepe.",e56d59cb-4b0d-4801-a31d-f8fcd0221b80,832f842e-de43-49e8-bac1-841c068cd825,29,pending
5df3f890-e503-44ef-9939-a8abb289263e,e715b7b5-254e-4fcd-8fbe-422e85530b9f,2,3,Corrupti inventore voluptate est asperiores distinctio asperiores. Dolore dignissimos alias labore ducimus facilis cumque. Sed non occaecati quaerat architecto.,0be6de08-e223-44a4-afaa-08a26d4c02f8,832f842e-de43-49e8-bac1-841c068cd825,24,pending
171d26ad-3afc-4bc7-9c4e-da7125956f54,e715b7b5-254e-4fcd-8fbe-422e85530b9f,3,3,Sed earum repudiandae vero rem. Vitae debitis repellat nihil nihil suscipit. Animi mollitia vel perferendis eaque magnam. Quia eveniet ex quidem harum consequuntur quod.,e56d59cb-4b0d-4801-a31d-f8fcd0221b80,832f842e-de43-49e8-bac1-841c068cd825,23,pending
6045c095-c49d-4537-b378-1620120f8254,e715b7b5-254e-4fcd-8fbe-422e85530b9f,4,3,Quis nostrum minima ratione eum libero. Quisquam voluptate officiis ipsam officia nostrum ullam optio. Dolorum molestias praesentium totam.,b4833cae-0b1e-4d91-a04f-c161ec8933be,832f842e-de43-49e8-bac1-841c068cd825,13,pending
fffb5d39-fa40-4e9b-84ea-fb7c984c5bc0,e715b7b5-254e-4fcd-8fbe-422e85530b9f,4,3,"Earum fuga soluta quos voluptatibus quis sint. Tenetur quos ad fugiat quam debitis.
Aperiam doloribus quibusdam inventore ullam id repudiandae consectetur. Dignissimos vero occaecati earum.",2f9c88c6-19d4-4e4f-a782-05164883ba36,832f842e-de43-49e8-bac1-841c068cd825,0,pending
c42f6a53-47e0-4234-bf63-7bb841ada2c8,e715b7b5-254e-4fcd-8fbe-422e85530b9f,3,3,Sed corrupti voluptatum recusandae non a quis. Fuga odit eum consequatur aut asperiores alias. Voluptatum ab blanditiis optio suscipit. Ex odit laboriosam alias minima doloribus.,94fa4429-b772-4efa-a345-17266a923b6a,832f842e-de43-49e8-bac1-841c068cd825,16,pending
