event_address,event_id,event_start_date,event_start_time,pickup_zip_code,user_id,journey_id,journey_empty_spaces,journey_car,journey_text,journey_date,journey_start_time
"Xaver-Fuhr-Straße 101, 68163 Mannheim",2ab60824-b539-4a1f-ae1a-f7d94d2d55bb,2020-04-04,19:00:00,17375,0553f8b8-233a-4507-bab9-36d7e0b58ed8,93aef28c-0e36-4c8d-b61c-1da0f2a0f114,4,Ferrari,Assumenda odit neque quo explicabo perferendis. Harum similique quasi nesciunt adipisci atque. Veritatis mollitia expedita rerum.,2020-04-04,03:20:30
"Rheinlanddamm 200, 44139 Dortmund",7be626b0-c1cd-4a26-a111-60afb13ba940,2020-04-30,17:00:00,39393,274428fb-b51c-42f3-a30a-7bbabfd83f81,6fffc36a-92cf-4a52-b084-b439e78f7d7c,2,Suzuki,Iure aspernatur provident vitae. Recusandae aspernatur nesciunt voluptatem enim. Accusantium quidem amet praesentium tenetur minus dolorem.,2020-04-30,08:41:48
"Mörfelder Landstraße 362, 60528 Frankfurt am Main",e6930b99-e8ca-49f8-9583-89f54366dc14,2020-06-05,20:00:00,84568,4224d3aa-f2f3-48a4-ac0a-98a5c4ef36f1,9677a570-8312-4d1c-bfe2-7f552142ac5e,1,Dodge,"Doloremque tenetur dolorum saepe distinctio. Ducimus aliquam eveniet.
Fuga dolores culpa accusamus reprehenderit eveniet laudantium. Repudiandae itaque ut.",2020-06-05,20:55:49
"Xaver-Fuhr-Straße 101, 68163 Mannheim",2ab60824-b539-4a1f-ae1a-f7d94d2d55bb,2020-04-04,19:00:00,7646,7a6a5ab2-df22-4ebf-ac8b-df06c0fcc43d,bec9d560-49fd-40d2-8798-2ec108ecff2e,1,Lamborghini,"Illo ratione iusto doloribus. Voluptates suscipit minus rerum.
Modi aperiam earum reprehenderit laborum temporibus. Aspernatur facere minus maiores porro.
Quaerat possimus corporis explicabo.",2020-04-04,08:42:13
"Mörfelder Landstraße 362, 60528 Frankfurt am Main",e6930b99-e8ca-49f8-9583-89f54366dc14,2020-06-05,20:00:00,9619,f7ac044a-3dde-4ebf-8d15-bf69e7305b68,f5cc4446-188c-4d7b-bf15-1577fecbfc89,5,Lexus,Aliquid dignissimos velit saepe beatae. Assumenda consectetur cum voluptas eligendi iste consequatur. Placeat voluptatem animi nam.,2020-06-05,02:56:16
"Otto-Flimm-Straße, 53520 Nürburg",eff7e9ae-9c58-42e1-8835-0d51c33dc480,2020-06-05,12:00:00,66879,6ff96d4f-56d0-46be-a2e5-a0be0b900886,4e830bee-2d67-4b55-8adc-edb81b838878,1,Tesla,Unde veniam quia enim vitae. Sequi veniam veritatis reiciendis minima et. Voluptates libero nobis mollitia fugit.,2020-06-05,15:42:55
"Otto-Flimm-Straße, 53520 Nürburg",eff7e9ae-9c58-42e1-8835-0d51c33dc480,2020-06-05,12:00:00,64665,2298de27-85af-4050-81d5-803a77ee8585,2300e2bf-3525-4fb8-8909-d347aef38884,3,Toyota,"Ipsam ab dolorem explicabo aspernatur. Eius at dolores nulla odit. Voluptas blanditiis voluptate minima.
Aliquam rerum id illum aperiam doloribus. Vitae cum recusandae.",2020-06-05,03:08:57
"Xaver-Fuhr-Straße 101, 68163 Mannheim",2ab60824-b539-4a1f-ae1a-f7d94d2d55bb,2020-04-04,19:00:00,83364,3c8c8503-7bc9-4991-8dfd-c11ed29fecf1,0eda9a14-4855-4f2b-9b73-4af5ec1d9359,4,Jeep,Hic omnis nam sit nobis. Eaque perspiciatis molestias sed vero quia qui. Tenetur odio deleniti voluptatem nemo voluptate.,2020-04-04,23:49:41
"Mörfelder Landstraße 362, 60528 Frankfurt am Main",e6930b99-e8ca-49f8-9583-89f54366dc14,2020-06-05,20:00:00,71144,93685f30-f13a-4d7c-9d17-67f75ed1fa6a,33d5b164-faf6-4499-8e5a-2c9bf21d49f2,4,Maserati,"Id ipsa earum nam sit aliquid.
Magni atque est facilis vero corrupti veniam. Libero reprehenderit adipisci deleniti reiciendis occaecati natus.",2020-06-05,09:34:55
"Rheinlanddamm 200, 44139 Dortmund",7be626b0-c1cd-4a26-a111-60afb13ba940,2020-04-30,17:00:00,9116,de6890e2-e3fa-4776-bf10-a9cfedbee9c0,22bc888d-b4d6-4a6c-87e8-fa8b13711fad,2,Infiniti,Soluta praesentium animi voluptatem reprehenderit. Quod quod totam vitae quibusdam perferendis. Quasi id officia tempora molestias adipisci expedita.,2020-04-30,11:16:59
"Mörfelder Landstraße 362, 60528 Frankfurt am Main",e6930b99-e8ca-49f8-9583-89f54366dc14,2020-06-05,20:00:00,29303,55c7a81d-2e4e-4356-be03-82034b2edbaf,c5d6e316-ff95-42ae-a520-85d3c2cb573e,1,Lexus,Provident nostrum consequatur aliquid necessitatibus tempore expedita. Modi ex aliquid nulla nam ullam. Ipsam eligendi eligendi.,2020-06-05,09:52:55
"Xaver-Fuhr-Straße 101, 68163 Mannheim",2ab60824-b539-4a1f-ae1a-f7d94d2d55bb,2020-04-04,19:00:00,53115,3ef5c93b-c710-43ba-ae0d-6ef1480edbf5,16915e9b-a44a-469c-a114-b8f7d2a97761,2,Audi,Natus eos adipisci. Velit omnis laudantium eveniet delectus placeat. Sunt laborum nobis eius.,2020-04-04,18:37:48
"Mörfelder Landstraße 362, 60528 Frankfurt am Main",e6930b99-e8ca-49f8-9583-89f54366dc14,2020-06-05,20:00:00,83552,5875c038-ddef-46d6-8b9c-50ff77a18009,83bcf81f-3255-409e-91ca-36cf77302b80,4,Saab,"Laborum perferendis corrupti laborum hic nisi. Illo in hic. Repellendus aperiam sapiente.
Recusandae fuga voluptatum voluptas. Suscipit architecto deleniti non. Architecto non illo cumque.",2020-06-05,03:14:59
"Otto-Flimm-Straße, 53520 Nürburg",eff7e9ae-9c58-42e1-8835-0d51c33dc480,2020-06-05,12:00:00,99994,457a1681-cf3a-4324-b80d-f14d31d7e6c7,2a6534c7-f295-4c81-848f-54bb58c63b19,4,Mazda,Vel deserunt reiciendis error molestiae rem natus. Itaque illo aliquid dolor aut magnam exercitationem. Error quaerat fuga et ea quae dolore ut.,2020-06-05,04:33:15
"Xaver-Fuhr-Straße 101, 68163 Mannheim",2ab60824-b539-4a1f-ae1a-f7d94d2d55bb,2020-04-04,19:00:00,23923,077ee531-2537-4734-bae6-89c998da89cc,04710558-afcf-4b44-b125-dde6f788dd4a,4,Suzuki,"Dolore necessitatibus facilis ducimus. Quos ipsam officia id incidunt ea.
Excepturi tempora distinctio totam optio fugiat. Deserunt consequuntur eius aut. Laboriosam non quae.",2020-04-04,18:47:03
"Rheinlanddamm 200, 44139 Dortmund",7be626b0-c1cd-4a26-a111-60afb13ba940,2020-04-30,17:00:00,76726,7e465889-2af8-43ad-95e7-dee5719d442b,00ab4198-c99e-43b7-b970-df56e0191598,5,Volvo,"Minima debitis eligendi quod quidem saepe ipsum. Sapiente et occaecati ad non at labore. Delectus laboriosam quas omnis eligendi.
Culpa autem adipisci quidem. Eveniet et expedita sit.",2020-04-30,12:12:18
"Otto-Flimm-Straße, 53520 Nürburg",eff7e9ae-9c58-42e1-8835-0d51c33dc480,2020-06-05,12:00:00,57638,2a1a872a-f04a-4505-a09d-166abb66af03,1ffe607c-e46f-4d35-a5b8-7544412eaef2,2,Lamborghini,Placeat eum eveniet fuga dolorem. Iusto quia blanditiis in non nobis voluptate saepe. Sit rerum magnam ducimus. Vero similique vero porro neque accusamus reprehenderit.,2020-06-05,23:01:24
"Mörfelder Landstraße 362, 60528 Frankfurt am Main",e6930b99-e8ca-49f8-9583-89f54366dc14,2020-06-05,20:00:00,4683,59f930a1-5582-449e-8b7d-edda5ffd6573,d7c38134-3a77-4635-abc8-3cfc75f04cb0,3,Hyundai,Cupiditate non nihil. Iste voluptate adipisci adipisci.,2020-06-05,13:17:27
"Otto-Flimm-Straße, 53520 Nürburg",eff7e9ae-9c58-42e1-8835-0d51c33dc480,2020-06-05,12:00:00,97633,457a1681-cf3a-4324-b80d-f14d31d7e6c7,393200d1-aa12-4b42-a867-3ed126ecd0d2,2,McLaren,"Neque quasi dolore. Voluptatem eos repellendus incidunt doloremque ab. Ducimus possimus ipsa est nulla. Explicabo iusto ullam.
Nesciunt architecto atque officiis optio.",2020-06-05,18:47:05
"Xaver-Fuhr-Straße 101, 68163 Mannheim",2ab60824-b539-4a1f-ae1a-f7d94d2d55bb,2020-04-04,19:00:00,75438,5875c038-ddef-46d6-8b9c-50ff77a18009,a9cd9018-0122-4e82-bd93-e3594b50630d,1,Maserati,Laudantium velit cupiditate officiis. Sed facere beatae animi quisquam in et. Delectus officiis iure totam quas quod quidem.,2020-04-04,18:21:47
"Xaver-Fuhr-Straße 101, 68163 Mannheim",2ab60824-b539-4a1f-ae1a-f7d94d2d55bb,2020-04-04,19:00:00,73107,0553f8b8-233a-4507-bab9-36d7e0b58ed8,0221eed1-b4db-4481-b8b5-089cdd5c98e1,4,Citroën,"Quidem corrupti voluptate at. Id nostrum perspiciatis libero voluptates assumenda delectus autem. Impedit minus voluptas.
Aperiam eos hic animi atque enim saepe nobis. Non modi qui enim expedita.",2020-04-04,19:29:39
"Otto-Flimm-Straße, 53520 Nürburg",eff7e9ae-9c58-42e1-8835-0d51c33dc480,2020-06-05,12:00:00,86739,026ea82d-32a0-4618-b792-150640dea4a3,8786facf-8ff9-4859-953e-a01fe8bced8f,3,Seat,Vel consequatur dicta itaque facilis. Iste earum a beatae sunt explicabo.,2020-06-05,12:36:10
"Rheinlanddamm 200, 44139 Dortmund",7be626b0-c1cd-4a26-a111-60afb13ba940,2020-04-30,17:00:00,34628,3c8c8503-7bc9-4991-8dfd-c11ed29fecf1,71966230-f0b9-4ec9-ac61-2483419f4801,3,McLaren,Aliquid quidem aliquam consectetur officiis. Rem quis enim in ratione doloremque tempora ipsum.,2020-04-30,20:24:09
"Xaver-Fuhr-Straße 101, 68163 Mannheim",2ab60824-b539-4a1f-ae1a-f7d94d2d55bb,2020-04-04,19:00:00,84553,7b3ae5fd-286e-40d1-a73f-24dcaa036fff,aadf21d7-cd68-4365-bde7-edb7f456b4d3,1,Tesla,"Vel fugiat temporibus exercitationem voluptatem. Veritatis deserunt ullam ut excepturi temporibus. Nisi cum officia.
Eos fugiat commodi fuga. Dicta vitae rem eos dolor doloremque mollitia et.",2020-04-04,05:30:34
"Otto-Flimm-Straße, 53520 Nürburg",eff7e9ae-9c58-42e1-8835-0d51c33dc480,2020-06-05,12:00:00,70825,98776c4f-0b70-403a-972e-da3df6cc26c8,678c824b-0862-4c23-95e1-deeb42d18d60,5,Toyota,Dolorem voluptas iste vitae tempore blanditiis. Est nemo consequatur quaerat odio. Repellat distinctio corporis nostrum.,2020-06-05,21:52:51
"Mörfelder Landstraße 362, 60528 Frankfurt am Main",e6930b99-e8ca-49f8-9583-89f54366dc14,2020-06-05,20:00:00,18236,da6217c3-d4a0-4969-b1c3-884928fce8aa,685c8665-ec44-4d55-b219-985eadc0d7e8,3,Ford,"Nemo optio facere sed quaerat rerum. Laboriosam adipisci incidunt facere vero iste.
Aliquam illo eum numquam fugit vitae. Nesciunt fugit quam debitis. Est minus earum aut similique iste sit quasi.",2020-06-05,06:01:46
"Otto-Flimm-Straße, 53520 Nürburg",eff7e9ae-9c58-42e1-8835-0d51c33dc480,2020-06-05,12:00:00,55595,c9f42e65-48b5-410d-b07e-78aad9bbf7ca,67ec8192-60a7-497e-bc6e-53e02499b91c,2,Maybach,"Sapiente voluptatum nam incidunt. Fuga accusamus similique doloremque libero officia eos. Deleniti cupiditate placeat laudantium.
Distinctio tenetur officiis dignissimos dolores. Sequi dicta fugit.",2020-06-05,09:14:32
"Otto-Flimm-Straße, 53520 Nürburg",eff7e9ae-9c58-42e1-8835-0d51c33dc480,2020-06-05,12:00:00,90411,a8b5a5c4-777d-4cbd-907e-2b1ea0f18213,60217879-df2b-4116-8b0d-d5d9a8719de2,4,Iveco,Eum esse pariatur sequi ab. Nostrum quia tenetur praesentium minus. Iusto repellendus beatae impedit ab qui magni ipsam.,2020-06-05,01:52:35
"Rheinlanddamm 200, 44139 Dortmund",7be626b0-c1cd-4a26-a111-60afb13ba940,2020-04-30,17:00:00,92637,980df95d-4535-450f-9176-cdfd635c951f,2d5169ab-f579-47a7-b01c-a9da673e24e4,3,Chrysler,Necessitatibus dolores culpa nobis eum rem mollitia. Modi dolores ipsam cum vero itaque. Soluta tempora sint fugit maiores.,2020-04-30,13:49:02
"Otto-Flimm-Straße, 53520 Nürburg",eff7e9ae-9c58-42e1-8835-0d51c33dc480,2020-06-05,12:00:00,57537,589e66c7-bfaa-46d6-8e96-0433a159324b,dd2b58fa-c5ce-493c-8c78-e2512852e813,1,Jaguar,"Ducimus saepe reiciendis at neque. Minus fugit praesentium fugiat veniam quo.
Amet illo recusandae. Quas necessitatibus sapiente quibusdam a quod fugit tempora. Adipisci repudiandae porro unde.",2020-06-05,17:43:11
"Xaver-Fuhr-Straße 101, 68163 Mannheim",2ab60824-b539-4a1f-ae1a-f7d94d2d55bb,2020-04-04,19:00:00,17291,a5c245ef-f903-44ae-9252-4619eb7bd52d,be8da10b-18ea-4ff1-9388-415b5822f7d9,2,Lada,Exercitationem ducimus consequatur impedit nulla cumque. Maiores deserunt itaque provident nam. In mollitia fuga explicabo quaerat illum eum.,2020-04-04,00:35:03
"Mörfelder Landstraße 362, 60528 Frankfurt am Main",e6930b99-e8ca-49f8-9583-89f54366dc14,2020-06-05,20:00:00,4571,b3a37c80-d6c5-4cd5-8623-17342d44c310,e1cc844d-392c-43bc-8746-10ed758fadbd,4,McLaren,Excepturi consequuntur praesentium saepe quaerat quisquam excepturi. Eos incidunt labore maxime quos.,2020-06-05,20:59:16
"Rheinlanddamm 200, 44139 Dortmund",7be626b0-c1cd-4a26-a111-60afb13ba940,2020-04-30,17:00:00,72184,93685f30-f13a-4d7c-9d17-67f75ed1fa6a,7d6b8eed-03f0-4e99-a179-018ddd842595,1,Abarth,Numquam quidem consectetur quibusdam nobis id. Omnis magnam enim debitis expedita explicabo repellendus nesciunt.,2020-04-30,05:50:36
"Xaver-Fuhr-Straße 101, 68163 Mannheim",2ab60824-b539-4a1f-ae1a-f7d94d2d55bb,2020-04-04,19:00:00,74376,98776c4f-0b70-403a-972e-da3df6cc26c8,0da2e895-d7af-4e12-b5e4-19c913880c53,2,Tesla,Veritatis similique assumenda harum nesciunt fugit. Dignissimos rem accusamus vel error quis corporis.,2020-04-04,08:12:51
"Rheinlanddamm 200, 44139 Dortmund",7be626b0-c1cd-4a26-a111-60afb13ba940,2020-04-30,17:00:00,54470,534db7fe-5988-4bc8-8061-b398b75090b8,72b2c0fa-37e1-4874-8095-1a619aa60e36,4,Iveco,Ipsam esse repudiandae. Occaecati delectus non aperiam voluptas tempora beatae. Ex nemo minus possimus expedita iusto.,2020-04-30,02:17:44
"Otto-Flimm-Straße, 53520 Nürburg",eff7e9ae-9c58-42e1-8835-0d51c33dc480,2020-06-05,12:00:00,22889,6c2d4155-3b6f-4de3-8e5c-3651d10ab1d2,bdb126f6-c04c-402e-9d40-d35b43172629,1,Rover,"Ipsam vitae itaque aspernatur suscipit ipsum porro. Ab voluptatibus porro quae repudiandae inventore porro.
Temporibus officiis quod atque. Aliquid ex voluptatem voluptates enim.",2020-06-05,19:54:29
"Rheinlanddamm 200, 44139 Dortmund",7be626b0-c1cd-4a26-a111-60afb13ba940,2020-04-30,17:00:00,29478,338e482b-5a91-4386-8a56-0e81bfb7ed91,a4dd0708-f69e-4d02-8e6d-9fcf66a9ab42,4,Aston Martin,Sit molestias quaerat ratione. Reiciendis delectus quod nesciunt cupiditate. Numquam fugiat excepturi vero.,2020-04-30,05:54:46
"Rheinlanddamm 200, 44139 Dortmund",7be626b0-c1cd-4a26-a111-60afb13ba940,2020-04-30,17:00:00,92665,7a231bd9-dda9-4a28-ab65-2e5f2e1d4e11,dc8d0195-b656-420d-862a-3990e0408883,5,Rolls-Royce,Consectetur in saepe fugit odit. Et eligendi consectetur quos sit. Soluta dignissimos doloremque quod dicta soluta.,2020-04-30,21:46:29
"Xaver-Fuhr-Straße 101, 68163 Mannheim",2ab60824-b539-4a1f-ae1a-f7d94d2d55bb,2020-04-04,19:00:00,25845,14b87cf2-c595-4e2f-84d1-40cafcf9dd76,ea55435d-2a4a-4e35-8df2-c19fb8ac053e,4,Audi,Veritatis facere repudiandae reprehenderit sunt cupiditate. Aperiam dolorem molestiae.,2020-04-04,18:42:17
"Mörfelder Landstraße 362, 60528 Frankfurt am Main",e6930b99-e8ca-49f8-9583-89f54366dc14,2020-06-05,20:00:00,82497,f0158fac-4fba-4fbd-915f-5ff92f9b082e,9c72f3ea-d58c-474c-a248-93752299b140,5,Jeep,Ipsum quo nam amet ipsum accusantium facilis. Animi vero deserunt tempore. Eaque rerum nemo veritatis.,2020-06-05,09:47:31
"Rheinlanddamm 200, 44139 Dortmund",7be626b0-c1cd-4a26-a111-60afb13ba940,2020-04-30,17:00:00,25489,12161938-5870-452f-a7b1-a20c8ee4e67d,86dfd3fd-32f1-4b86-b5b3-6012901a259c,4,Saab,Quia veniam ea facere quam nobis perspiciatis. Debitis laboriosam aliquam. Dignissimos accusantium necessitatibus adipisci incidunt tenetur sit. Architecto occaecati quae neque eos velit.,2020-04-30,06:38:53
"Rheinlanddamm 200, 44139 Dortmund",7be626b0-c1cd-4a26-a111-60afb13ba940,2020-04-30,17:00:00,25585,bdd4a3ae-0585-44dc-9253-c1575dd920f6,9b67ff93-2902-4831-851e-53820e22befc,3,MG,Assumenda libero explicabo deleniti enim quidem. Provident tempore numquam assumenda suscipit placeat nulla. Iste placeat eaque ipsum consequatur explicabo.,2020-04-30,07:08:52
"Otto-Flimm-Straße, 53520 Nürburg",eff7e9ae-9c58-42e1-8835-0d51c33dc480,2020-06-05,12:00:00,15320,da6217c3-d4a0-4969-b1c3-884928fce8aa,3f9e4917-f942-4b3c-9b26-15f52fe0f2ac,5,Fisker,"Sunt rerum ab dolorem saepe. Qui inventore voluptatem harum magni quisquam. Quos neque laborum totam enim neque saepe.
Ducimus velit necessitatibus ad.",2020-06-05,18:53:12
"Mörfelder Landstraße 362, 60528 Frankfurt am Main",e6930b99-e8ca-49f8-9583-89f54366dc14,2020-06-05,20:00:00,8393,9b49f405-1570-4944-880c-7b11e52344e8,8aa5498b-2b0a-4cea-ab8a-1ce1a2f7451e,5,Lotus,"Expedita dolorem incidunt adipisci odio fugiat saepe. Impedit libero aspernatur mollitia. Perferendis nesciunt eos ipsam illo.
Consequuntur totam aperiam. Ex incidunt aliquid totam hic.",2020-06-05,23:32:07
"Otto-Flimm-Straße, 53520 Nürburg",eff7e9ae-9c58-42e1-8835-0d51c33dc480,2020-06-05,12:00:00,16259,66af6138-0563-48d9-bf2c-f72c1dfd57d7,c8fcce57-08d8-4a07-876d-c7746d244243,2,Toyota,"Nam sunt magni temporibus nesciunt nulla. Incidunt ipsam cum corporis expedita.
Blanditiis cumque reiciendis fugiat corrupti. Voluptatum delectus veritatis cum iusto sunt.",2020-06-05,14:37:34
"Otto-Flimm-Straße, 53520 Nürburg",eff7e9ae-9c58-42e1-8835-0d51c33dc480,2020-06-05,12:00:00,84513,af6ae583-d2af-4b91-809f-687ffe7be169,b088b75d-fd7a-42f5-a1ac-04c8194b08b8,2,McLaren,"Voluptas at recusandae vitae. Consequatur ut eum cum perferendis alias delectus.
Id ullam inventore in voluptates vero. Aperiam cumque fugit mollitia inventore cupiditate.",2020-06-05,05:26:33
"Rheinlanddamm 200, 44139 Dortmund",7be626b0-c1cd-4a26-a111-60afb13ba940,2020-04-30,17:00:00,60486,0190ec19-de31-4488-bb8a-94842364e0f2,49b8d11c-07ef-49d5-ab5c-3c1ae7f2b29f,1,Dacia,"Facilis ipsa voluptas dicta. Delectus atque debitis rerum suscipit.
Exercitationem ad numquam eaque ea veniam eligendi. Maxime saepe velit omnis eveniet veniam qui.",2020-04-30,19:08:48
"Otto-Flimm-Straße, 53520 Nürburg",eff7e9ae-9c58-42e1-8835-0d51c33dc480,2020-06-05,12:00:00,67724,1baf96a1-55d7-468b-abbe-5bc30116be1d,27859841-c1c4-473a-9f19-1e827047b307,2,Kia,Repellat eius fuga mollitia iste ex explicabo. Animi ipsum ipsam consequatur asperiores quibusdam recusandae cum.,2020-06-05,10:43:49
"Mörfelder Landstraße 362, 60528 Frankfurt am Main",e6930b99-e8ca-49f8-9583-89f54366dc14,2020-06-05,20:00:00,54317,59f930a1-5582-449e-8b7d-edda5ffd6573,4ac67d93-65de-49bb-8aec-dbd39c117035,2,Rover,"Eius blanditiis iste dolor. Maiores assumenda officiis quas ullam.
Inventore tempora saepe occaecati repudiandae iure odio. Ipsam quidem corrupti error temporibus voluptatibus deleniti.",2020-06-05,01:37:02
"Otto-Flimm-Straße, 53520 Nürburg",eff7e9ae-9c58-42e1-8835-0d51c33dc480,2020-06-05,12:00:00,7616,2448380d-cfe7-4e57-86dd-1f87c65a154f,9a67c980-e144-4861-bbe4-2f35506995ef,1,Iveco,Quia praesentium cumque animi quisquam. Sequi doloremque culpa cumque tempore. Iusto provident sint doloremque consequatur voluptatem.,2020-06-05,20:36:35
"Xaver-Fuhr-Straße 101, 68163 Mannheim",2ab60824-b539-4a1f-ae1a-f7d94d2d55bb,2020-04-04,19:00:00,1594,a13c233a-2e0d-495e-a360-775e956efba5,477c9b13-c988-482e-b8ff-2a840d3397ad,1,Bentley,Eum repudiandae voluptates accusantium nostrum facilis quas. Repudiandae dolore amet distinctio sed.,2020-04-04,19:18:42
"Otto-Flimm-Straße, 53520 Nürburg",eff7e9ae-9c58-42e1-8835-0d51c33dc480,2020-06-05,12:00:00,72669,4bbbac5e-850c-46cd-bc5d-5fe77e9b55e8,f2c3320d-3891-42e2-9b7f-e14ce1ddcc23,4,Saab,Ex voluptatum ex expedita. Quisquam voluptas odit eius vel.,2020-06-05,09:17:05
"Rheinlanddamm 200, 44139 Dortmund",7be626b0-c1cd-4a26-a111-60afb13ba940,2020-04-30,17:00:00,66882,6c2d4155-3b6f-4de3-8e5c-3651d10ab1d2,a19a2808-1853-447a-a05b-0ad3a15740c0,1,McLaren,"Officiis odit dolore at reprehenderit. Eligendi laboriosam vero iure. Odio eveniet dicta doloremque.
Dolore maxime quis debitis sunt. Laborum ea doloribus eligendi in.",2020-04-30,10:37:33
"Otto-Flimm-Straße, 53520 Nürburg",eff7e9ae-9c58-42e1-8835-0d51c33dc480,2020-06-05,12:00:00,22179,7a6a5ab2-df22-4ebf-ac8b-df06c0fcc43d,92148250-36aa-46bb-8f73-38df7c9bcc99,5,Audi,Culpa dicta iure soluta blanditiis. Commodi harum quibusdam nostrum illum. Minima voluptate animi amet repudiandae.,2020-06-05,01:32:45
"Rheinlanddamm 200, 44139 Dortmund",7be626b0-c1cd-4a26-a111-60afb13ba940,2020-04-30,17:00:00,24214,2448380d-cfe7-4e57-86dd-1f87c65a154f,cb27903d-4984-4484-a12c-89b433a7e94f,3,Lotus,"Magnam maiores amet veniam. Excepturi iste ab delectus. Quam doloribus necessitatibus quod atque.
Iure ipsum voluptas eaque illo aliquid voluptatem non. Ut corrupti veritatis dicta harum quasi minus.",2020-04-30,10:39:08
"Mörfelder Landstraße 362, 60528 Frankfurt am Main",e6930b99-e8ca-49f8-9583-89f54366dc14,2020-06-05,20:00:00,58579,da6217c3-d4a0-4969-b1c3-884928fce8aa,ab64164a-7443-4384-862f-c836a35e7d37,2,Bentley,Sequi ratione ipsam consectetur dolorum. Excepturi atque magni necessitatibus necessitatibus similique. Perspiciatis reprehenderit pariatur incidunt iure doloremque.,2020-06-05,15:02:34
"Xaver-Fuhr-Straße 101, 68163 Mannheim",2ab60824-b539-4a1f-ae1a-f7d94d2d55bb,2020-04-04,19:00:00,7607,418cff41-c967-4be5-b466-86b98ee23bbb,881720c1-a4f5-4803-9408-ca77153702b6,2,Morgan,Animi nisi corrupti vero hic fugiat vero sint. Alias doloribus iure nemo sequi deserunt incidunt. Occaecati est quia quidem cum.,2020-04-04,14:28:33
"Rheinlanddamm 200, 44139 Dortmund",7be626b0-c1cd-4a26-a111-60afb13ba940,2020-04-30,17:00:00,24217,fb645b0e-2b94-485e-8723-74654c5f7c4f,a6d783f8-cd10-430b-97ae-cb15d3c96a08,3,Maserati,"Ratione expedita mollitia facere magni placeat. Illum nulla id officiis inventore.
Expedita accusamus reiciendis nisi. Sapiente laudantium ut. Nihil molestiae in est doloremque.",2020-04-30,06:21:33
"Rheinlanddamm 200, 44139 Dortmund",7be626b0-c1cd-4a26-a111-60afb13ba940,2020-04-30,17:00:00,39356,bdd4a3ae-0585-44dc-9253-c1575dd920f6,68677097-2971-4569-9b4f-c90e6eed013c,1,Land Rover,Magnam eaque a consectetur voluptas quas. Soluta maxime nobis quasi voluptatum dicta. Officia a ea.,2020-04-30,03:37:29
"Mörfelder Landstraße 362, 60528 Frankfurt am Main",e6930b99-e8ca-49f8-9583-89f54366dc14,2020-06-05,20:00:00,44229,2a1a872a-f04a-4505-a09d-166abb66af03,6b820536-2528-4b28-9a3f-3858affd8e82,2,Renault,"Odio mollitia distinctio voluptatibus fuga cum reiciendis soluta. Officiis placeat quasi labore.
Sequi asperiores nostrum sit blanditiis enim corporis. Eum deserunt autem.",2020-06-05,17:05:01
"Xaver-Fuhr-Straße 101, 68163 Mannheim",2ab60824-b539-4a1f-ae1a-f7d94d2d55bb,2020-04-04,19:00:00,91443,24574fdb-c314-44b6-a9a1-8e9acdfd6343,39766525-a733-43d6-8b68-72361ef71a7a,4,Lexus,"Esse voluptas quidem architecto. Dignissimos deleniti rem repellat nulla.
Quasi mollitia sit necessitatibus enim. Sint id itaque inventore temporibus.",2020-04-04,10:31:37
"Otto-Flimm-Straße, 53520 Nürburg",eff7e9ae-9c58-42e1-8835-0d51c33dc480,2020-06-05,12:00:00,23911,6dc96739-a869-48b7-8ddc-59de818437b5,c90ff184-2dba-4348-8279-5ae5a6d2a092,5,Mini,"Illum tempore hic distinctio eos fugit harum. Ab optio quia.
Nostrum incidunt illo repellat sequi doloribus aspernatur explicabo. Voluptatibus quam sequi saepe tempore autem.",2020-06-05,06:18:53
"Mörfelder Landstraße 362, 60528 Frankfurt am Main",e6930b99-e8ca-49f8-9583-89f54366dc14,2020-06-05,20:00:00,75057,5447ef80-d3c7-4752-8224-2e062978205e,44e53871-c8a9-4343-9192-593cf57369fb,4,McLaren,"Laboriosam est qui voluptates repudiandae quaerat odit.
A reiciendis neque delectus consequatur. Blanditiis est porro nemo repellendus tempore eaque.",2020-06-05,19:40:50
"Rheinlanddamm 200, 44139 Dortmund",7be626b0-c1cd-4a26-a111-60afb13ba940,2020-04-30,17:00:00,91241,838277b3-488d-4b89-8ad3-7a49526a86ca,247ce422-f6da-483d-92c9-95f95fb95eec,1,KTM,Ratione alias aspernatur alias reiciendis possimus. Ea ipsa nulla ab. Fugit labore eius vero cum exercitationem. Adipisci sequi asperiores sunt perferendis mollitia esse.,2020-04-30,20:40:52
"Mörfelder Landstraße 362, 60528 Frankfurt am Main",e6930b99-e8ca-49f8-9583-89f54366dc14,2020-06-05,20:00:00,6556,2d1db158-19f2-4799-9c43-584a170ab2dc,d143e062-5210-497a-beb5-a557bbc1ab80,2,SsangYong,Dicta esse adipisci quae in eos ipsam recusandae. Corrupti autem corporis iusto at. Perferendis adipisci doloremque illum quisquam ipsum culpa. Repudiandae voluptas amet tempora dignissimos beatae.,2020-06-05,11:19:50
"Xaver-Fuhr-Straße 101, 68163 Mannheim",2ab60824-b539-4a1f-ae1a-f7d94d2d55bb,2020-04-04,19:00:00,16928,ec28d9a1-3c2d-4dd7-8cb9-db3fb68b0520,d28f508b-fc08-47e2-b035-f091e884830e,4,Volvo,Repudiandae ipsa sit. Animi odio delectus totam. Error consectetur quo. Rem iste vel reprehenderit quidem doloribus a.,2020-04-04,15:45:40
"Otto-Flimm-Straße, 53520 Nürburg",eff7e9ae-9c58-42e1-8835-0d51c33dc480,2020-06-05,12:00:00,82065,7a231bd9-dda9-4a28-ab65-2e5f2e1d4e11,3dfe6b59-4768-4613-9c6e-183c69cb7048,1,Citroën,Debitis sit maxime pariatur eos vero temporibus nisi. Est quos vero eos. Nemo error recusandae autem occaecati. Esse asperiores enim itaque numquam ratione totam.,2020-06-05,19:52:23
"Xaver-Fuhr-Straße 101, 68163 Mannheim",2ab60824-b539-4a1f-ae1a-f7d94d2d55bb,2020-04-04,19:00:00,16775,7420515d-69fd-446f-90b6-221ed7034c1f,bdca136d-6c37-40c5-9db0-e3eb7b60fe1e,4,Daewoo,Sapiente at voluptates debitis nihil corrupti fugit. Amet ullam occaecati unde corrupti magni.,2020-04-04,12:22:12
"Rheinlanddamm 200, 44139 Dortmund",7be626b0-c1cd-4a26-a111-60afb13ba940,2020-04-30,17:00:00,85229,494bcc9c-8a0b-4a64-aef4-4686aa65b0e1,4eccd413-f565-4d70-9fdd-96619e8c285d,2,McLaren,"Similique aliquid asperiores sunt dolor.
At harum repellat commodi ipsam tempore deleniti. Possimus rem ipsam quae quos.",2020-04-30,16:20:56
"Mörfelder Landstraße 362, 60528 Frankfurt am Main",e6930b99-e8ca-49f8-9583-89f54366dc14,2020-06-05,20:00:00,89188,838277b3-488d-4b89-8ad3-7a49526a86ca,fda6c230-f566-42c1-8c75-077193dbf40d,3,Volkswagen,Tenetur placeat voluptatum exercitationem a molestias dolorem. Tempora doloremque nostrum. Eum animi rem maxime saepe tempore. Perferendis consectetur fugiat vel sed.,2020-06-05,23:02:33
"Mörfelder Landstraße 362, 60528 Frankfurt am Main",e6930b99-e8ca-49f8-9583-89f54366dc14,2020-06-05,20:00:00,96197,7b3ae5fd-286e-40d1-a73f-24dcaa036fff,18506330-ec62-4164-8f11-672ec394c656,2,Mini,Voluptates provident sint mollitia. Natus eligendi excepturi nulla id quidem nihil. Dignissimos ex dicta id cum numquam suscipit. Doloribus eaque fugiat tenetur animi sed itaque velit.,2020-06-05,17:33:01
"Xaver-Fuhr-Straße 101, 68163 Mannheim",2ab60824-b539-4a1f-ae1a-f7d94d2d55bb,2020-04-04,19:00:00,91336,6c2d4155-3b6f-4de3-8e5c-3651d10ab1d2,a54e685b-1c32-4343-a3b6-2edf042a5dbd,5,Subaru,"Cumque animi non ipsa exercitationem deleniti voluptatibus. Ea doloremque non velit maxime eum.
Consectetur itaque saepe. Repellat nostrum sed officiis.",2020-04-04,22:02:03
"Otto-Flimm-Straße, 53520 Nürburg",eff7e9ae-9c58-42e1-8835-0d51c33dc480,2020-06-05,12:00:00,76137,838277b3-488d-4b89-8ad3-7a49526a86ca,5839180c-0212-46c0-a254-26f76b977bb2,1,Morgan,Deleniti accusantium deleniti ullam. Reiciendis maiores exercitationem et. Rem reiciendis quas perferendis minima quidem.,2020-06-05,12:46:30
