journey_id,reservation_requested_seats,journey_empty_spaces,reservation_text,user_id,journey_user_id
7870a3f9-4b3f-4b57-b93d-da0b5be87a43,1,1,"In rerum sequi quae. Maiores iste quisquam veritatis culpa totam.
Aliquam adipisci libero repellat explicabo quisquam est. Facere reiciendis expedita animi odio. Laboriosam cupiditate optio in.",5eeb15f3-d3f0-49e3-be8c-ed4779aa1b8f,58d96f87-c364-4582-8e54-76b099a96ccd
199d078e-4afb-4556-844f-e2b27593c5e2,5,5,Ratione accusamus quibusdam inventore aspernatur. Temporibus dignissimos magnam magnam illum autem optio.,92bb9675-a8d3-4562-afad-8d44114bcfe0,ba516a17-7aff-4080-b0ab-5e6da78aa02b
199d078e-4afb-4556-844f-e2b27593c5e2,2,5,"Blanditiis reiciendis doloribus nihil. Doloribus consectetur quas excepturi. Qui similique ab praesentium beatae.
Mollitia in quas illum accusamus. Eum numquam saepe aspernatur illo non.",dbde00fc-a75e-4e2c-a7d3-8231fca194f7,ba516a17-7aff-4080-b0ab-5e6da78aa02b
7870a3f9-4b3f-4b57-b93d-da0b5be87a43,5,1,"Corporis fugit praesentium pariatur eveniet. Non doloribus quo quia rem sit saepe.
A adipisci ut perferendis tempore porro in. Dolor sed laboriosam.",bd9c78bf-7db1-49d5-8479-59bdd48a93bf,58d96f87-c364-4582-8e54-76b099a96ccd
7870a3f9-4b3f-4b57-b93d-da0b5be87a43,2,1,"Quos ipsam deserunt repudiandae quasi. Error porro laboriosam expedita.
Doloribus quasi labore. Velit adipisci repudiandae porro quia id odit. Sed incidunt dolor alias.",3dc7d1f1-8826-4c84-ba93-666594534718,58d96f87-c364-4582-8e54-76b099a96ccd
596a49a7-766d-4166-aebd-9d2551443543,1,5,"Eligendi minima ipsum velit. Architecto quidem voluptatem ratione beatae beatae.
Sequi sit veniam possimus quidem. Iste nemo quasi provident blanditiis nam at.",2f887a39-08f5-4829-b810-627c22b9d722,60a3bcf6-1480-41e2-9c6f-eec7642a0f60
8b18113d-9dc3-4fde-b17b-4f7dc8c7e56f,2,4,Consectetur harum repudiandae facere facere sit. Autem occaecati voluptatibus. Ullam error laudantium culpa at corporis temporibus fuga.,00de9d68-8385-4902-8108-cd8763c3afda,9b70d827-b5eb-4f1a-a22a-bfebe58a5b64
8b18113d-9dc3-4fde-b17b-4f7dc8c7e56f,2,4,Molestias accusamus cumque ad aut commodi. Voluptatum ratione saepe nam nam ad. Atque ad exercitationem corrupti.,8581fab5-bbcf-4ffa-bac5-33e0aed58a93,9b70d827-b5eb-4f1a-a22a-bfebe58a5b64
596a49a7-766d-4166-aebd-9d2551443543,5,5,"Fuga voluptates dolor rerum id harum numquam consectetur.
Velit iste perspiciatis accusamus. Quasi magnam necessitatibus molestias dolor. Voluptate dignissimos eligendi laudantium.",9bedea62-c758-4268-b279-22934532de30,60a3bcf6-1480-41e2-9c6f-eec7642a0f60
8b18113d-9dc3-4fde-b17b-4f7dc8c7e56f,5,4,Illum molestiae accusantium consequatur. Ratione deleniti dignissimos ducimus repellat aperiam. A recusandae amet hic exercitationem.,8c65b6d5-831a-46c6-a72c-784141761a99,9b70d827-b5eb-4f1a-a22a-bfebe58a5b64
596a49a7-766d-4166-aebd-9d2551443543,2,5,Eligendi laudantium neque necessitatibus natus. A expedita velit placeat.,a9c8a41c-b359-4eef-b6f4-0be0a8cc2ce8,60a3bcf6-1480-41e2-9c6f-eec7642a0f60
7870a3f9-4b3f-4b57-b93d-da0b5be87a43,4,1,"Quas nobis laborum consectetur. Recusandae quo excepturi nihil corporis eos voluptatum.
Reprehenderit id error suscipit cum. Alias impedit sint vitae molestias.",3dc7d1f1-8826-4c84-ba93-666594534718,58d96f87-c364-4582-8e54-76b099a96ccd
199d078e-4afb-4556-844f-e2b27593c5e2,5,5,Architecto ratione nisi itaque incidunt. Voluptatem nisi quas. Temporibus nulla accusantium animi maxime veniam.,eef254dc-831a-42ef-9d85-d8e3dff5b720,ba516a17-7aff-4080-b0ab-5e6da78aa02b
596a49a7-766d-4166-aebd-9d2551443543,1,5,"Asperiores eaque deserunt quas asperiores dolore. Itaque quod laborum dolorum officia.
Veritatis animi suscipit aliquid. Non autem autem porro reprehenderit illum.",de362257-35a5-427f-b5be-37f9e41a9d9c,60a3bcf6-1480-41e2-9c6f-eec7642a0f60
7870a3f9-4b3f-4b57-b93d-da0b5be87a43,3,1,"Repellendus cum inventore unde culpa. Dolor illum dolores. Fugit pariatur praesentium.
Asperiores laudantium possimus deserunt dignissimos. Odit alias dolores quidem dolore.",ad357e85-7ea4-48d6-b819-f70d85920d5b,58d96f87-c364-4582-8e54-76b099a96ccd
199d078e-4afb-4556-844f-e2b27593c5e2,4,5,"Quod velit vitae. Aut ducimus sequi a.
Iste quidem pariatur sapiente modi magnam reprehenderit. Facere delectus occaecati corrupti tempora cum ullam.",5d68cdca-0448-479c-ad78-ad2c989d7c9c,ba516a17-7aff-4080-b0ab-5e6da78aa02b
7870a3f9-4b3f-4b57-b93d-da0b5be87a43,1,1,"Odio provident recusandae rem ipsa ex explicabo. Rerum saepe quasi hic in dolor repellendus. Optio voluptatum id quaerat quos quos.
Error laudantium quibusdam et pariatur.",12406f81-487a-4996-806a-e3d18b5cca73,58d96f87-c364-4582-8e54-76b099a96ccd
596a49a7-766d-4166-aebd-9d2551443543,3,5,Ex nesciunt dolorum dolorum iusto. Sequi doloribus nisi eligendi. Vel quibusdam delectus facilis minus.,20d10ad9-dbcc-4f9d-beee-a9bc17e2c89c,60a3bcf6-1480-41e2-9c6f-eec7642a0f60
7870a3f9-4b3f-4b57-b93d-da0b5be87a43,2,1,Cupiditate nemo vel incidunt adipisci velit tempora. Quis sed quas aperiam culpa cum. Perspiciatis accusamus quis molestiae.,de362257-35a5-427f-b5be-37f9e41a9d9c,58d96f87-c364-4582-8e54-76b099a96ccd
199d078e-4afb-4556-844f-e2b27593c5e2,3,5,Deleniti modi recusandae sint deleniti unde similique. Blanditiis sed consectetur earum reiciendis fugit harum. Esse veniam exercitationem tempore.,3a66417f-7d7f-4513-bcfc-b37da3c65740,ba516a17-7aff-4080-b0ab-5e6da78aa02b
596a49a7-766d-4166-aebd-9d2551443543,5,5,Quidem placeat quo possimus. Iusto incidunt voluptate similique deleniti quam in. Libero hic magnam odio.,b05427f0-049f-4c63-b6f7-4274f229ecdd,60a3bcf6-1480-41e2-9c6f-eec7642a0f60
199d078e-4afb-4556-844f-e2b27593c5e2,4,5,"Sed culpa ab optio earum facilis temporibus. Vel ab error consectetur a.
Tempora inventore corrupti deleniti iusto vel laudantium asperiores. Fugiat blanditiis accusamus itaque cumque ullam libero.",e8d0a594-c49a-4a56-bb99-45ebb5c01d4f,ba516a17-7aff-4080-b0ab-5e6da78aa02b
7870a3f9-4b3f-4b57-b93d-da0b5be87a43,5,1,"Vitae minus totam at exercitationem eos delectus.
Nulla doloremque architecto minus fuga incidunt suscipit. Dicta quod tenetur. Voluptatibus commodi dicta assumenda.
Soluta dolorem labore officia.",eef254dc-831a-42ef-9d85-d8e3dff5b720,58d96f87-c364-4582-8e54-76b099a96ccd
199d078e-4afb-4556-844f-e2b27593c5e2,5,5,Officia aperiam ea nulla. Dicta dolorem veritatis.,ec0467f6-711f-4ab3-8ada-f4f136fd7db0,ba516a17-7aff-4080-b0ab-5e6da78aa02b
7870a3f9-4b3f-4b57-b93d-da0b5be87a43,2,1,"Nulla cum quae officiis assumenda.
Repellendus dicta eveniet molestias quaerat in assumenda nostrum. Soluta voluptate impedit accusantium quisquam quas. Beatae ipsum veritatis.",dbde00fc-a75e-4e2c-a7d3-8231fca194f7,58d96f87-c364-4582-8e54-76b099a96ccd
7870a3f9-4b3f-4b57-b93d-da0b5be87a43,1,1,Illum aliquid unde harum modi unde. Facilis maxime hic pariatur nisi. Soluta dolorem blanditiis dignissimos ipsam consectetur.,a7cd15c9-dda8-486d-ba50-48e7c24bf994,58d96f87-c364-4582-8e54-76b099a96ccd
199d078e-4afb-4556-844f-e2b27593c5e2,4,5,"Modi rem mollitia. Eveniet autem mollitia officia quisquam quod nostrum.
Dignissimos vero earum enim aliquid harum reiciendis ipsam. Molestiae animi non ratione incidunt non explicabo.",776220f0-c0f9-4800-9c14-e1fdcfebe78f,ba516a17-7aff-4080-b0ab-5e6da78aa02b
596a49a7-766d-4166-aebd-9d2551443543,3,5,Qui ducimus similique at rerum. Adipisci quam illo distinctio aliquam unde. Enim delectus architecto eius voluptas.,58d96f87-c364-4582-8e54-76b099a96ccd,60a3bcf6-1480-41e2-9c6f-eec7642a0f60
199d078e-4afb-4556-844f-e2b27593c5e2,1,5,Error modi laborum ullam architecto perferendis quae. Perspiciatis in itaque fugiat officiis corporis sequi. Laboriosam eveniet eius error aliquid quas.,b05427f0-049f-4c63-b6f7-4274f229ecdd,ba516a17-7aff-4080-b0ab-5e6da78aa02b
7870a3f9-4b3f-4b57-b93d-da0b5be87a43,4,1,Est quas ea eveniet laudantium nisi. Enim labore sapiente iusto.,c9349e4d-cdcc-4c91-9685-b1728579a9a7,58d96f87-c364-4582-8e54-76b099a96ccd
7870a3f9-4b3f-4b57-b93d-da0b5be87a43,1,1,"Vero facilis sint aspernatur tenetur.
Quas aliquam placeat hic voluptatem corrupti. Modi qui in consequatur at nihil. Excepturi repellat maxime deleniti aspernatur eaque.",49011016-fd7f-431b-a7b4-f7bbf91367a8,58d96f87-c364-4582-8e54-76b099a96ccd
8b18113d-9dc3-4fde-b17b-4f7dc8c7e56f,1,4,Pariatur at tempore quod quia nam. Quos dolor incidunt numquam nemo accusantium modi.,9cdeca80-ad09-415d-9c00-37eda03a913b,9b70d827-b5eb-4f1a-a22a-bfebe58a5b64
199d078e-4afb-4556-844f-e2b27593c5e2,3,5,Explicabo neque explicabo culpa delectus aperiam repellat. Ipsa sequi temporibus culpa facilis autem velit. Eum reiciendis inventore eum sint maiores explicabo.,fae4fe41-3d63-4b32-8ea5-ca523fa8ea63,ba516a17-7aff-4080-b0ab-5e6da78aa02b
596a49a7-766d-4166-aebd-9d2551443543,3,5,Velit distinctio quod. Eligendi accusantium corrupti dolorem voluptates. Commodi voluptate ipsum nesciunt aut.,2050b9dc-7990-4304-a614-26192c3498f9,60a3bcf6-1480-41e2-9c6f-eec7642a0f60
199d078e-4afb-4556-844f-e2b27593c5e2,4,5,"Accusamus illum sed laboriosam error. Placeat illo nobis quisquam nobis nisi beatae.
Quasi recusandae minima dolorem. Vitae ut facere alias ducimus tenetur.",5c0e8357-2b51-44e4-8d43-38f58166be37,ba516a17-7aff-4080-b0ab-5e6da78aa02b
596a49a7-766d-4166-aebd-9d2551443543,1,5,Et quisquam molestiae quo dolor id nostrum tenetur. Iusto magnam laboriosam.,05bd2767-62ae-4992-a1b9-b339b6e37a59,60a3bcf6-1480-41e2-9c6f-eec7642a0f60
7870a3f9-4b3f-4b57-b93d-da0b5be87a43,3,1,"Atque praesentium voluptates eum quos. Repellendus hic vitae architecto.
Accusantium fuga eos. Saepe totam labore commodi vero quas nesciunt repellat.",24c57f2e-222d-4885-be3d-5e1330953e56,58d96f87-c364-4582-8e54-76b099a96ccd
199d078e-4afb-4556-844f-e2b27593c5e2,3,5,Inventore dolorem dolores cupiditate aperiam. In occaecati voluptate nostrum sapiente. Impedit perferendis distinctio cumque id repellendus.,3f898b70-1da0-443a-b11d-6198bfc5b52e,ba516a17-7aff-4080-b0ab-5e6da78aa02b
7870a3f9-4b3f-4b57-b93d-da0b5be87a43,4,1,"Amet totam aut sunt atque cum.
Neque facilis neque non inventore rerum. Eos officia soluta nisi eius ut.
Velit magni porro. Autem aliquid voluptate pariatur.",c9c73437-2299-4f90-9104-c078dd6f3cc4,58d96f87-c364-4582-8e54-76b099a96ccd
596a49a7-766d-4166-aebd-9d2551443543,2,5,Quis in quam officiis repellat repellat quis. Atque odit architecto in adipisci aliquid repellendus.,04399bf4-784c-4ef0-81ce-60afa5b31621,60a3bcf6-1480-41e2-9c6f-eec7642a0f60
8b18113d-9dc3-4fde-b17b-4f7dc8c7e56f,5,4,Temporibus aspernatur commodi cumque fugit ad. Distinctio voluptatum debitis facilis harum impedit. Assumenda maxime similique incidunt mollitia nemo.,4f3c2411-05a3-428e-9f26-166106469564,9b70d827-b5eb-4f1a-a22a-bfebe58a5b64
8b18113d-9dc3-4fde-b17b-4f7dc8c7e56f,4,4,Sed blanditiis nobis eveniet harum. Culpa iusto vero quis minima officia esse ducimus.,3f898b70-1da0-443a-b11d-6198bfc5b52e,9b70d827-b5eb-4f1a-a22a-bfebe58a5b64
7870a3f9-4b3f-4b57-b93d-da0b5be87a43,2,1,"Laboriosam repellendus voluptatibus vel corrupti laudantium laboriosam. Consequatur cupiditate nisi deleniti.
Adipisci optio repudiandae voluptatum.",58d96f87-c364-4582-8e54-76b099a96ccd,58d96f87-c364-4582-8e54-76b099a96ccd
596a49a7-766d-4166-aebd-9d2551443543,5,5,"Natus dolore eos inventore necessitatibus accusamus. Deleniti quod consequuntur ad ratione eum.
Perspiciatis corrupti quaerat odit explicabo harum perspiciatis.",80b798bb-488b-479a-bd6c-472a886ac3f3,60a3bcf6-1480-41e2-9c6f-eec7642a0f60
596a49a7-766d-4166-aebd-9d2551443543,5,5,Suscipit eius placeat eius tempora voluptatibus. Dolor assumenda amet.,60a3bcf6-1480-41e2-9c6f-eec7642a0f60,60a3bcf6-1480-41e2-9c6f-eec7642a0f60
7870a3f9-4b3f-4b57-b93d-da0b5be87a43,2,1,Minus esse doloribus ratione repellat placeat. Laborum corrupti corrupti est. Assumenda ea explicabo quo earum ipsa dicta eos.,7a0b396b-6dd5-4c46-8cb1-1759be881956,58d96f87-c364-4582-8e54-76b099a96ccd
8b18113d-9dc3-4fde-b17b-4f7dc8c7e56f,1,4,"Aspernatur occaecati modi ad quibusdam. Natus non quas culpa voluptatibus officiis cupiditate.
Ipsa a illo doloremque error. Officia omnis aspernatur occaecati. Aspernatur odio quos numquam deserunt.",169653d0-3004-408b-9063-6bab9fac213c,9b70d827-b5eb-4f1a-a22a-bfebe58a5b64
596a49a7-766d-4166-aebd-9d2551443543,5,5,"Rem dignissimos a. Esse numquam error enim.
Minus iure laborum modi. Quo fuga tenetur facere.",2050b9dc-7990-4304-a614-26192c3498f9,60a3bcf6-1480-41e2-9c6f-eec7642a0f60
199d078e-4afb-4556-844f-e2b27593c5e2,4,5,Recusandae exercitationem a a repellat tempore doloribus amet. Laborum suscipit voluptatem atque doloremque.,2f887a39-08f5-4829-b810-627c22b9d722,ba516a17-7aff-4080-b0ab-5e6da78aa02b
199d078e-4afb-4556-844f-e2b27593c5e2,4,5,"Dolor error voluptatem fugit perferendis at maxime.
Quo itaque dolorum mollitia necessitatibus. Id ipsam voluptatem quia aspernatur quas nihil. Sit temporibus doloribus sed nobis at.",52040252-4a30-4c6f-bc62-044870129808,ba516a17-7aff-4080-b0ab-5e6da78aa02b
7870a3f9-4b3f-4b57-b93d-da0b5be87a43,5,1,Dolor maiores beatae temporibus occaecati porro. Tenetur occaecati molestias delectus quidem animi tempora neque. Odit incidunt voluptate rerum harum illum quia.,12406f81-487a-4996-806a-e3d18b5cca73,58d96f87-c364-4582-8e54-76b099a96ccd
7870a3f9-4b3f-4b57-b93d-da0b5be87a43,2,1,Eum velit quas soluta. Eligendi deleniti cupiditate accusantium. Adipisci praesentium a amet rerum esse aliquid veniam.,55bbabb6-cffb-48f1-8f89-0abb11d5f9d1,58d96f87-c364-4582-8e54-76b099a96ccd
8b18113d-9dc3-4fde-b17b-4f7dc8c7e56f,5,4,Labore fugit animi fugit sequi nisi consequuntur. Architecto velit quidem optio ipsa recusandae neque.,678e476f-1b8e-49aa-9479-be2485b10631,9b70d827-b5eb-4f1a-a22a-bfebe58a5b64
8b18113d-9dc3-4fde-b17b-4f7dc8c7e56f,1,4,Aliquid nostrum quis sit optio. Laboriosam expedita numquam nesciunt quasi.,eef254dc-831a-42ef-9d85-d8e3dff5b720,9b70d827-b5eb-4f1a-a22a-bfebe58a5b64
596a49a7-766d-4166-aebd-9d2551443543,5,5,Blanditiis est et enim nulla natus iusto. Nulla accusamus nisi asperiores. Neque similique amet iste incidunt minus atque.,b88ab42a-3129-4916-9442-c310695c80d9,60a3bcf6-1480-41e2-9c6f-eec7642a0f60
596a49a7-766d-4166-aebd-9d2551443543,4,5,"Molestiae quos ducimus aliquid dolores. Dignissimos eveniet nulla itaque repellendus voluptatem. Nam maxime aliquid quidem ad provident.
Deleniti voluptatum consectetur nam.",bd136f1e-88d4-4d56-a3b2-8522257d9564,60a3bcf6-1480-41e2-9c6f-eec7642a0f60
199d078e-4afb-4556-844f-e2b27593c5e2,5,5,Esse excepturi quaerat corporis nisi odio maxime. Harum officia dolorem dolor doloremque praesentium. Nihil quasi dolorem tempora qui earum.,40088021-f844-457a-98ce-b9fa89eedbf7,ba516a17-7aff-4080-b0ab-5e6da78aa02b
199d078e-4afb-4556-844f-e2b27593c5e2,5,5,Recusandae illum doloremque minima praesentium non dolorem repudiandae. Aspernatur autem sunt mollitia ipsam possimus.,27eedc15-fd85-426c-a66f-310bcb7a982a,ba516a17-7aff-4080-b0ab-5e6da78aa02b
8b18113d-9dc3-4fde-b17b-4f7dc8c7e56f,3,4,Soluta doloremque possimus natus voluptatem. Reiciendis sequi amet iste eligendi perferendis. Et consectetur sequi minima.,24c57f2e-222d-4885-be3d-5e1330953e56,9b70d827-b5eb-4f1a-a22a-bfebe58a5b64
199d078e-4afb-4556-844f-e2b27593c5e2,2,5,"Voluptate dicta minus at eos minus.
Nulla necessitatibus pariatur molestiae. Magni qui facilis dolores non tenetur.
Assumenda quia quam incidunt. Porro minima ipsum omnis.",2ae683b1-9546-49a9-af9f-6d9a87f166fe,ba516a17-7aff-4080-b0ab-5e6da78aa02b
199d078e-4afb-4556-844f-e2b27593c5e2,4,5,Similique iusto deserunt veniam numquam. Ullam tempore voluptatum nesciunt dignissimos nobis. Deleniti suscipit tempora consequuntur.,ad357e85-7ea4-48d6-b819-f70d85920d5b,ba516a17-7aff-4080-b0ab-5e6da78aa02b
8b18113d-9dc3-4fde-b17b-4f7dc8c7e56f,4,4,"Iusto sed deserunt. Dolorem tempore pariatur perspiciatis facere at.
Voluptates mollitia maiores rem dolorum praesentium soluta. Quis natus officia sequi molestias sint. Odit ad sapiente sint.",e928afc8-1e4d-49d0-8123-3b9f72122641,9b70d827-b5eb-4f1a-a22a-bfebe58a5b64
7870a3f9-4b3f-4b57-b93d-da0b5be87a43,5,1,Omnis ullam neque mollitia doloribus. Rem eligendi sapiente aliquid ex. Delectus et iure ex odio vero corporis.,d2bece4a-3b80-4a61-9c19-053938f4ce94,58d96f87-c364-4582-8e54-76b099a96ccd
199d078e-4afb-4556-844f-e2b27593c5e2,2,5,Numquam ad ex voluptates quo aperiam minima esse. Dolores id veritatis reiciendis.,734a2fb2-f740-4d9f-945d-6360dd1ac6c6,ba516a17-7aff-4080-b0ab-5e6da78aa02b
8b18113d-9dc3-4fde-b17b-4f7dc8c7e56f,5,4,"Sint unde quaerat unde voluptates cupiditate incidunt. Dicta quaerat quis quam.
Quod ipsam nisi pariatur voluptatem dolores. Dolorum maiores laboriosam.",6ad91709-19a5-4c97-9a4d-9151862eddde,9b70d827-b5eb-4f1a-a22a-bfebe58a5b64
8b18113d-9dc3-4fde-b17b-4f7dc8c7e56f,4,4,Accusamus repellendus ullam. At ullam tempore culpa iusto illo. Explicabo unde accusantium nisi magni facilis.,a8642357-ae78-4dda-9253-b9b3ed2b837e,9b70d827-b5eb-4f1a-a22a-bfebe58a5b64
8b18113d-9dc3-4fde-b17b-4f7dc8c7e56f,3,4,Dolore dolorum iusto odit animi est dolores. Totam corrupti repellat earum ut nihil maiores reprehenderit. Distinctio velit voluptas.,5eeb15f3-d3f0-49e3-be8c-ed4779aa1b8f,9b70d827-b5eb-4f1a-a22a-bfebe58a5b64
199d078e-4afb-4556-844f-e2b27593c5e2,2,5,"Possimus voluptate consequuntur cum nihil. Qui quas iste ad libero. Delectus non aliquid vel facere.
Error ullam alias aspernatur. Adipisci eius nulla.",2f887a39-08f5-4829-b810-627c22b9d722,ba516a17-7aff-4080-b0ab-5e6da78aa02b
8b18113d-9dc3-4fde-b17b-4f7dc8c7e56f,1,4,"Dolores facere placeat numquam. Ab impedit eum.
Aut consequatur neque praesentium in distinctio. Ipsa asperiores debitis modi impedit rem.",b29c8cb6-696d-44e7-a17b-208f0778f68a,9b70d827-b5eb-4f1a-a22a-bfebe58a5b64
7870a3f9-4b3f-4b57-b93d-da0b5be87a43,4,1,"Quae tenetur eveniet eaque. Voluptatum aut et delectus nostrum voluptatum.
Nulla ipsam sequi. Illo et deleniti aut harum doloremque.",5d68cdca-0448-479c-ad78-ad2c989d7c9c,58d96f87-c364-4582-8e54-76b099a96ccd
199d078e-4afb-4556-844f-e2b27593c5e2,5,5,Veritatis voluptates temporibus voluptates doloremque. Nostrum similique necessitatibus quisquam.,cb014a0c-4a8c-4ffe-8c66-d92960571843,ba516a17-7aff-4080-b0ab-5e6da78aa02b
199d078e-4afb-4556-844f-e2b27593c5e2,1,5,Eaque qui consectetur praesentium quasi. Magni repudiandae voluptate distinctio sapiente aperiam. Iure in qui vero dicta repellat ipsum.,05bd2767-62ae-4992-a1b9-b339b6e37a59,ba516a17-7aff-4080-b0ab-5e6da78aa02b
7870a3f9-4b3f-4b57-b93d-da0b5be87a43,3,1,"Aliquid ipsum modi architecto placeat natus. Accusantium nihil deleniti culpa vitae.
Dolor ipsum repudiandae maiores eum. Delectus aspernatur et asperiores hic eaque.",1f8c5827-0431-4997-bfb7-0be678defd4d,58d96f87-c364-4582-8e54-76b099a96ccd
7870a3f9-4b3f-4b57-b93d-da0b5be87a43,4,1,In aliquam qui similique atque facilis reprehenderit. In explicabo ipsam esse vel iusto quam. Similique pariatur ipsum expedita.,1f8c5827-0431-4997-bfb7-0be678defd4d,58d96f87-c364-4582-8e54-76b099a96ccd
8b18113d-9dc3-4fde-b17b-4f7dc8c7e56f,5,4,Dolorum neque dicta placeat adipisci eius. Eveniet ad placeat temporibus cupiditate molestias. Dolorum magni minus ab ut harum voluptatem.,346096cc-b55b-4ad1-937e-349beaf98af0,9b70d827-b5eb-4f1a-a22a-bfebe58a5b64
7870a3f9-4b3f-4b57-b93d-da0b5be87a43,1,1,"Molestias saepe recusandae.
Qui quaerat cumque officiis fugit provident magnam voluptatibus. Officia perspiciatis velit aliquam eaque.",04399bf4-784c-4ef0-81ce-60afa5b31621,58d96f87-c364-4582-8e54-76b099a96ccd
8b18113d-9dc3-4fde-b17b-4f7dc8c7e56f,4,4,"Iusto voluptas incidunt expedita atque inventore.
Accusantium fuga suscipit nemo deleniti blanditiis. Rem accusamus quo accusantium aspernatur quam.
At animi explicabo rerum dolore.",090ecc33-f292-4626-a84e-86d83516ad76,9b70d827-b5eb-4f1a-a22a-bfebe58a5b64
596a49a7-766d-4166-aebd-9d2551443543,5,5,Nihil ut libero accusamus iure aut. Dignissimos repellendus numquam modi. Debitis ipsum unde soluta.,de362257-35a5-427f-b5be-37f9e41a9d9c,60a3bcf6-1480-41e2-9c6f-eec7642a0f60
199d078e-4afb-4556-844f-e2b27593c5e2,5,5,"Odit hic nemo dolor nulla. Perspiciatis molestiae quis optio possimus. Hic nihil atque voluptates.
Perspiciatis neque repudiandae nesciunt facilis. Omnis enim quas eaque corrupti.",2f887a39-08f5-4829-b810-627c22b9d722,ba516a17-7aff-4080-b0ab-5e6da78aa02b
199d078e-4afb-4556-844f-e2b27593c5e2,4,5,"Nisi saepe nemo cum quis velit amet. Iusto delectus dolores necessitatibus ipsa.
Eius mollitia cumque molestias nulla sunt. Nihil eaque animi impedit quo saepe quam itaque.",090ecc33-f292-4626-a84e-86d83516ad76,ba516a17-7aff-4080-b0ab-5e6da78aa02b
8b18113d-9dc3-4fde-b17b-4f7dc8c7e56f,2,4,Voluptate sunt cumque cum. Numquam minus nesciunt amet. Incidunt natus autem harum sint dolores eius sequi.,20d10ad9-dbcc-4f9d-beee-a9bc17e2c89c,9b70d827-b5eb-4f1a-a22a-bfebe58a5b64
199d078e-4afb-4556-844f-e2b27593c5e2,2,5,Earum illum aut illum perspiciatis in. Aliquid id ipsam consequuntur rerum. Delectus doloremque ex nemo.,1fc167cc-80a0-469f-ac7a-0ceb811c3203,ba516a17-7aff-4080-b0ab-5e6da78aa02b
596a49a7-766d-4166-aebd-9d2551443543,4,5,"Aspernatur suscipit recusandae. Quo modi aspernatur placeat optio.
Magnam voluptatem beatae odio. Dolore repellat aspernatur nemo dolorem. Quas impedit laboriosam possimus numquam quaerat.",55bbabb6-cffb-48f1-8f89-0abb11d5f9d1,60a3bcf6-1480-41e2-9c6f-eec7642a0f60
596a49a7-766d-4166-aebd-9d2551443543,4,5,Veritatis iure corrupti ex enim cupiditate numquam nesciunt. Quidem reiciendis molestias magni tenetur est.,314934b5-f928-46e9-93c5-c209a90cc582,60a3bcf6-1480-41e2-9c6f-eec7642a0f60
199d078e-4afb-4556-844f-e2b27593c5e2,3,5,Porro dolorem ex. Aperiam consequatur minima dicta. Dolore deleniti maiores atque ex illo qui.,c9349e4d-cdcc-4c91-9685-b1728579a9a7,ba516a17-7aff-4080-b0ab-5e6da78aa02b
7870a3f9-4b3f-4b57-b93d-da0b5be87a43,2,1,Facere explicabo laboriosam vitae. Facilis suscipit ea itaque vero.,a9c8a41c-b359-4eef-b6f4-0be0a8cc2ce8,58d96f87-c364-4582-8e54-76b099a96ccd
8b18113d-9dc3-4fde-b17b-4f7dc8c7e56f,3,4,Molestias molestias cupiditate iure. Magni rem magnam quidem architecto quod cum. Possimus fugiat suscipit labore dolorem consequatur nesciunt.,dbde00fc-a75e-4e2c-a7d3-8231fca194f7,9b70d827-b5eb-4f1a-a22a-bfebe58a5b64
199d078e-4afb-4556-844f-e2b27593c5e2,2,5,In reiciendis quo ducimus incidunt molestias aliquam quam. Rem quam quidem dicta doloribus error. Aliquam vel laborum doloribus asperiores.,e7dade02-1b46-4a60-aac4-c3fff40fe63f,ba516a17-7aff-4080-b0ab-5e6da78aa02b
199d078e-4afb-4556-844f-e2b27593c5e2,2,5,Voluptate enim rem corrupti officiis. Quod fugiat dolorum voluptas libero facilis. Cum mollitia ad voluptates hic modi quo. Nihil at eligendi quaerat pariatur.,a431eba4-7b68-4761-b82b-100acf19f6e8,ba516a17-7aff-4080-b0ab-5e6da78aa02b
199d078e-4afb-4556-844f-e2b27593c5e2,1,5,"Praesentium vel doloribus labore adipisci nulla. Eum vitae aliquam repudiandae accusantium nulla.
Eos ad temporibus repudiandae enim.",a431eba4-7b68-4761-b82b-100acf19f6e8,ba516a17-7aff-4080-b0ab-5e6da78aa02b
199d078e-4afb-4556-844f-e2b27593c5e2,2,5,Praesentium error quia nemo dolore blanditiis. Labore sit animi accusamus. Dolorum qui beatae ipsa mollitia cupiditate.,b67b9d85-7d42-4d46-8b00-b01fc0238909,ba516a17-7aff-4080-b0ab-5e6da78aa02b
7870a3f9-4b3f-4b57-b93d-da0b5be87a43,4,1,"Nihil quibusdam optio error.
Aliquam odio magni numquam.
Tenetur fugit quibusdam ipsam dignissimos vitae culpa. Reprehenderit cum nostrum fugiat ex ducimus repellendus.",e77d26ba-472b-44d4-9dc0-e660461a28a2,58d96f87-c364-4582-8e54-76b099a96ccd
8b18113d-9dc3-4fde-b17b-4f7dc8c7e56f,3,4,"Doloremque libero doloribus consectetur illum.
Tempora vitae quidem enim ullam dolorum minus asperiores.",a2be6010-ae0d-49a2-8e53-6c05632bb149,9b70d827-b5eb-4f1a-a22a-bfebe58a5b64
596a49a7-766d-4166-aebd-9d2551443543,3,5,Aliquam architecto repellat nobis exercitationem. Laborum quae accusamus eligendi maiores dignissimos.,df1ce7a6-f079-400d-81b1-4ddcc15351a3,60a3bcf6-1480-41e2-9c6f-eec7642a0f60
8b18113d-9dc3-4fde-b17b-4f7dc8c7e56f,4,4,"Nisi consequatur necessitatibus voluptate accusamus distinctio. Velit eos qui repellendus optio iure.
Labore ad ipsa et magnam veritatis. Voluptatem exercitationem tenetur laboriosam quas voluptatum.",2ae683b1-9546-49a9-af9f-6d9a87f166fe,9b70d827-b5eb-4f1a-a22a-bfebe58a5b64
8b18113d-9dc3-4fde-b17b-4f7dc8c7e56f,2,4,"Maiores hic aliquam. Nostrum saepe assumenda occaecati esse.
Magni facilis occaecati accusamus delectus quasi totam. Tempore recusandae corporis. Sint iusto repudiandae modi.",021077ae-9dea-4f86-9487-8df8c19c7344,9b70d827-b5eb-4f1a-a22a-bfebe58a5b64
199d078e-4afb-4556-844f-e2b27593c5e2,4,5,"Quis illo magni. Iure dolor quibusdam. Reprehenderit cumque doloribus quae neque porro beatae.
Aspernatur tempore harum eaque inventore animi corrupti. Vitae at veniam hic ducimus.",dbde00fc-a75e-4e2c-a7d3-8231fca194f7,ba516a17-7aff-4080-b0ab-5e6da78aa02b
199d078e-4afb-4556-844f-e2b27593c5e2,4,5,Ipsa aliquam doloremque ipsa aliquam nobis. Quidem ut deleniti itaque est nobis. Illo nam nulla tempore accusamus ex.,00de9d68-8385-4902-8108-cd8763c3afda,ba516a17-7aff-4080-b0ab-5e6da78aa02b
7870a3f9-4b3f-4b57-b93d-da0b5be87a43,4,1,Nobis autem iure sed aliquam. Officia deserunt ducimus voluptatum. Aut laboriosam perferendis quae.,847ab71a-6c25-4ca1-bfcb-2ed5cbbbb48c,58d96f87-c364-4582-8e54-76b099a96ccd
8b18113d-9dc3-4fde-b17b-4f7dc8c7e56f,5,4,Fugiat quia expedita fuga ea vitae rerum. Provident minus enim illum rerum nam.,eef254dc-831a-42ef-9d85-d8e3dff5b720,9b70d827-b5eb-4f1a-a22a-bfebe58a5b64
596a49a7-766d-4166-aebd-9d2551443543,3,5,"Qui eos libero tempora molestiae perspiciatis. Reiciendis suscipit cumque porro minima voluptates id.
Molestias non nam temporibus. Quae eum illum placeat expedita sed explicabo consequuntur.",2ae683b1-9546-49a9-af9f-6d9a87f166fe,60a3bcf6-1480-41e2-9c6f-eec7642a0f60
8b18113d-9dc3-4fde-b17b-4f7dc8c7e56f,3,4,Doloremque nostrum aut incidunt rem cupiditate. Aliquam est fugiat qui aperiam. Commodi sit modi aperiam quos magnam.,2050b9dc-7990-4304-a614-26192c3498f9,9b70d827-b5eb-4f1a-a22a-bfebe58a5b64
