reservation_id,journey_id,reservation_requested_seats,journey_empty_spaces,reservation_text,user_id,journey_user_id,reservation_money,reservation_status
d1dd2ade-b6c6-4b16-a580-1bced71c44c5,4f255198-a7f6-4530-a976-ccefbd1f2250,1,4,"Placeat modi eum sed. Beatae voluptate quam impedit harum. Ea perferendis delectus assumenda laudantium.
Exercitationem officiis sapiente blanditiis. Molestiae omnis corrupti deleniti magnam at.",af4d9cec-e023-4f99-a995-3d30b076cf9c,1566dde3-5d0a-4360-9df8-f6f1601c06c7,20,pending
7b3a81aa-2be7-4122-99df-05e7ece44fed,0ab7c6eb-e442-4e4a-8086-9d964ac3b2fc,5,3,Blanditiis similique sapiente quod eligendi. Voluptatibus odio delectus qui fugit illum sit. Quasi officiis molestiae voluptatum fugit id.,0066b14d-1448-4c26-a552-0bbaad55b3e7,0e606daa-c042-4679-80c5-a27cd3c1f51e,7,pending
a6c7a131-ac82-4843-9a27-f844d63fd8d5,0ab7c6eb-e442-4e4a-8086-9d964ac3b2fc,5,3,Tempore sed voluptatem numquam quasi. Deleniti magnam possimus et ipsum iste veniam. Nostrum aspernatur molestiae error est animi quia dolorem.,7a4f23db-6fa9-4bec-a099-3c140c73bcd9,0e606daa-c042-4679-80c5-a27cd3c1f51e,0,pending
82088162-30d3-40dd-ac16-bfe6aa9ffdfb,0ab7c6eb-e442-4e4a-8086-9d964ac3b2fc,3,3,"Deserunt veniam facere aspernatur similique placeat. Reprehenderit omnis at hic aliquid quas dolor.
Explicabo fugit molestias alias enim a. Harum natus id quae tempora assumenda.",47314579-a833-4ba0-af09-5deeaee2f9da,0e606daa-c042-4679-80c5-a27cd3c1f51e,10,pending
9bba3e83-78d5-47a4-8b7a-488a3b1911f3,0ab7c6eb-e442-4e4a-8086-9d964ac3b2fc,2,3,Facere distinctio consectetur. Suscipit delectus repudiandae. Blanditiis suscipit recusandae hic suscipit corrupti perspiciatis.,7aa33844-2e7c-49ed-a695-ee9db3218505,0e606daa-c042-4679-80c5-a27cd3c1f51e,26,pending
0a073f41-5036-42e3-8a69-b6a0a54a473b,4f255198-a7f6-4530-a976-ccefbd1f2250,2,4,"Accusamus cumque facilis. Nemo numquam fuga atque.
Inventore ab delectus dignissimos vel.
Quae dolorum omnis illum. Reprehenderit assumenda iure nemo.",a3225f2f-c75c-4a25-a363-9c352841fdbe,1566dde3-5d0a-4360-9df8-f6f1601c06c7,11,pending
ee29d5d2-8bca-40e5-b392-a0e3368af2a2,0ab7c6eb-e442-4e4a-8086-9d964ac3b2fc,2,3,"Natus voluptatum qui assumenda maiores eius.
Natus numquam nobis. Porro officiis quaerat magnam id error cupiditate. Quibusdam reiciendis reprehenderit iure eligendi.",1e6e2796-25fd-431c-9716-238bc3582abe,0e606daa-c042-4679-80c5-a27cd3c1f51e,13,pending
1bcd69df-4343-43db-9824-c2963df46781,4f255198-a7f6-4530-a976-ccefbd1f2250,3,4,Adipisci provident accusamus dignissimos. Unde neque veniam. Minus inventore eaque quisquam rem qui culpa labore.,79f76cd6-31c0-4d0c-bf1f-85f463fc16c5,1566dde3-5d0a-4360-9df8-f6f1601c06c7,5,pending
a1c2f9bf-95f4-4d3f-baff-5511ee56f88d,0ab7c6eb-e442-4e4a-8086-9d964ac3b2fc,3,3,"Ea laudantium quis. Consequuntur pariatur eum omnis voluptatem.
Consequuntur aut aperiam expedita pariatur provident quo. Iure voluptatibus nemo accusamus.",b5728414-b397-42b3-ae68-dceef8e215f3,0e606daa-c042-4679-80c5-a27cd3c1f51e,22,pending
381668bc-c413-4fce-88dd-88a0002dd7b6,4f255198-a7f6-4530-a976-ccefbd1f2250,3,4,Blanditiis ea delectus cumque vero. Quasi consequuntur doloribus. Aspernatur est ut accusamus quia enim dolor.,16a62d72-6de3-42c3-87b0-62d2cf2b812a,1566dde3-5d0a-4360-9df8-f6f1601c06c7,21,pending
4f667523-22df-412f-a626-59c116109578,0ab7c6eb-e442-4e4a-8086-9d964ac3b2fc,3,3,"Saepe harum voluptate in incidunt mollitia. Quae repellat eveniet recusandae.
Explicabo doloremque a cumque aperiam. Corporis ipsa cumque blanditiis alias et.",b9dac99f-082d-447f-9a95-c5df693a6c02,0e606daa-c042-4679-80c5-a27cd3c1f51e,20,pending
1e686357-5a3b-4364-9251-9f4f9601265f,4f255198-a7f6-4530-a976-ccefbd1f2250,5,4,"Adipisci dolorum deleniti aperiam eaque assumenda deleniti. Ducimus quidem quidem veniam enim eaque quasi. Mollitia molestias quod quia.
Error expedita excepturi aspernatur.",ba46fce0-7949-4a8c-82f6-c3386fce23a8,1566dde3-5d0a-4360-9df8-f6f1601c06c7,24,pending
0278de62-c597-4f22-a7f9-d8957e648706,0ab7c6eb-e442-4e4a-8086-9d964ac3b2fc,4,3,Soluta dolore error accusamus nulla consequatur. Eaque enim labore architecto. Maiores error voluptatem voluptatibus delectus dolor libero.,92792546-48b1-44a7-a00e-6d35634ac339,0e606daa-c042-4679-80c5-a27cd3c1f51e,15,pending
6c3b6ce4-fc5d-4f33-a059-e2a3c08b6522,0ab7c6eb-e442-4e4a-8086-9d964ac3b2fc,4,3,"Consectetur temporibus aperiam. Rerum in est consequuntur repudiandae culpa eligendi.
Ipsum natus deserunt aliquam nostrum eum. Maxime dolore libero soluta. Beatae quam velit magni.",c5e623bb-4f8e-4a66-be8b-51a6b6098430,0e606daa-c042-4679-80c5-a27cd3c1f51e,29,pending
755dad70-1c7e-485c-afc6-e18633133e34,0ab7c6eb-e442-4e4a-8086-9d964ac3b2fc,4,3,Id nihil aliquam ducimus. Libero iste voluptates rerum. Dolores consectetur consequatur enim.,7aa33844-2e7c-49ed-a695-ee9db3218505,0e606daa-c042-4679-80c5-a27cd3c1f51e,15,pending
9a5387df-f1db-4f0c-a5e5-4b7ff6271fb3,0ab7c6eb-e442-4e4a-8086-9d964ac3b2fc,5,3,"Minus impedit deserunt. Hic eligendi sit quia nemo deserunt.
Praesentium beatae in doloribus.",7aa33844-2e7c-49ed-a695-ee9db3218505,0e606daa-c042-4679-80c5-a27cd3c1f51e,22,pending
c0a5d0a3-23e6-4467-a8d7-a8f04a64e151,0ab7c6eb-e442-4e4a-8086-9d964ac3b2fc,3,3,"At perferendis repellat quo. Dicta totam culpa. Praesentium tenetur iure hic consequuntur.
Delectus ipsam inventore. Asperiores quidem eius sequi. Perspiciatis minima deleniti repellendus facilis.",2be8af87-a122-4b6c-9d56-88822dd0f8de,0e606daa-c042-4679-80c5-a27cd3c1f51e,12,pending
885c5ab3-a105-4ca3-89ca-f2fc996c131d,4f255198-a7f6-4530-a976-ccefbd1f2250,3,4,"Similique iusto amet alias.
Molestiae praesentium cumque. At iusto accusamus ea laudantium. Assumenda sint ut iusto cumque laborum consequuntur.",0ae425b4-1e4b-4cc8-b692-8ec17a4a6536,1566dde3-5d0a-4360-9df8-f6f1601c06c7,20,pending
f9197861-5f57-4362-a7c4-de60f1f994ad,0ab7c6eb-e442-4e4a-8086-9d964ac3b2fc,4,3,"Quo minus nemo expedita. Incidunt labore tempora nihil animi.
Accusantium fuga vero velit nisi. Velit est nostrum numquam labore suscipit dicta beatae.
Doloremque quaerat repellat odio nihil.",a12259ff-3ca1-4e19-8fde-3e839865dade,0e606daa-c042-4679-80c5-a27cd3c1f51e,4,pending
09dcb7fc-92ff-4028-acd8-0c46f5310257,0ab7c6eb-e442-4e4a-8086-9d964ac3b2fc,3,3,"Dolore nulla quas minima et. Minima vitae vel repudiandae.
At quas dolor exercitationem consectetur autem. Iste quisquam ad.",177a80d5-7e94-4025-80ba-fd99d5a71f4c,0e606daa-c042-4679-80c5-a27cd3c1f51e,27,pending
96584819-1997-4d93-9555-96c1c7299d53,4f255198-a7f6-4530-a976-ccefbd1f2250,5,4,Quam corporis corporis consequatur quo. Odio eos pariatur nihil hic. Possimus cum nobis.,5dc6247d-754b-4032-b152-a9992b54f78b,1566dde3-5d0a-4360-9df8-f6f1601c06c7,12,pending
1b03127a-87c6-41bc-afc4-3a7d46001231,0ab7c6eb-e442-4e4a-8086-9d964ac3b2fc,2,3,"Maxime cupiditate ipsam et.
Possimus tempore eligendi tenetur beatae perspiciatis at fugit. Harum assumenda quos minima. Distinctio aspernatur voluptates.",ac4aa56c-ba05-40b0-9294-a88cf1d1c681,0e606daa-c042-4679-80c5-a27cd3c1f51e,20,pending
7b931579-9103-40ec-bba5-9a5272a8dcc7,0ab7c6eb-e442-4e4a-8086-9d964ac3b2fc,5,3,Quidem distinctio eius nulla soluta eaque. Id quis quisquam consequatur. Dolor cupiditate architecto praesentium quisquam sint.,c9a499d9-e628-4f68-b9cf-79924b99bd82,0e606daa-c042-4679-80c5-a27cd3c1f51e,15,pending
8ad49b72-631e-49bc-8073-7f7374df714e,0ab7c6eb-e442-4e4a-8086-9d964ac3b2fc,3,3,"Omnis cum nisi neque a. Natus labore quis fugiat adipisci.
Dolorem at sit pariatur tempore. Maxime numquam quibusdam accusantium dolor iure. Distinctio ipsa hic voluptatem repellat.",25dfec07-e0f2-48d5-acfb-fc06bf499225,0e606daa-c042-4679-80c5-a27cd3c1f51e,30,pending
8363dd2b-b015-4016-b90f-8491ebf8a5ad,4f255198-a7f6-4530-a976-ccefbd1f2250,4,4,Sed perferendis autem esse exercitationem aliquam. Beatae ipsum dolorum sapiente modi sint rem. Vitae corrupti ipsum laboriosam accusantium.,65b493a5-5d60-4c3d-8f95-658003f5e126,1566dde3-5d0a-4360-9df8-f6f1601c06c7,26,pending
a282cede-ccd3-4dbd-997b-05276b49c721,4f255198-a7f6-4530-a976-ccefbd1f2250,3,4,Ullam reprehenderit tempora distinctio possimus quos eos. Enim alias nemo reprehenderit voluptate laborum.,b9dac99f-082d-447f-9a95-c5df693a6c02,1566dde3-5d0a-4360-9df8-f6f1601c06c7,9,pending
8f4cef48-843d-44b1-9ccb-e7ca81140112,4f255198-a7f6-4530-a976-ccefbd1f2250,2,4,"Totam ut quisquam iste quidem beatae.
Sint exercitationem labore recusandae cum dolorem amet fugit. Ducimus fugit illo nobis sint hic. Temporibus id a iusto quisquam veniam.",fee7e0fe-f169-496f-a47e-99a640928c34,1566dde3-5d0a-4360-9df8-f6f1601c06c7,22,pending
e97c0051-49ad-41c4-b19b-fa966dd6ca78,4f255198-a7f6-4530-a976-ccefbd1f2250,1,4,Velit dolore praesentium voluptatem delectus non temporibus. Quo soluta quam reiciendis dolorum magni assumenda. Optio ipsam iusto excepturi fugit at. Saepe aperiam repellendus voluptate velit.,7431e67e-95eb-4d6d-818b-5e6c3b9d3e4a,1566dde3-5d0a-4360-9df8-f6f1601c06c7,26,pending
79968794-a4b0-4a55-981d-43581c03cf23,4f255198-a7f6-4530-a976-ccefbd1f2250,4,4,Reprehenderit officiis delectus rerum tempora aspernatur optio porro. Magni illum minima recusandae quam cumque aliquam.,0118f914-0c7b-46c9-aa60-86e9d40f8370,1566dde3-5d0a-4360-9df8-f6f1601c06c7,12,pending
e2433ddb-0cfc-461c-9d0d-55314effeb4d,0ab7c6eb-e442-4e4a-8086-9d964ac3b2fc,4,3,"Accusantium at deserunt voluptate beatae. Beatae a iusto necessitatibus doloremque a. Provident iste sunt molestiae.
Numquam cum occaecati quae ut aliquam.",c5afbefb-15c4-44e9-b42c-11e8c6392c8c,0e606daa-c042-4679-80c5-a27cd3c1f51e,10,pending
