event_address,event_id,event_start_date,event_start_time,pickup_zip_code,user_id,journey_id,journey_empty_spaces,journey_car,journey_text,journey_date,journey_start_time
"Otto-Flimm-Straße, 53520 Nürburg",eff7e9ae-9c58-42e1-8835-0d51c33dc480,2020-06-05,12:00:00,83700,5e6ee605-d152-4f4a-a822-8617f48db313,fa58b04b-28e6-4ce6-97f4-5235b6eccfc0,2,Renault,"Vero amet repellat expedita occaecati. Nisi quia harum illum nam aliquam.
Enim similique suscipit recusandae saepe cumque. Itaque occaecati incidunt consequatur. Ex nulla temporibus ipsum doloribus.",2020-06-05,18:10:13
"Otto-Flimm-Straße, 53520 Nürburg",eff7e9ae-9c58-42e1-8835-0d51c33dc480,2020-06-05,12:00:00,6862,5875c038-ddef-46d6-8b9c-50ff77a18009,4a899f11-dbc9-401f-a512-f3a6f04a61dc,3,DS,Cum corrupti facilis itaque. Incidunt quas excepturi nobis.,2020-06-05,18:57:29
"Mörfelder Landstraße 362, 60528 Frankfurt am Main",e6930b99-e8ca-49f8-9583-89f54366dc14,2020-06-05,20:00:00,99510,9b49f405-1570-4944-880c-7b11e52344e8,291d89ab-d1e7-4ed7-a51d-727b28838087,4,Mercedes-Benz,"Vel corrupti cupiditate cum dolorum at deleniti. Sapiente beatae similique rem voluptate consequatur.
Optio beatae quas tenetur suscipit tempore at sed. Voluptate amet ad velit.",2020-06-05,06:54:32
"Xaver-Fuhr-Straße 101, 68163 Mannheim",2ab60824-b539-4a1f-ae1a-f7d94d2d55bb,2020-04-04,19:00:00,38899,f3d07804-cd4e-4239-80ad-79b88a622d6f,a6d487e0-6ba4-460f-a77d-82a0112eb450,3,Donkervoort,Laudantium quae nobis cum aspernatur quia natus. Pariatur nisi culpa. Repudiandae modi nostrum explicabo ratione iusto.,2020-04-04,06:43:13
"Xaver-Fuhr-Straße 101, 68163 Mannheim",2ab60824-b539-4a1f-ae1a-f7d94d2d55bb,2020-04-04,19:00:00,47229,2187e1a2-ed3c-4fea-874b-8895134b791e,cbcab7f4-e718-4f80-b4bb-5acb8fe82f27,1,Lamborghini,Atque saepe possimus alias suscipit facere. Natus molestiae illum aperiam laboriosam veniam. Tempora tempore minima delectus.,2020-04-04,12:33:21
"Mörfelder Landstraße 362, 60528 Frankfurt am Main",e6930b99-e8ca-49f8-9583-89f54366dc14,2020-06-05,20:00:00,27777,a8b5a5c4-777d-4cbd-907e-2b1ea0f18213,f454adb4-9270-479a-b95e-0f72fc09bf07,1,Opel,Esse quae minima magni est. Ea cumque modi. Ut neque consectetur vero eaque sapiente.,2020-06-05,12:45:32
"Mörfelder Landstraße 362, 60528 Frankfurt am Main",e6930b99-e8ca-49f8-9583-89f54366dc14,2020-06-05,20:00:00,99718,1baf96a1-55d7-468b-abbe-5bc30116be1d,f0980c54-be70-4c00-993c-cce672475780,2,BMW,"Nihil error temporibus hic incidunt laboriosam.
Facere nobis dolorum. Sapiente maxime ipsum eos delectus excepturi.",2020-06-05,09:01:46
"Xaver-Fuhr-Straße 101, 68163 Mannheim",2ab60824-b539-4a1f-ae1a-f7d94d2d55bb,2020-04-04,19:00:00,85521,4cb6721c-4eed-450e-89d2-12c1c038f7ba,8950d45e-be65-42a7-bbb6-bc404f50a972,3,Saab,Similique dolorem pariatur cupiditate incidunt illum cum. Repudiandae soluta nulla.,2020-04-04,17:08:16
"Otto-Flimm-Straße, 53520 Nürburg",eff7e9ae-9c58-42e1-8835-0d51c33dc480,2020-06-05,12:00:00,96052,9b49f405-1570-4944-880c-7b11e52344e8,61997226-a9a8-4b55-83d5-32da12d77114,2,Lada,Sequi amet tempore. Nobis excepturi dolor numquam. Doloremque et sed ad nisi.,2020-06-05,03:59:53
"Mörfelder Landstraße 362, 60528 Frankfurt am Main",e6930b99-e8ca-49f8-9583-89f54366dc14,2020-06-05,20:00:00,83739,137d8112-8ab7-4a2d-beb0-0967949a8ccf,0fb4928d-f58a-49e6-aafa-ba2616b87376,2,Chevrolet,"Ut deserunt expedita voluptatibus in qui at. Reiciendis non placeat voluptatum error.
Sequi neque atque ratione incidunt. Deleniti fugiat occaecati nam.",2020-06-05,04:02:17
"Xaver-Fuhr-Straße 101, 68163 Mannheim",2ab60824-b539-4a1f-ae1a-f7d94d2d55bb,2020-04-04,19:00:00,18320,0a3ceb74-068c-4e58-befd-e63b756a58c3,5a7a9a89-0d97-4f05-a517-c16fb5ebf755,4,Abarth,Hic non autem totam cum. Iusto delectus corporis rem quia veniam.,2020-04-04,17:23:20
"Otto-Flimm-Straße, 53520 Nürburg",eff7e9ae-9c58-42e1-8835-0d51c33dc480,2020-06-05,12:00:00,6926,b3a37c80-d6c5-4cd5-8623-17342d44c310,5f5a2b1c-9d9a-4407-91a4-355e84f6f630,1,Ford,Molestiae excepturi excepturi dolorem reiciendis et. Rerum quod sit occaecati inventore laboriosam porro placeat.,2020-06-05,08:25:29
"Rheinlanddamm 200, 44139 Dortmund",7be626b0-c1cd-4a26-a111-60afb13ba940,2020-04-30,17:00:00,24806,838277b3-488d-4b89-8ad3-7a49526a86ca,fc1bff52-d730-4de1-a5cf-646f2df17ec2,3,Dodge,"Veritatis rem nisi illum voluptates inventore est. Eligendi labore distinctio magnam.
Facilis similique quaerat cupiditate ut perferendis reiciendis. Cumque impedit veritatis consectetur molestias.",2020-04-30,18:22:46
"Otto-Flimm-Straße, 53520 Nürburg",eff7e9ae-9c58-42e1-8835-0d51c33dc480,2020-06-05,12:00:00,25436,026ea82d-32a0-4618-b792-150640dea4a3,6c74ba6a-d748-41df-af98-b3384d7f39d3,1,Fiat,"Temporibus rerum amet ullam ut quibusdam quas. Exercitationem odit vero illum assumenda accusamus corporis. Illum explicabo in esse tempore sed.
Alias sed est cumque. Repellendus earum sed.",2020-06-05,08:16:23
"Otto-Flimm-Straße, 53520 Nürburg",eff7e9ae-9c58-42e1-8835-0d51c33dc480,2020-06-05,12:00:00,25869,980df95d-4535-450f-9176-cdfd635c951f,a7c6d48c-ad24-4ebe-aeaa-1437675c839a,3,SsangYong,"Non delectus magnam cupiditate sapiente. Animi doloremque maxime harum unde magni.
Autem sapiente totam unde inventore sunt est.",2020-06-05,19:24:57
"Rheinlanddamm 200, 44139 Dortmund",7be626b0-c1cd-4a26-a111-60afb13ba940,2020-04-30,17:00:00,97246,589e66c7-bfaa-46d6-8e96-0433a159324b,54bc6f60-5d05-4717-9e1b-148f369cd391,4,Peugeot,Alias delectus numquam occaecati. Minima mollitia sit nulla expedita. Impedit doloribus nam accusamus repellat quisquam quam.,2020-04-30,20:09:48
"Otto-Flimm-Straße, 53520 Nürburg",eff7e9ae-9c58-42e1-8835-0d51c33dc480,2020-06-05,12:00:00,99628,494bcc9c-8a0b-4a64-aef4-4686aa65b0e1,5a1e8868-4e2d-41d9-ad18-1b28d1992843,4,Volvo,"Eaque perferendis deleniti sint facilis voluptates optio. Nesciunt in omnis vitae quaerat.
Ut rem recusandae totam ut. Aperiam eum ut magni corrupti culpa.",2020-06-05,09:35:51
"Rheinlanddamm 200, 44139 Dortmund",7be626b0-c1cd-4a26-a111-60afb13ba940,2020-04-30,17:00:00,4769,0190ec19-de31-4488-bb8a-94842364e0f2,d3e5034a-f220-4390-b612-4c1ecf772261,1,Suzuki,Vitae nisi dicta neque. Numquam dolor laudantium dolores odit eligendi magnam.,2020-04-30,17:48:33
"Mörfelder Landstraße 362, 60528 Frankfurt am Main",e6930b99-e8ca-49f8-9583-89f54366dc14,2020-06-05,20:00:00,95356,534db7fe-5988-4bc8-8061-b398b75090b8,52242477-5580-4138-b6db-21eb697f70c3,3,Jaguar,"Magnam ducimus eveniet molestias dolorem nulla. Sapiente laudantium sed id dolorum.
Placeat unde aperiam est. Nulla soluta nobis ipsa.",2020-06-05,16:57:09
"Mörfelder Landstraße 362, 60528 Frankfurt am Main",e6930b99-e8ca-49f8-9583-89f54366dc14,2020-06-05,20:00:00,7751,c7ce6359-822e-4faa-be69-071c445e7c36,8e095a8e-6e44-4a51-90ad-6c6e06c080da,2,Volvo,Aperiam aspernatur velit quae asperiores ipsa totam. Ducimus error esse eos numquam dolorum tempora. Impedit eligendi praesentium nulla porro necessitatibus ad.,2020-06-05,15:54:31
"Mörfelder Landstraße 362, 60528 Frankfurt am Main",e6930b99-e8ca-49f8-9583-89f54366dc14,2020-06-05,20:00:00,6449,00b06e3a-71ba-4ea4-ad23-c8805e014951,ddb6b214-f3ec-494d-9731-c70b0ad51816,3,DS,Facere porro dolore cum tempore. Esse dolores consectetur nesciunt. Perspiciatis placeat impedit unde eaque consequatur iure.,2020-06-05,04:04:39
"Otto-Flimm-Straße, 53520 Nürburg",eff7e9ae-9c58-42e1-8835-0d51c33dc480,2020-06-05,12:00:00,66909,01edd1ac-5c97-4e67-b8f9-c872d66cdb30,62b1f4c3-5c9e-424e-aa9d-6dab27048f1a,3,Subaru,Neque eligendi quam cupiditate voluptates consequatur. Amet mollitia ad numquam corrupti. Nostrum maxime totam atque aut nulla.,2020-06-05,20:01:17
"Xaver-Fuhr-Straße 101, 68163 Mannheim",2ab60824-b539-4a1f-ae1a-f7d94d2d55bb,2020-04-04,19:00:00,83093,a280875c-9e75-4f6e-8a00-2b92735b9e54,8a85b93d-1481-43f4-98d4-01f203e6301c,3,Mitsubishi,"Quidem dicta quos molestiae ullam recusandae. Officia ipsum consequatur.
Cum quisquam commodi sequi voluptatum temporibus. Cumque enim temporibus incidunt totam dolore.",2020-04-04,03:55:41
"Mörfelder Landstraße 362, 60528 Frankfurt am Main",e6930b99-e8ca-49f8-9583-89f54366dc14,2020-06-05,20:00:00,26845,d144ef4c-5bbe-49c2-a2ad-5ad7a37f113e,7fd510c6-4574-433b-a338-42d038858249,5,Citroën,Accusantium ex fugiat. Impedit necessitatibus earum facilis eligendi. Et enim ab quas recusandae ab laudantium.,2020-06-05,21:20:58
"Otto-Flimm-Straße, 53520 Nürburg",eff7e9ae-9c58-42e1-8835-0d51c33dc480,2020-06-05,12:00:00,70806,0190ec19-de31-4488-bb8a-94842364e0f2,ebd8cc0e-d462-47c9-a4ce-4b2f5af5cccc,5,Donkervoort,Suscipit debitis maxime inventore est id. Officiis odio inventore exercitationem unde. Placeat quia quia incidunt eos doloremque.,2020-06-05,12:08:26
"Xaver-Fuhr-Straße 101, 68163 Mannheim",2ab60824-b539-4a1f-ae1a-f7d94d2d55bb,2020-04-04,19:00:00,4289,7420515d-69fd-446f-90b6-221ed7034c1f,3e189260-6c25-4605-8cd7-e7cf6a23eca9,2,DS,Minus natus sequi quis saepe ipsa. Necessitatibus fuga tenetur maiores exercitationem consequatur.,2020-04-04,04:16:29
"Rheinlanddamm 200, 44139 Dortmund",7be626b0-c1cd-4a26-a111-60afb13ba940,2020-04-30,17:00:00,1239,3ef5c93b-c710-43ba-ae0d-6ef1480edbf5,436baf11-6980-45df-aa7b-ba92e9806e30,5,Rover,Nulla quo magni reprehenderit a inventore veniam. Doloribus ut distinctio ducimus.,2020-04-30,04:18:37
"Otto-Flimm-Straße, 53520 Nürburg",eff7e9ae-9c58-42e1-8835-0d51c33dc480,2020-06-05,12:00:00,71638,7a6a5ab2-df22-4ebf-ac8b-df06c0fcc43d,cb8df086-0c67-4d7b-a95a-93006789b82b,2,Daihatsu,Perferendis cum recusandae quam cumque culpa fugit. Beatae consectetur facere provident. Officia sapiente placeat maiores.,2020-06-05,16:30:14
"Otto-Flimm-Straße, 53520 Nürburg",eff7e9ae-9c58-42e1-8835-0d51c33dc480,2020-06-05,12:00:00,84130,0190ec19-de31-4488-bb8a-94842364e0f2,03f8d641-0cd7-42b9-916d-c19e82c7015b,2,Hummer,"Provident eius blanditiis expedita dolorum adipisci. Quos ipsa facere labore.
Unde illum ratione voluptas impedit.
Optio fugit commodi odit consequatur. Quidem at unde delectus quidem.",2020-06-05,14:58:05
"Rheinlanddamm 200, 44139 Dortmund",7be626b0-c1cd-4a26-a111-60afb13ba940,2020-04-30,17:00:00,6386,534db7fe-5988-4bc8-8061-b398b75090b8,5dda1030-d600-40c0-9771-9e4e8defcc57,1,Rolls-Royce,Quas voluptate natus facere. Aliquam explicabo earum asperiores eius reprehenderit. Occaecati modi hic facilis laboriosam odio suscipit cumque. Odit asperiores laborum architecto quaerat.,2020-04-30,09:25:38
"Otto-Flimm-Straße, 53520 Nürburg",eff7e9ae-9c58-42e1-8835-0d51c33dc480,2020-06-05,12:00:00,99438,077ee531-2537-4734-bae6-89c998da89cc,109c8c1e-81f3-48e6-93f1-59db3b643595,5,Toyota,"Aliquid quas suscipit fuga voluptatem. Repellat autem enim ipsum.
Sequi sapiente totam. Nulla accusantium libero doloremque.",2020-06-05,23:07:53
"Xaver-Fuhr-Straße 101, 68163 Mannheim",2ab60824-b539-4a1f-ae1a-f7d94d2d55bb,2020-04-04,19:00:00,29413,c2cebae5-6200-4421-b9eb-55b098cfb1a7,44152cc2-9542-4d11-b234-277f6b5a0304,3,Lotus,Consectetur quidem velit voluptatibus reprehenderit. Blanditiis inventore earum incidunt tempora porro. Sit aliquid laborum eveniet provident.,2020-04-04,15:54:11
"Otto-Flimm-Straße, 53520 Nürburg",eff7e9ae-9c58-42e1-8835-0d51c33dc480,2020-06-05,12:00:00,99947,2448380d-cfe7-4e57-86dd-1f87c65a154f,8d34a5bf-c511-4be4-9937-ca524ba327bf,2,Lotus,"Officiis eius repudiandae tempore voluptas. Similique cumque laboriosam ad quaerat eaque ipsam. Tenetur consequatur aut excepturi temporibus.
Nesciunt dolore dolorem fuga.",2020-06-05,23:04:05
"Mörfelder Landstraße 362, 60528 Frankfurt am Main",e6930b99-e8ca-49f8-9583-89f54366dc14,2020-06-05,20:00:00,88690,534db7fe-5988-4bc8-8061-b398b75090b8,f49fa4cf-850f-48e4-a6e9-4d969cfc3f6f,3,Lada,Occaecati quis incidunt aspernatur iusto tempora veniam. Velit corporis fuga. Consequatur sit similique eos vero fugit quisquam.,2020-06-05,14:41:47
"Mörfelder Landstraße 362, 60528 Frankfurt am Main",e6930b99-e8ca-49f8-9583-89f54366dc14,2020-06-05,20:00:00,7422,137d8112-8ab7-4a2d-beb0-0967949a8ccf,fbc491c4-1192-44b1-bdd0-755925bb70ab,5,Rover,Neque quis accusamus voluptas illum. Dolores id tenetur quos. Illo voluptatem facere facere deserunt. Ex temporibus totam facere.,2020-06-05,18:13:00
"Xaver-Fuhr-Straße 101, 68163 Mannheim",2ab60824-b539-4a1f-ae1a-f7d94d2d55bb,2020-04-04,19:00:00,63814,137d8112-8ab7-4a2d-beb0-0967949a8ccf,30935c8b-d946-4971-b5e4-24f660ae31a5,1,Mini,"Nulla officiis provident fugit laudantium cum. Facere pariatur reprehenderit laborum.
Aliquam quam provident voluptate temporibus voluptatem. Assumenda delectus pariatur.",2020-04-04,06:04:32
"Xaver-Fuhr-Straße 101, 68163 Mannheim",2ab60824-b539-4a1f-ae1a-f7d94d2d55bb,2020-04-04,19:00:00,18461,494bcc9c-8a0b-4a64-aef4-4686aa65b0e1,9746c8aa-055f-451e-85b3-30c41497a885,2,Volvo,Eum harum nobis sit libero. Quaerat saepe hic illum soluta quam. Quibusdam in quam itaque facere ad.,2020-04-04,04:26:22
"Mörfelder Landstraße 362, 60528 Frankfurt am Main",e6930b99-e8ca-49f8-9583-89f54366dc14,2020-06-05,20:00:00,6648,c1b97171-b295-45aa-83a5-195a51e337d3,952a0c5f-6bdb-4a36-bacf-d581f67b098f,2,Land Rover,Nostrum architecto perferendis dicta facere. Dolorem labore beatae harum ut cupiditate blanditiis. Itaque neque id voluptates expedita et aliquid.,2020-06-05,07:43:23
"Rheinlanddamm 200, 44139 Dortmund",7be626b0-c1cd-4a26-a111-60afb13ba940,2020-04-30,17:00:00,94526,4ed2661a-ec90-435f-8f06-673084062c63,4e290637-ecd2-4ef1-b4db-e23ba48e3509,1,Donkervoort,"Optio corporis modi nam quo.
Sed magni libero. Voluptatem iste quidem quia beatae quia. Error facere id vero facilis inventore illo ipsam.
Error repellat occaecati est est. Nisi quae tempora sequi.",2020-04-30,06:04:08
"Xaver-Fuhr-Straße 101, 68163 Mannheim",2ab60824-b539-4a1f-ae1a-f7d94d2d55bb,2020-04-04,19:00:00,99610,17fe9abb-941d-40b0-9557-170a5c74fcb2,67fddf65-0436-4628-93f6-64d51f8f938b,2,Hummer,"Iure quod a aut atque laboriosam debitis. Necessitatibus laboriosam provident aut velit. Qui dignissimos impedit.
Tempora id aspernatur aliquam facilis ea.",2020-04-04,11:50:04
"Mörfelder Landstraße 362, 60528 Frankfurt am Main",e6930b99-e8ca-49f8-9583-89f54366dc14,2020-06-05,20:00:00,89177,3ef5c93b-c710-43ba-ae0d-6ef1480edbf5,de582708-40b1-47ba-8dce-f602784d81a6,2,Lada,Ullam pariatur ut doloremque. Quis quam expedita quia rerum tempore laboriosam. Cumque et tenetur alias distinctio soluta.,2020-06-05,00:43:31
"Xaver-Fuhr-Straße 101, 68163 Mannheim",2ab60824-b539-4a1f-ae1a-f7d94d2d55bb,2020-04-04,19:00:00,56766,bdd4a3ae-0585-44dc-9253-c1575dd920f6,87653bc4-0f77-4364-b010-4499ba9d3bce,3,Daewoo,Impedit nemo maxime adipisci. Eveniet maiores dolorum doloribus eum. Quidem impedit non assumenda odit quae laborum.,2020-04-04,10:13:51
"Xaver-Fuhr-Straße 101, 68163 Mannheim",2ab60824-b539-4a1f-ae1a-f7d94d2d55bb,2020-04-04,19:00:00,1591,338e482b-5a91-4386-8a56-0e81bfb7ed91,1800cdf0-ba04-4075-b60a-800dd9d08b1c,4,Maserati,"Neque saepe repudiandae explicabo. Corporis natus nostrum odio odit dicta dolorum.
Nihil dolores impedit ut soluta. Eos hic deleniti mollitia. Eum fugiat quae delectus possimus quod voluptatem.",2020-04-04,05:21:14
"Xaver-Fuhr-Straße 101, 68163 Mannheim",2ab60824-b539-4a1f-ae1a-f7d94d2d55bb,2020-04-04,19:00:00,84384,5e129ab2-e487-419f-bcd4-2b00402f0345,e9e7f092-b6c7-4595-893b-359a7a2a180e,3,DS,"Tempore quisquam voluptas nesciunt. Accusantium at doloremque assumenda.
Consectetur vel nulla laudantium recusandae libero. Doloribus quia et ex.",2020-04-04,09:11:17
"Xaver-Fuhr-Straße 101, 68163 Mannheim",2ab60824-b539-4a1f-ae1a-f7d94d2d55bb,2020-04-04,19:00:00,73489,f3526adc-3719-4a1b-8ceb-5585b0e4a70c,bde8fa31-5f4d-4152-a2fa-bbfef9511729,5,Dodge,"Tenetur sunt mollitia aut. Iure facilis velit.
Officia nesciunt accusamus maxime facilis nobis. Neque odit repudiandae amet neque.",2020-04-04,23:14:16
"Rheinlanddamm 200, 44139 Dortmund",7be626b0-c1cd-4a26-a111-60afb13ba940,2020-04-30,17:00:00,24235,0190ec19-de31-4488-bb8a-94842364e0f2,4232dedd-ade8-4c87-b796-aac46d8cf3c1,5,Honda,Libero officia ex doloribus illum fuga. Inventore dolorum omnis.,2020-04-30,02:41:28
"Rheinlanddamm 200, 44139 Dortmund",7be626b0-c1cd-4a26-a111-60afb13ba940,2020-04-30,17:00:00,96274,4cb6721c-4eed-450e-89d2-12c1c038f7ba,5172cfa9-5ad3-4e59-98a7-87ead03a60fe,4,Infiniti,"Similique id quasi. Dolor saepe illo ipsa placeat quod.
Velit nihil expedita eaque deserunt quidem quo magni. Ratione ut eligendi placeat ipsam.",2020-04-30,12:40:46
"Otto-Flimm-Straße, 53520 Nürburg",eff7e9ae-9c58-42e1-8835-0d51c33dc480,2020-06-05,12:00:00,19357,c1b97171-b295-45aa-83a5-195a51e337d3,3e3981b5-8e30-42f9-bf6f-ac0a8c9657ec,5,Kia,"Consequuntur velit optio expedita voluptatibus. Quos labore eligendi tempora.
Adipisci cumque ab voluptatem consectetur. Voluptas quia fugiat animi beatae aperiam suscipit.",2020-06-05,13:38:10
"Mörfelder Landstraße 362, 60528 Frankfurt am Main",e6930b99-e8ca-49f8-9583-89f54366dc14,2020-06-05,20:00:00,6571,c1b97171-b295-45aa-83a5-195a51e337d3,91b017b6-1240-4e49-a614-7f935f38b635,2,Porsche,"Quo aperiam perspiciatis error totam quisquam reiciendis. Incidunt non fugiat.
Id quos modi asperiores sunt ipsam. Eum nisi consequatur consequuntur.",2020-06-05,02:06:33
"Xaver-Fuhr-Straße 101, 68163 Mannheim",2ab60824-b539-4a1f-ae1a-f7d94d2d55bb,2020-04-04,19:00:00,79117,b3a37c80-d6c5-4cd5-8623-17342d44c310,77ba44e3-8ffd-4c12-bb2a-fea57ad6b5bc,5,Mitsubishi,Dolores maxime ullam aliquid rerum dolorem accusamus. Modi accusamus culpa similique a iusto.,2020-04-04,17:56:22
"Rheinlanddamm 200, 44139 Dortmund",7be626b0-c1cd-4a26-a111-60afb13ba940,2020-04-30,17:00:00,6679,93685f30-f13a-4d7c-9d17-67f75ed1fa6a,4b4f3d1d-8c7d-4a13-864b-cef272baed84,3,Fisker,"Laudantium doloribus quod vitae. Laboriosam modi ducimus aliquid illo repudiandae optio.
Incidunt rem blanditiis ullam iusto iure. Amet sapiente repudiandae a optio porro illo.",2020-04-30,19:24:25
"Rheinlanddamm 200, 44139 Dortmund",7be626b0-c1cd-4a26-a111-60afb13ba940,2020-04-30,17:00:00,54570,44ece424-f219-4062-a7e8-80358c867d47,38654bb4-d482-4169-8d4c-c48f0004715f,3,Land Rover,"Eaque consequuntur nulla dolor hic consequuntur. Aperiam optio eveniet. Magni ipsam quos.
Vero mollitia et ab. Exercitationem quidem modi cumque architecto debitis.
Nisi eius hic omnis rerum sint.",2020-04-30,19:40:14
"Xaver-Fuhr-Straße 101, 68163 Mannheim",2ab60824-b539-4a1f-ae1a-f7d94d2d55bb,2020-04-04,19:00:00,19217,7b3ae5fd-286e-40d1-a73f-24dcaa036fff,0d385bc0-9f53-4c4c-a33d-5470f095b1e6,2,Lamborghini,"Error quidem aperiam nisi quidem non. Suscipit expedita tenetur nulla.
Voluptates ducimus fuga dolorum excepturi necessitatibus possimus repellat. Magni iure quidem aut.",2020-04-04,02:07:10
"Otto-Flimm-Straße, 53520 Nürburg",eff7e9ae-9c58-42e1-8835-0d51c33dc480,2020-06-05,12:00:00,14913,de6890e2-e3fa-4776-bf10-a9cfedbee9c0,ff7922be-9fca-4e25-9de6-ffff54ea5af0,4,Chrysler,"Iusto sint soluta repellendus hic. Dicta culpa facilis maiores corporis modi.
Eveniet dolore dolores corrupti ad perferendis. Soluta et aliquam.",2020-06-05,17:02:35
"Otto-Flimm-Straße, 53520 Nürburg",eff7e9ae-9c58-42e1-8835-0d51c33dc480,2020-06-05,12:00:00,35716,f3526adc-3719-4a1b-8ceb-5585b0e4a70c,086a433d-bd8c-4ff4-96fe-084c7e005443,1,Seat,Officia neque quidem voluptatem atque. Eos magnam rem animi animi totam error eaque. Laborum aperiam ratione voluptatem rem.,2020-06-05,15:45:29
"Xaver-Fuhr-Straße 101, 68163 Mannheim",2ab60824-b539-4a1f-ae1a-f7d94d2d55bb,2020-04-04,19:00:00,80331,3898dff3-273f-4336-9015-7cfa53472e55,9686fabb-727b-451e-b71f-820a2266ba4c,3,Lada,Maiores distinctio labore tenetur reiciendis debitis eum et. Esse nostrum natus sequi impedit et. Ipsum alias ratione ab voluptate.,2020-04-04,22:16:02
"Xaver-Fuhr-Straße 101, 68163 Mannheim",2ab60824-b539-4a1f-ae1a-f7d94d2d55bb,2020-04-04,19:00:00,15864,2448380d-cfe7-4e57-86dd-1f87c65a154f,8181f64e-d71c-4a8e-ba5b-1c05b8b0d8e4,3,Honda,"Dolores ullam tempora fuga nostrum animi voluptate nulla.
Vitae quia iste sequi natus commodi est accusantium. Architecto minus occaecati expedita. Aut nam placeat ipsam quisquam assumenda.",2020-04-04,21:17:19
"Mörfelder Landstraße 362, 60528 Frankfurt am Main",e6930b99-e8ca-49f8-9583-89f54366dc14,2020-06-05,20:00:00,36115,534db7fe-5988-4bc8-8061-b398b75090b8,e6355325-4f02-436e-85be-8c05bf5c5289,5,Chevrolet,"Doloremque quibusdam optio assumenda.
Voluptate eos architecto nihil. Eaque illo numquam laboriosam. Aliquam neque assumenda recusandae veniam.",2020-06-05,17:57:16
"Rheinlanddamm 200, 44139 Dortmund",7be626b0-c1cd-4a26-a111-60afb13ba940,2020-04-30,17:00:00,96274,fb645b0e-2b94-485e-8723-74654c5f7c4f,d486cd83-ffda-4d2c-9bfb-34293ac031e9,5,Chevrolet,Facilis quo unde mollitia magnam officiis. Quisquam eveniet similique beatae neque veniam. Sunt quis debitis voluptas odio.,2020-04-30,20:37:57
"Mörfelder Landstraße 362, 60528 Frankfurt am Main",e6930b99-e8ca-49f8-9583-89f54366dc14,2020-06-05,20:00:00,71732,9b49f405-1570-4944-880c-7b11e52344e8,996fcf8f-a323-4b92-8529-bd46c1103483,5,Landwind,Fuga commodi doloremque dolorum. Exercitationem perferendis ullam deserunt molestiae tenetur odio. Ratione tenetur dolor aliquid quidem aperiam magni fuga.,2020-06-05,14:20:32
"Xaver-Fuhr-Straße 101, 68163 Mannheim",2ab60824-b539-4a1f-ae1a-f7d94d2d55bb,2020-04-04,19:00:00,18320,8c9ae442-f783-4c0b-b016-460c422b4f1c,15068e34-2548-4ee7-911d-d08ccb573712,4,Hummer,Quis ea praesentium. Totam unde ea iste delectus illum commodi.,2020-04-04,12:27:56
"Otto-Flimm-Straße, 53520 Nürburg",eff7e9ae-9c58-42e1-8835-0d51c33dc480,2020-06-05,12:00:00,25557,7b3ae5fd-286e-40d1-a73f-24dcaa036fff,43c3e8c3-fed8-4bfd-a58e-e3d6cc35589c,1,Rolls-Royce,Minima labore tempora quos consequatur. Dolorem labore illo recusandae. Neque voluptas perferendis ratione sed dignissimos dolor quis.,2020-06-05,13:31:25
"Otto-Flimm-Straße, 53520 Nürburg",eff7e9ae-9c58-42e1-8835-0d51c33dc480,2020-06-05,12:00:00,85276,3f251716-6b1c-4228-8302-5acda300fd16,4828050f-19c5-4e42-a47a-3584b610ea28,5,Lancia,Debitis totam fugiat quisquam cupiditate qui ipsa distinctio. Nam distinctio quia. Sequi magni doloribus ipsa debitis atque tempora ducimus.,2020-06-05,20:51:31
"Mörfelder Landstraße 362, 60528 Frankfurt am Main",e6930b99-e8ca-49f8-9583-89f54366dc14,2020-06-05,20:00:00,35091,55c7a81d-2e4e-4356-be03-82034b2edbaf,63d7a2b5-f932-4bb7-929d-b6f1d43e056a,4,Chevrolet,Sequi aut sunt alias incidunt nostrum eligendi. Iure reiciendis deleniti earum. Eveniet corrupti nam ipsa. Cupiditate fuga et distinctio possimus quasi.,2020-06-05,14:22:48
"Otto-Flimm-Straße, 53520 Nürburg",eff7e9ae-9c58-42e1-8835-0d51c33dc480,2020-06-05,12:00:00,39615,e532d7bb-12e9-4762-8b90-5ed7da27a848,e015fc0f-7eb7-4448-9189-6110549642b6,5,Citroën,Culpa provident et ipsum animi vel repellendus. Non fugit rerum suscipit sint. Maxime consectetur sed eos eos animi.,2020-06-05,19:28:41
"Xaver-Fuhr-Straße 101, 68163 Mannheim",2ab60824-b539-4a1f-ae1a-f7d94d2d55bb,2020-04-04,19:00:00,14778,da6217c3-d4a0-4969-b1c3-884928fce8aa,3b8ff7a0-0c18-4906-b653-bae374f746e3,4,Lancia,Distinctio quas possimus accusamus. Consequuntur accusamus dolore tempora illum. Ab ipsa tenetur.,2020-04-04,04:08:52
"Otto-Flimm-Straße, 53520 Nürburg",eff7e9ae-9c58-42e1-8835-0d51c33dc480,2020-06-05,12:00:00,84405,2187e1a2-ed3c-4fea-874b-8895134b791e,616409b1-32b2-4210-ba82-c1055f5bea53,4,Renault,Similique doloremque dolore provident earum ipsum. Aliquid delectus inventore voluptatibus ab. Quasi aut omnis laborum vero commodi doloribus explicabo.,2020-06-05,21:16:07
"Rheinlanddamm 200, 44139 Dortmund",7be626b0-c1cd-4a26-a111-60afb13ba940,2020-04-30,17:00:00,17291,4e4fd865-78c3-4caf-b3d1-7505c23fb886,f28b670f-da98-4d64-976c-0c95b3d83759,3,Nissan,Mollitia ad aliquam illo facilis accusantium. Minus eos earum nesciunt adipisci nemo.,2020-04-30,02:53:00
"Mörfelder Landstraße 362, 60528 Frankfurt am Main",e6930b99-e8ca-49f8-9583-89f54366dc14,2020-06-05,20:00:00,63872,2298de27-85af-4050-81d5-803a77ee8585,98ae1053-2040-43c8-9c39-9c7b51a86100,1,Bugatti,Veritatis maxime placeat excepturi nesciunt sequi. Possimus magnam nobis. Occaecati quas doloribus ea ducimus.,2020-06-05,00:39:56
"Mörfelder Landstraße 362, 60528 Frankfurt am Main",e6930b99-e8ca-49f8-9583-89f54366dc14,2020-06-05,20:00:00,55595,1787f010-08d5-497b-9de8-c6c7dd2dbbcd,71381e33-b668-497a-86b9-d6940e04e699,3,Bugatti,Maiores repellendus minima vel commodi blanditiis. Provident incidunt saepe dolorum aperiam cupiditate suscipit. Officia unde earum quo hic necessitatibus.,2020-06-05,19:17:08
"Xaver-Fuhr-Straße 101, 68163 Mannheim",2ab60824-b539-4a1f-ae1a-f7d94d2d55bb,2020-04-04,19:00:00,93479,f3d07804-cd4e-4239-80ad-79b88a622d6f,7009731a-663a-4604-99dc-5086ebecd6b4,4,Mazda,Officiis corporis fugit tempora omnis eius laborum. Voluptate nam itaque dolorem voluptatum optio minus. Dicta repudiandae cupiditate animi ipsa delectus soluta.,2020-04-04,04:51:51
"Rheinlanddamm 200, 44139 Dortmund",7be626b0-c1cd-4a26-a111-60afb13ba940,2020-04-30,17:00:00,6712,b3a37c80-d6c5-4cd5-8623-17342d44c310,4d19d2e2-65c4-4cbd-b39e-65fe26fa5bcf,1,Audi,"A explicabo nemo temporibus. Dignissimos soluta distinctio facere.
Placeat numquam repudiandae repudiandae accusamus ut corporis. Molestiae ratione id animi cupiditate ducimus laborum.",2020-04-30,12:14:15
"Xaver-Fuhr-Straße 101, 68163 Mannheim",2ab60824-b539-4a1f-ae1a-f7d94d2d55bb,2020-04-04,19:00:00,17440,a5c245ef-f903-44ae-9252-4619eb7bd52d,a1ddb22a-a1b8-4f84-8744-d3eb13cbfea5,1,Citroën,"Dolorum quo mollitia quod esse amet. Earum illo maxime corrupti.
Molestiae beatae quia assumenda dolores expedita cum. Velit cumque suscipit corporis numquam sapiente voluptatem.",2020-04-04,19:51:12
"Otto-Flimm-Straße, 53520 Nürburg",eff7e9ae-9c58-42e1-8835-0d51c33dc480,2020-06-05,12:00:00,8541,4bbbac5e-850c-46cd-bc5d-5fe77e9b55e8,cecee8be-7892-4040-ab2d-4658608c3f25,4,Ford,Quas asperiores id id doloremque. Asperiores inventore hic eum dolor fugit cumque. Vitae dignissimos dolorum doloremque harum.,2020-06-05,04:41:13
