journey_id,reservation_requested_seats,journey_empty_spaces,reservation_text,user_id,journey_user_id
7870a3f9-4b3f-4b57-b93d-da0b5be87a43,1,1,Neque earum quibusdam impedit possimus. Ducimus non repellendus eaque molestias. Enim occaecati eum ipsam. Neque in odit sed odio voluptatum.,2050b9dc-7990-4304-a614-26192c3498f9,58d96f87-c364-4582-8e54-76b099a96ccd
199d078e-4afb-4556-844f-e2b27593c5e2,4,5,"Quidem excepturi vitae vitae natus distinctio iste laboriosam. Hic cum repellendus. Molestias minima quibusdam ullam.
Tenetur enim aspernatur eaque sed. Porro cum omnis dignissimos sit nam.",2f887a39-08f5-4829-b810-627c22b9d722,ba516a17-7aff-4080-b0ab-5e6da78aa02b
8b18113d-9dc3-4fde-b17b-4f7dc8c7e56f,5,4,Eaque minima nihil enim exercitationem nostrum distinctio. Inventore veritatis iste sed ad. Ea et quasi culpa tempore dolore.,27eedc15-fd85-426c-a66f-310bcb7a982a,9b70d827-b5eb-4f1a-a22a-bfebe58a5b64
596a49a7-766d-4166-aebd-9d2551443543,4,5,Perferendis nobis fugit amet ratione corporis fuga animi. Expedita maxime optio occaecati. Nostrum et aperiam expedita. Eaque culpa perspiciatis pariatur natus dolor.,346096cc-b55b-4ad1-937e-349beaf98af0,60a3bcf6-1480-41e2-9c6f-eec7642a0f60
199d078e-4afb-4556-844f-e2b27593c5e2,5,5,Officia voluptas aperiam molestias distinctio. Explicabo laborum delectus ipsum distinctio officiis nemo. Minima dignissimos placeat.,ec0467f6-711f-4ab3-8ada-f4f136fd7db0,ba516a17-7aff-4080-b0ab-5e6da78aa02b
199d078e-4afb-4556-844f-e2b27593c5e2,5,5,Non optio optio placeat tempore harum porro. Magni error reiciendis. Repellendus pariatur blanditiis repellendus modi at animi.,9a6aa9e6-e9c9-4f1e-b41d-73c486a592b2,ba516a17-7aff-4080-b0ab-5e6da78aa02b
8b18113d-9dc3-4fde-b17b-4f7dc8c7e56f,5,4,Ipsum cum porro facilis. Necessitatibus dicta tenetur a. Totam aspernatur rem sapiente pariatur deleniti.,f9d82ec4-5acb-4d22-a1fe-8e08e09a56b6,9b70d827-b5eb-4f1a-a22a-bfebe58a5b64
596a49a7-766d-4166-aebd-9d2551443543,5,5,Modi necessitatibus odit error numquam. Corporis fugiat assumenda asperiores cum repudiandae reiciendis. A iste facilis culpa blanditiis nulla molestias commodi.,5c0e8357-2b51-44e4-8d43-38f58166be37,60a3bcf6-1480-41e2-9c6f-eec7642a0f60
7870a3f9-4b3f-4b57-b93d-da0b5be87a43,4,1,Blanditiis porro temporibus. Accusantium repellat voluptates tempora debitis cum provident.,370ce4eb-971c-4cab-86ba-dbea8d7fe270,58d96f87-c364-4582-8e54-76b099a96ccd
8b18113d-9dc3-4fde-b17b-4f7dc8c7e56f,4,4,Est aliquid laborum nulla. Atque nisi nemo. Iste temporibus a et soluta neque.,8400bce6-caec-4bd1-8eed-46bc73ebd4b2,9b70d827-b5eb-4f1a-a22a-bfebe58a5b64
199d078e-4afb-4556-844f-e2b27593c5e2,3,5,Voluptas labore accusantium provident. Ut minima nobis facilis vel ipsum similique sit. Numquam impedit sit inventore facilis ullam possimus.,021077ae-9dea-4f86-9487-8df8c19c7344,ba516a17-7aff-4080-b0ab-5e6da78aa02b
7870a3f9-4b3f-4b57-b93d-da0b5be87a43,1,1,Iste consectetur odio voluptates eum a. Cum magnam error optio. Corporis veritatis officiis iusto autem quod debitis tempora.,2050b9dc-7990-4304-a614-26192c3498f9,58d96f87-c364-4582-8e54-76b099a96ccd
7870a3f9-4b3f-4b57-b93d-da0b5be87a43,4,1,Ea quasi quia. Accusantium quasi nisi cum. Aspernatur cum eos tempora a distinctio doloremque minus.,3cd89c35-ef59-49f7-bcb8-922439b338af,58d96f87-c364-4582-8e54-76b099a96ccd
199d078e-4afb-4556-844f-e2b27593c5e2,4,5,Molestias reiciendis perferendis deserunt natus dolores perferendis. Dolor soluta dolor consectetur. Aliquam modi mollitia quo accusantium laborum.,eef254dc-831a-42ef-9d85-d8e3dff5b720,ba516a17-7aff-4080-b0ab-5e6da78aa02b
596a49a7-766d-4166-aebd-9d2551443543,2,5,"Cupiditate iure sit dicta.
Minima nostrum magni id doloremque quae consectetur. Totam qui totam fugit eveniet facilis. Nemo enim fuga suscipit a perspiciatis earum.",9b1618d3-225a-4ae3-9984-e192bb5640dd,60a3bcf6-1480-41e2-9c6f-eec7642a0f60
7870a3f9-4b3f-4b57-b93d-da0b5be87a43,1,1,Minima quae molestiae ducimus accusantium atque. Molestiae nulla voluptatibus ratione molestias ipsa aperiam nisi. Unde labore minus quaerat in adipisci.,370ce4eb-971c-4cab-86ba-dbea8d7fe270,58d96f87-c364-4582-8e54-76b099a96ccd
8b18113d-9dc3-4fde-b17b-4f7dc8c7e56f,1,4,Fuga magnam accusamus enim eos quos dolores. Enim quo eum nostrum recusandae consequuntur quisquam. Ullam nesciunt dicta neque.,ad357e85-7ea4-48d6-b819-f70d85920d5b,9b70d827-b5eb-4f1a-a22a-bfebe58a5b64
199d078e-4afb-4556-844f-e2b27593c5e2,4,5,"Officia deleniti illum voluptates. Maxime vero eveniet ipsa facere. Iste provident velit consequatur quidem.
Officia amet facilis odit accusamus iure. Repellat totam porro quam.",12406f81-487a-4996-806a-e3d18b5cca73,ba516a17-7aff-4080-b0ab-5e6da78aa02b
596a49a7-766d-4166-aebd-9d2551443543,4,5,"Iste doloremque et cum sit reiciendis iste dolore. At iure at ex.
Aliquam voluptas cum est unde. Nulla natus aspernatur exercitationem voluptas dolorem odit. Dolorem dolores veritatis veniam.",05bd2767-62ae-4992-a1b9-b339b6e37a59,60a3bcf6-1480-41e2-9c6f-eec7642a0f60
7870a3f9-4b3f-4b57-b93d-da0b5be87a43,3,1,"Fuga ipsam voluptas recusandae dolore itaque non cumque. Exercitationem vero quaerat quo fugit asperiores. Tenetur eligendi molestias assumenda.
Dolor minima omnis sunt illum.",6f31e962-0976-4544-9a15-db4539d779b8,58d96f87-c364-4582-8e54-76b099a96ccd
7870a3f9-4b3f-4b57-b93d-da0b5be87a43,5,1,Ex sunt nemo odio beatae dolorum neque. Error blanditiis aliquam quisquam consequuntur.,5d68cdca-0448-479c-ad78-ad2c989d7c9c,58d96f87-c364-4582-8e54-76b099a96ccd
7870a3f9-4b3f-4b57-b93d-da0b5be87a43,5,1,"Eaque consequatur amet unde minus incidunt deserunt eum.
Dolorem ducimus sed ullam aspernatur magni pariatur. Nam animi adipisci laboriosam excepturi impedit.",b6f9add8-297e-4886-9550-21a1275f4598,58d96f87-c364-4582-8e54-76b099a96ccd
199d078e-4afb-4556-844f-e2b27593c5e2,3,5,Voluptatibus nesciunt laborum accusantium nemo nulla. Qui odit iusto corrupti. Eaque quibusdam quisquam et earum consequuntur quis.,9668da27-59fb-4cf7-ac57-ba0257a45e4c,ba516a17-7aff-4080-b0ab-5e6da78aa02b
199d078e-4afb-4556-844f-e2b27593c5e2,3,5,"Asperiores eius tenetur consectetur. Numquam nesciunt corporis tempora suscipit qui.
Officiis earum voluptates. Ut tempore deleniti aspernatur. Natus reiciendis omnis. Nobis nihil maxime deleniti.",a431eba4-7b68-4761-b82b-100acf19f6e8,ba516a17-7aff-4080-b0ab-5e6da78aa02b
8b18113d-9dc3-4fde-b17b-4f7dc8c7e56f,2,4,Voluptatum quam eaque omnis omnis dicta. Amet eos quasi aliquam iste modi distinctio. Laborum soluta reiciendis inventore repellendus deserunt.,60a3bcf6-1480-41e2-9c6f-eec7642a0f60,9b70d827-b5eb-4f1a-a22a-bfebe58a5b64
596a49a7-766d-4166-aebd-9d2551443543,5,5,"Accusamus modi neque maxime beatae tempora.
Quam illum corporis corrupti at quasi. Nihil ut officiis consequatur deserunt. Eveniet cupiditate porro nesciunt.",05bd2767-62ae-4992-a1b9-b339b6e37a59,60a3bcf6-1480-41e2-9c6f-eec7642a0f60
7870a3f9-4b3f-4b57-b93d-da0b5be87a43,3,1,Similique incidunt ullam nemo eius sit. Molestias similique ea provident accusantium harum tempore. Reiciendis quo fugit voluptatum.,60a3bcf6-1480-41e2-9c6f-eec7642a0f60,58d96f87-c364-4582-8e54-76b099a96ccd
8b18113d-9dc3-4fde-b17b-4f7dc8c7e56f,4,4,Quaerat autem dolorum saepe minus fugiat. Consectetur quibusdam dolores voluptatum.,e928afc8-1e4d-49d0-8123-3b9f72122641,9b70d827-b5eb-4f1a-a22a-bfebe58a5b64
596a49a7-766d-4166-aebd-9d2551443543,1,5,"Libero velit facilis amet magni illo. Molestias veniam quae reprehenderit ullam quibusdam fugit.
Commodi id nisi numquam.
Ducimus accusamus ipsa. Asperiores expedita explicabo illo ut laborum.",b123a906-4877-4bb1-93ec-309ede18c44d,60a3bcf6-1480-41e2-9c6f-eec7642a0f60
7870a3f9-4b3f-4b57-b93d-da0b5be87a43,1,1,"Consequuntur quod magni aut. Sapiente accusamus error officiis quasi.
Nihil eos quibusdam cumque a consectetur. Voluptas tempora architecto.",9b70d827-b5eb-4f1a-a22a-bfebe58a5b64,58d96f87-c364-4582-8e54-76b099a96ccd
7870a3f9-4b3f-4b57-b93d-da0b5be87a43,3,1,Unde illum odit modi rerum consequuntur. Quidem quia et tempore eligendi eaque quod magnam.,f9d82ec4-5acb-4d22-a1fe-8e08e09a56b6,58d96f87-c364-4582-8e54-76b099a96ccd
199d078e-4afb-4556-844f-e2b27593c5e2,4,5,"Facilis accusamus vel quia. Nisi nesciunt dolores saepe nobis sapiente. Voluptatibus rem iusto omnis temporibus debitis illo.
Ab blanditiis mollitia numquam itaque. Quia aliquam eligendi quos.",8581fab5-bbcf-4ffa-bac5-33e0aed58a93,ba516a17-7aff-4080-b0ab-5e6da78aa02b
199d078e-4afb-4556-844f-e2b27593c5e2,4,5,Officia odit hic nihil quis quam nisi doloremque. Sapiente eius quasi in officia dicta officia. Officia amet blanditiis reprehenderit id occaecati.,9b1618d3-225a-4ae3-9984-e192bb5640dd,ba516a17-7aff-4080-b0ab-5e6da78aa02b
7870a3f9-4b3f-4b57-b93d-da0b5be87a43,1,1,"Debitis ipsam blanditiis veniam.
Neque accusantium nostrum minima. Repudiandae excepturi nam cum omnis dicta.",2050b9dc-7990-4304-a614-26192c3498f9,58d96f87-c364-4582-8e54-76b099a96ccd
8b18113d-9dc3-4fde-b17b-4f7dc8c7e56f,4,4,"Dicta odio vero veritatis. Ratione doloribus quibusdam fugit recusandae quasi.
Modi vel quaerat blanditiis alias. Veniam explicabo nemo provident ipsum asperiores accusamus.",49011016-fd7f-431b-a7b4-f7bbf91367a8,9b70d827-b5eb-4f1a-a22a-bfebe58a5b64
8b18113d-9dc3-4fde-b17b-4f7dc8c7e56f,5,4,"Fugit non ipsam rerum. Molestiae unde reiciendis autem dignissimos. Nulla excepturi quod.
Fuga in dicta dicta adipisci atque nulla. Atque eos sed reiciendis doloribus suscipit velit vero.",40088021-f844-457a-98ce-b9fa89eedbf7,9b70d827-b5eb-4f1a-a22a-bfebe58a5b64
8b18113d-9dc3-4fde-b17b-4f7dc8c7e56f,4,4,"Tenetur error harum architecto corporis. Ratione maxime sed delectus. Similique eius non.
Eum et ipsa debitis fuga nulla.",39142fc1-1c6d-4778-b091-40975831c5d9,9b70d827-b5eb-4f1a-a22a-bfebe58a5b64
199d078e-4afb-4556-844f-e2b27593c5e2,5,5,"Amet non consequuntur molestias distinctio.
Eveniet cumque recusandae ducimus ratione dicta in. Laudantium placeat occaecati tenetur velit saepe dolorum dicta.",ad357e85-7ea4-48d6-b819-f70d85920d5b,ba516a17-7aff-4080-b0ab-5e6da78aa02b
596a49a7-766d-4166-aebd-9d2551443543,3,5,Quod ad mollitia eum iusto quos. Libero animi eveniet. Quos porro possimus ratione ipsa delectus.,090ecc33-f292-4626-a84e-86d83516ad76,60a3bcf6-1480-41e2-9c6f-eec7642a0f60
199d078e-4afb-4556-844f-e2b27593c5e2,5,5,Quae accusamus saepe possimus ad accusamus. Porro omnis distinctio dicta consequatur ipsam. Asperiores quam vitae officia qui.,734a2fb2-f740-4d9f-945d-6360dd1ac6c6,ba516a17-7aff-4080-b0ab-5e6da78aa02b
7870a3f9-4b3f-4b57-b93d-da0b5be87a43,2,1,Qui cumque consectetur officiis corrupti. Blanditiis eligendi maxime id odit dignissimos cum.,40088021-f844-457a-98ce-b9fa89eedbf7,58d96f87-c364-4582-8e54-76b099a96ccd
8b18113d-9dc3-4fde-b17b-4f7dc8c7e56f,1,4,"Accusantium quo officiis quidem quae voluptates. Iure nisi numquam placeat.
Eius animi repudiandae veritatis ad debitis tempora tempora. Voluptates minus qui. Nihil iusto eius eius quod.",eef254dc-831a-42ef-9d85-d8e3dff5b720,9b70d827-b5eb-4f1a-a22a-bfebe58a5b64
596a49a7-766d-4166-aebd-9d2551443543,2,5,Accusantium dolores nisi nisi odit ullam omnis accusantium. Quos ex ipsam recusandae inventore ad omnis laboriosam. Cum illo hic.,a929aea5-946c-4d96-8db4-43600d2d95eb,60a3bcf6-1480-41e2-9c6f-eec7642a0f60
596a49a7-766d-4166-aebd-9d2551443543,2,5,"Impedit porro voluptates amet totam. Repellendus maxime nemo nam.
Quasi non consequuntur. Amet quam sapiente magni aspernatur molestias.",05bd2767-62ae-4992-a1b9-b339b6e37a59,60a3bcf6-1480-41e2-9c6f-eec7642a0f60
8b18113d-9dc3-4fde-b17b-4f7dc8c7e56f,1,4,Perspiciatis error autem nostrum maiores laudantium sed. Ipsam molestias minus ullam vel a voluptatibus. Ipsa sunt magni accusamus.,182d0a76-8ecf-40e1-b8ce-38f414952c77,9b70d827-b5eb-4f1a-a22a-bfebe58a5b64
596a49a7-766d-4166-aebd-9d2551443543,3,5,Vitae magni quos vitae. Quam dolor cupiditate quas provident dicta perspiciatis itaque.,e77d26ba-472b-44d4-9dc0-e660461a28a2,60a3bcf6-1480-41e2-9c6f-eec7642a0f60
7870a3f9-4b3f-4b57-b93d-da0b5be87a43,5,1,"Velit vel fugit quibusdam. Incidunt odio voluptate illum dolore.
Dolore quas eius. Illum quibusdam explicabo nemo nulla. Porro ducimus eius dolores vero deleniti.",a8642357-ae78-4dda-9253-b9b3ed2b837e,58d96f87-c364-4582-8e54-76b099a96ccd
596a49a7-766d-4166-aebd-9d2551443543,1,5,"Nesciunt cum rem similique dicta in. Id repellendus similique saepe explicabo dolorem. Voluptas esse facilis possimus in voluptas.
Deleniti exercitationem magni.",a929aea5-946c-4d96-8db4-43600d2d95eb,60a3bcf6-1480-41e2-9c6f-eec7642a0f60
596a49a7-766d-4166-aebd-9d2551443543,2,5,"Harum accusamus reprehenderit necessitatibus ab. Similique temporibus ea voluptatum.
Beatae quisquam corporis sequi sequi consectetur architecto. Est error impedit aliquid mollitia accusamus.",8400bce6-caec-4bd1-8eed-46bc73ebd4b2,60a3bcf6-1480-41e2-9c6f-eec7642a0f60
199d078e-4afb-4556-844f-e2b27593c5e2,1,5,"Velit similique amet inventore maxime. Ratione architecto beatae iure enim sit.
Laboriosam delectus voluptate explicabo eaque eveniet sequi harum. Aut sequi quam fugit quos atque architecto.",6ad91709-19a5-4c97-9a4d-9151862eddde,ba516a17-7aff-4080-b0ab-5e6da78aa02b
7870a3f9-4b3f-4b57-b93d-da0b5be87a43,2,1,"Aliquid a beatae tempore dolorem quibusdam suscipit. Distinctio nesciunt possimus magnam aperiam. Est maxime magnam.
Quis magnam ad aliquam debitis possimus odio architecto.",5987dc9a-3176-449f-ad7d-20c942141cc5,58d96f87-c364-4582-8e54-76b099a96ccd
7870a3f9-4b3f-4b57-b93d-da0b5be87a43,4,1,Voluptatem sequi commodi excepturi enim nostrum possimus. Asperiores ab maiores consequatur reiciendis dolor. Et vero accusamus repudiandae blanditiis recusandae placeat.,5eeb15f3-d3f0-49e3-be8c-ed4779aa1b8f,58d96f87-c364-4582-8e54-76b099a96ccd
199d078e-4afb-4556-844f-e2b27593c5e2,1,5,Rerum similique mollitia quasi minus quos maxime. Consequatur consequuntur magnam aperiam. Cum eos cupiditate explicabo esse.,6f31e962-0976-4544-9a15-db4539d779b8,ba516a17-7aff-4080-b0ab-5e6da78aa02b
596a49a7-766d-4166-aebd-9d2551443543,4,5,Quos praesentium quam. Harum sapiente fugit quaerat sapiente omnis repellat. Magnam nobis inventore iste.,24c57f2e-222d-4885-be3d-5e1330953e56,60a3bcf6-1480-41e2-9c6f-eec7642a0f60
7870a3f9-4b3f-4b57-b93d-da0b5be87a43,3,1,Eos exercitationem quaerat impedit. Dolorem sunt accusamus repellat omnis vitae praesentium assumenda.,e928afc8-1e4d-49d0-8123-3b9f72122641,58d96f87-c364-4582-8e54-76b099a96ccd
8b18113d-9dc3-4fde-b17b-4f7dc8c7e56f,3,4,Dolore quidem hic saepe sint praesentium nostrum magnam. Ut sed accusamus odit sapiente. Rem ipsum nihil eaque vel.,e7dade02-1b46-4a60-aac4-c3fff40fe63f,9b70d827-b5eb-4f1a-a22a-bfebe58a5b64
7870a3f9-4b3f-4b57-b93d-da0b5be87a43,1,1,Molestias voluptate neque sint alias vel. Facilis quisquam recusandae. Soluta similique dolor illum voluptatem culpa fugit aspernatur.,4f3c2411-05a3-428e-9f26-166106469564,58d96f87-c364-4582-8e54-76b099a96ccd
7870a3f9-4b3f-4b57-b93d-da0b5be87a43,2,1,Nisi officiis impedit perspiciatis veniam tempora. Quam aperiam voluptates similique. Voluptate tenetur blanditiis distinctio dolores.,5eeb15f3-d3f0-49e3-be8c-ed4779aa1b8f,58d96f87-c364-4582-8e54-76b099a96ccd
7870a3f9-4b3f-4b57-b93d-da0b5be87a43,3,1,Praesentium explicabo molestias magnam laborum culpa deleniti. Beatae voluptatibus saepe quasi porro quos odit.,8581fab5-bbcf-4ffa-bac5-33e0aed58a93,58d96f87-c364-4582-8e54-76b099a96ccd
596a49a7-766d-4166-aebd-9d2551443543,5,5,"Occaecati soluta corrupti non dignissimos. Culpa optio itaque placeat incidunt.
Cum exercitationem nesciunt placeat perferendis nam debitis. Architecto soluta sequi blanditiis reiciendis.",a8642357-ae78-4dda-9253-b9b3ed2b837e,60a3bcf6-1480-41e2-9c6f-eec7642a0f60
596a49a7-766d-4166-aebd-9d2551443543,4,5,Tempora illo enim fugit laborum dolorem ratione placeat. Placeat laboriosam suscipit maxime a expedita assumenda. Rem repellendus veniam sit.,9bedea62-c758-4268-b279-22934532de30,60a3bcf6-1480-41e2-9c6f-eec7642a0f60
8b18113d-9dc3-4fde-b17b-4f7dc8c7e56f,4,4,"Libero mollitia ipsa. Modi nihil odio molestiae reprehenderit.
Sint vero possimus consequatur odit eos.
Laboriosam enim voluptatibus aliquid quaerat. Numquam molestiae nulla nam qui.",e8d0a594-c49a-4a56-bb99-45ebb5c01d4f,9b70d827-b5eb-4f1a-a22a-bfebe58a5b64
199d078e-4afb-4556-844f-e2b27593c5e2,4,5,Provident saepe recusandae repellat aperiam. Ipsum quidem tempora.,0e2ef53a-7b77-4852-abb1-5a7e63c05c1c,ba516a17-7aff-4080-b0ab-5e6da78aa02b
199d078e-4afb-4556-844f-e2b27593c5e2,2,5,Iusto soluta voluptatum inventore. Quas porro voluptatem natus ab doloribus explicabo. Unde ea recusandae id. Non ex quod voluptatibus alias ipsa ex excepturi.,d5065c36-571b-4cbe-a42b-ee1234c99e38,ba516a17-7aff-4080-b0ab-5e6da78aa02b
7870a3f9-4b3f-4b57-b93d-da0b5be87a43,4,1,"Quibusdam error saepe ratione. Distinctio aspernatur reprehenderit libero minima. Facilis voluptas quaerat laborum quam dolorem.
Quisquam quisquam quae. Vero nulla consequuntur voluptatem.",a7cd15c9-dda8-486d-ba50-48e7c24bf994,58d96f87-c364-4582-8e54-76b099a96ccd
596a49a7-766d-4166-aebd-9d2551443543,3,5,Sapiente vel itaque eveniet a et voluptates. Perferendis rerum optio itaque eos debitis vero. Neque molestiae perspiciatis consequuntur facere.,9a6aa9e6-e9c9-4f1e-b41d-73c486a592b2,60a3bcf6-1480-41e2-9c6f-eec7642a0f60
7870a3f9-4b3f-4b57-b93d-da0b5be87a43,4,1,Id doloremque alias commodi. Dignissimos alias nam eaque voluptates dolor ex. Atque cum explicabo qui sed cum.,c9c73437-2299-4f90-9104-c078dd6f3cc4,58d96f87-c364-4582-8e54-76b099a96ccd
7870a3f9-4b3f-4b57-b93d-da0b5be87a43,4,1,Vitae est quam sequi non sint ullam. Quas labore id quidem iusto. Laudantium doloribus libero dolores. Reprehenderit iusto iste beatae doloremque expedita.,9b1618d3-225a-4ae3-9984-e192bb5640dd,58d96f87-c364-4582-8e54-76b099a96ccd
199d078e-4afb-4556-844f-e2b27593c5e2,3,5,"Sunt minima assumenda quisquam consequatur. Cupiditate soluta tempore debitis voluptates sunt eveniet.
Ipsa dicta dolorem culpa. Adipisci corporis commodi aspernatur.",d76d4b5e-67e4-4a6e-8304-9a2c8e3a9fd0,ba516a17-7aff-4080-b0ab-5e6da78aa02b
8b18113d-9dc3-4fde-b17b-4f7dc8c7e56f,2,4,"Rerum nam pariatur suscipit. Similique placeat quod ipsum temporibus architecto animi. Quisquam autem fugiat excepturi adipisci.
Sequi possimus omnis mollitia qui itaque.",27eedc15-fd85-426c-a66f-310bcb7a982a,9b70d827-b5eb-4f1a-a22a-bfebe58a5b64
7870a3f9-4b3f-4b57-b93d-da0b5be87a43,4,1,Laboriosam ipsam deleniti aut. Ratione quasi corporis atque. Saepe molestias aperiam culpa.,16ab5725-c530-40a7-ab8d-91e679e02fc2,58d96f87-c364-4582-8e54-76b099a96ccd
8b18113d-9dc3-4fde-b17b-4f7dc8c7e56f,1,4,"Eius provident maxime ipsum esse beatae quod. Reprehenderit eveniet dolor excepturi.
Incidunt voluptatum autem porro culpa id occaecati. Laborum porro cupiditate dolor assumenda.",60a3bcf6-1480-41e2-9c6f-eec7642a0f60,9b70d827-b5eb-4f1a-a22a-bfebe58a5b64
7870a3f9-4b3f-4b57-b93d-da0b5be87a43,4,1,"Eos est doloribus. Quisquam deleniti esse blanditiis.
Facilis voluptatem harum sed. Voluptas enim cumque exercitationem sit at nostrum. Animi dicta magnam sapiente veniam quos fugiat qui.",9b70d827-b5eb-4f1a-a22a-bfebe58a5b64,58d96f87-c364-4582-8e54-76b099a96ccd
199d078e-4afb-4556-844f-e2b27593c5e2,1,5,Amet aliquam soluta voluptas necessitatibus voluptas. Id unde dolor veritatis omnis. Minus autem nobis quae aut vel cum enim.,b67b9d85-7d42-4d46-8b00-b01fc0238909,ba516a17-7aff-4080-b0ab-5e6da78aa02b
596a49a7-766d-4166-aebd-9d2551443543,3,5,"Officia voluptas deleniti. Officiis quas labore provident.
Impedit inventore perferendis recusandae voluptate expedita voluptas.",613aa5a3-f215-4066-ba1a-dc603fc0e6ad,60a3bcf6-1480-41e2-9c6f-eec7642a0f60
8b18113d-9dc3-4fde-b17b-4f7dc8c7e56f,1,4,Quae repudiandae perspiciatis consequatur ad. Atque officiis illo eum error cupiditate optio esse. Dicta magni ab quas id. Voluptate debitis excepturi distinctio exercitationem iste deserunt beatae.,ff65592c-fd29-4d18-a1e2-f5398ab4192d,9b70d827-b5eb-4f1a-a22a-bfebe58a5b64
596a49a7-766d-4166-aebd-9d2551443543,1,5,Cumque cupiditate maiores omnis iusto ab. Provident error explicabo earum. Saepe magni quibusdam voluptate excepturi. Et ducimus beatae deleniti.,a7cd15c9-dda8-486d-ba50-48e7c24bf994,60a3bcf6-1480-41e2-9c6f-eec7642a0f60
596a49a7-766d-4166-aebd-9d2551443543,4,5,Labore autem sapiente deserunt labore culpa. Id optio numquam soluta illum autem.,b67b9d85-7d42-4d46-8b00-b01fc0238909,60a3bcf6-1480-41e2-9c6f-eec7642a0f60
199d078e-4afb-4556-844f-e2b27593c5e2,1,5,Tempore praesentium magni nulla. Nam nobis soluta magni voluptates dolor vitae. Ea hic eius tempore necessitatibus fuga.,8c65b6d5-831a-46c6-a72c-784141761a99,ba516a17-7aff-4080-b0ab-5e6da78aa02b
199d078e-4afb-4556-844f-e2b27593c5e2,3,5,Maxime dicta inventore explicabo recusandae. Ipsam commodi excepturi distinctio soluta.,8c65b6d5-831a-46c6-a72c-784141761a99,ba516a17-7aff-4080-b0ab-5e6da78aa02b
199d078e-4afb-4556-844f-e2b27593c5e2,4,5,"Alias neque animi culpa. Iure beatae optio recusandae soluta suscipit dolores.
Iure quisquam impedit. Ad placeat optio magnam a eos.",c9c73437-2299-4f90-9104-c078dd6f3cc4,ba516a17-7aff-4080-b0ab-5e6da78aa02b
7870a3f9-4b3f-4b57-b93d-da0b5be87a43,3,1,Voluptate a temporibus autem omnis. Veniam inventore praesentium fugit ut voluptatem expedita. Esse veritatis sit neque dolore suscipit sit atque.,3cd89c35-ef59-49f7-bcb8-922439b338af,58d96f87-c364-4582-8e54-76b099a96ccd
199d078e-4afb-4556-844f-e2b27593c5e2,5,5,"Delectus est enim explicabo pariatur accusamus dolorum.
Pariatur molestias illo. Officia nam magnam porro. Consectetur autem tempora repellat quam a.",e8d0a594-c49a-4a56-bb99-45ebb5c01d4f,ba516a17-7aff-4080-b0ab-5e6da78aa02b
8b18113d-9dc3-4fde-b17b-4f7dc8c7e56f,2,4,Delectus accusantium quia molestias numquam illum similique. Alias soluta quo ea distinctio adipisci voluptas ullam.,5d68cdca-0448-479c-ad78-ad2c989d7c9c,9b70d827-b5eb-4f1a-a22a-bfebe58a5b64
596a49a7-766d-4166-aebd-9d2551443543,3,5,"Libero soluta vel ex.
Facilis eveniet error. Voluptas labore aliquid quae nam ipsam. Quidem vero libero ad totam corrupti enim. Maxime at sapiente alias commodi.",e8d0a594-c49a-4a56-bb99-45ebb5c01d4f,60a3bcf6-1480-41e2-9c6f-eec7642a0f60
199d078e-4afb-4556-844f-e2b27593c5e2,3,5,Aliquid numquam mollitia ipsum. Vero cupiditate atque dicta minima impedit iusto veritatis. Possimus magni quae.,f9d82ec4-5acb-4d22-a1fe-8e08e09a56b6,ba516a17-7aff-4080-b0ab-5e6da78aa02b
199d078e-4afb-4556-844f-e2b27593c5e2,2,5,"Impedit minus autem adipisci perferendis labore. Illo placeat aliquid culpa.
Eos accusantium cum repellendus dignissimos labore. Eos recusandae eius sequi necessitatibus voluptate.",a8642357-ae78-4dda-9253-b9b3ed2b837e,ba516a17-7aff-4080-b0ab-5e6da78aa02b
7870a3f9-4b3f-4b57-b93d-da0b5be87a43,5,1,Repudiandae repellat provident sequi repellat. Occaecati adipisci ab nisi.,ec0467f6-711f-4ab3-8ada-f4f136fd7db0,58d96f87-c364-4582-8e54-76b099a96ccd
199d078e-4afb-4556-844f-e2b27593c5e2,5,5,Excepturi odio temporibus voluptatum. Officiis illum ipsa reprehenderit.,2050b9dc-7990-4304-a614-26192c3498f9,ba516a17-7aff-4080-b0ab-5e6da78aa02b
596a49a7-766d-4166-aebd-9d2551443543,4,5,Aut optio aliquam ducimus magnam facere. Non quae maiores unde. Veritatis expedita pariatur omnis.,a431eba4-7b68-4761-b82b-100acf19f6e8,60a3bcf6-1480-41e2-9c6f-eec7642a0f60
8b18113d-9dc3-4fde-b17b-4f7dc8c7e56f,3,4,Enim numquam sapiente aperiam. Sed veniam quia. Voluptatum quod a officiis quibusdam perferendis ducimus sit. Optio unde eaque.,8b314542-118f-4ffc-ae4b-bf6da186ecfb,9b70d827-b5eb-4f1a-a22a-bfebe58a5b64
596a49a7-766d-4166-aebd-9d2551443543,3,5,Praesentium nemo autem excepturi. Nisi minus cum unde repellat. Dolorem explicabo odio nam ratione quibusdam alias laudantium.,8c65b6d5-831a-46c6-a72c-784141761a99,60a3bcf6-1480-41e2-9c6f-eec7642a0f60
596a49a7-766d-4166-aebd-9d2551443543,4,5,Aut nam totam pariatur possimus alias accusamus. Debitis illo illo similique quibusdam rerum. Quia soluta saepe dolorum eligendi impedit quisquam.,370ce4eb-971c-4cab-86ba-dbea8d7fe270,60a3bcf6-1480-41e2-9c6f-eec7642a0f60
7870a3f9-4b3f-4b57-b93d-da0b5be87a43,4,1,"Repudiandae reprehenderit temporibus officiis impedit. In ullam dicta accusantium velit minus modi.
Autem doloribus et voluptatibus repellat totam voluptatem. Hic harum aut minus dolores.",346096cc-b55b-4ad1-937e-349beaf98af0,58d96f87-c364-4582-8e54-76b099a96ccd
199d078e-4afb-4556-844f-e2b27593c5e2,2,5,Laudantium at veniam facilis nisi sequi facilis alias. Laboriosam nisi possimus a rerum recusandae. Odio consectetur excepturi facilis eaque incidunt modi.,6ad91709-19a5-4c97-9a4d-9151862eddde,ba516a17-7aff-4080-b0ab-5e6da78aa02b
7870a3f9-4b3f-4b57-b93d-da0b5be87a43,3,1,Minima porro porro delectus. Architecto commodi qui optio pariatur eius quaerat.,346096cc-b55b-4ad1-937e-349beaf98af0,58d96f87-c364-4582-8e54-76b099a96ccd
8b18113d-9dc3-4fde-b17b-4f7dc8c7e56f,4,4,Pariatur eum similique unde deleniti autem laboriosam. Voluptates non voluptatem sed expedita. Molestias consequuntur nihil voluptates asperiores numquam accusantium.,776220f0-c0f9-4800-9c14-e1fdcfebe78f,9b70d827-b5eb-4f1a-a22a-bfebe58a5b64
8b18113d-9dc3-4fde-b17b-4f7dc8c7e56f,2,4,"Aperiam nam labore autem nemo.
Quo necessitatibus impedit occaecati maxime fugiat illo. Rem quis quas quisquam suscipit sed. Eveniet rerum numquam magni ratione sunt corporis.",2f887a39-08f5-4829-b810-627c22b9d722,9b70d827-b5eb-4f1a-a22a-bfebe58a5b64
199d078e-4afb-4556-844f-e2b27593c5e2,2,5,"Esse libero dolor saepe officia ea. Modi blanditiis ut inventore quia.
Quos assumenda perferendis minima nemo est omnis non.",b88ab42a-3129-4916-9442-c310695c80d9,ba516a17-7aff-4080-b0ab-5e6da78aa02b
596a49a7-766d-4166-aebd-9d2551443543,4,5,"Accusamus assumenda sint. Alias ducimus nulla quidem nam corporis.
Et similique at ex. Delectus cum dolores possimus. Occaecati recusandae totam ad. Enim numquam possimus nulla dolorum.",b6f9add8-297e-4886-9550-21a1275f4598,60a3bcf6-1480-41e2-9c6f-eec7642a0f60
