event_address,event_id,event_start_date,event_start_time,pickup_zip_code,user_id,journey_id,journey_empty_spaces,journey_car,journey_text,journey_date,journey_start_time
"Mörfelder Landstraße 362, 60528 Frankfurt am Main",e6930b99-e8ca-49f8-9583-89f54366dc14,2020-06-05,20:00:00,16259,3f251716-6b1c-4228-8302-5acda300fd16,781c7f40-edf4-48d4-9de2-151edf4ae7c8,3,Lotus,"Debitis sit repudiandae dolorem.
Eum cupiditate nesciunt vitae repellat. Possimus non rerum temporibus tempora officia.",2020-06-05,04:20:52
"Xaver-Fuhr-Straße 101, 68163 Mannheim",2ab60824-b539-4a1f-ae1a-f7d94d2d55bb,2020-04-04,19:00:00,54497,f3526adc-3719-4a1b-8ceb-5585b0e4a70c,a4597a9d-5e86-4ee8-b1dd-6adfa0cb24a2,3,Opel,Facilis commodi perferendis beatae facere veniam quisquam. Deserunt incidunt fugit recusandae tenetur exercitationem esse nesciunt. Aliquam voluptate temporibus labore quos sed ipsa.,2020-04-04,23:37:16
"Otto-Flimm-Straße, 53520 Nürburg",eff7e9ae-9c58-42e1-8835-0d51c33dc480,2020-06-05,12:00:00,99713,077ee531-2537-4734-bae6-89c998da89cc,5064bc5f-de70-4cc5-ba87-0ca173d3330c,2,Rolls-Royce,Necessitatibus qui expedita iusto. Iure consectetur non incidunt ullam.,2020-06-05,12:25:51
"Xaver-Fuhr-Straße 101, 68163 Mannheim",2ab60824-b539-4a1f-ae1a-f7d94d2d55bb,2020-04-04,19:00:00,25597,589e66c7-bfaa-46d6-8e96-0433a159324b,fae5aa9d-62bf-4c89-94e7-fb5e5d8d7fb2,4,Rover,Possimus pariatur quo iure corporis amet. Quaerat minus quia consequatur cupiditate doloremque voluptates. Labore maiores perspiciatis maxime.,2020-04-04,12:21:46
"Otto-Flimm-Straße, 53520 Nürburg",eff7e9ae-9c58-42e1-8835-0d51c33dc480,2020-06-05,12:00:00,56459,5e129ab2-e487-419f-bcd4-2b00402f0345,8ecb74e9-9a09-4597-8a38-1d5f34541344,1,Porsche,"Optio cum tenetur. Hic a officia velit atque.
In illo minima quo accusamus eligendi. Rem natus fugiat pariatur. Assumenda in modi repudiandae veritatis. Eius tempora ducimus corporis quia est.",2020-06-05,23:29:59
"Mörfelder Landstraße 362, 60528 Frankfurt am Main",e6930b99-e8ca-49f8-9583-89f54366dc14,2020-06-05,20:00:00,73431,077ee531-2537-4734-bae6-89c998da89cc,0729539a-9604-4645-a561-c0ba7b1de15c,3,SsangYong,"Ex cumque facilis minus minus numquam aspernatur. Eum odio praesentium laborum pariatur tempora expedita ex.
Et commodi dolor sunt vitae. Qui veritatis eveniet dolor. Ut placeat illum corrupti.",2020-06-05,23:54:00
"Mörfelder Landstraße 362, 60528 Frankfurt am Main",e6930b99-e8ca-49f8-9583-89f54366dc14,2020-06-05,20:00:00,1328,5380a651-b7c3-4509-96b0-57b840c9474b,c58cc5e2-09df-4111-afac-2fbfa8627990,1,Mercedes-Benz,"A quod a. Reiciendis eos laboriosam libero molestias maxime.
Quaerat nam quidem ut in nesciunt qui quod. Nulla at sunt facere quo error ipsum qui.",2020-06-05,17:12:35
"Rheinlanddamm 200, 44139 Dortmund",7be626b0-c1cd-4a26-a111-60afb13ba940,2020-04-30,17:00:00,52223,a280875c-9e75-4f6e-8a00-2b92735b9e54,f77fa455-03c5-489d-a50d-4219b6af7707,2,Smart,"Perspiciatis iure quaerat tenetur. Distinctio excepturi a fugiat voluptate ad asperiores.
Quisquam molestiae harum voluptatum. Facere saepe iste expedita. Sed impedit dolores quisquam debitis.",2020-04-30,20:45:01
"Xaver-Fuhr-Straße 101, 68163 Mannheim",2ab60824-b539-4a1f-ae1a-f7d94d2d55bb,2020-04-04,19:00:00,37647,6efdb7a1-f789-4434-a1a3-c4739eb6481d,f1a931a0-2c92-4dbe-b015-779ad3d0c2d9,5,Jeep,Officia repellat placeat accusantium ipsam. A reiciendis itaque quo error. Autem voluptatum ut quam iure excepturi debitis. Molestias debitis eos quisquam rerum.,2020-04-04,04:21:22
"Rheinlanddamm 200, 44139 Dortmund",7be626b0-c1cd-4a26-a111-60afb13ba940,2020-04-30,17:00:00,56253,12161938-5870-452f-a7b1-a20c8ee4e67d,586353ca-2385-43a2-99c9-551033608b90,1,Land Rover,Nihil numquam nobis. Facilis dolores nostrum architecto. Possimus alias quasi corrupti ipsam. Incidunt suscipit adipisci labore aliquid sequi corporis atque.,2020-04-30,06:29:01
"Rheinlanddamm 200, 44139 Dortmund",7be626b0-c1cd-4a26-a111-60afb13ba940,2020-04-30,17:00:00,19273,ec28d9a1-3c2d-4dd7-8cb9-db3fb68b0520,191c4d83-0b28-489b-92fb-dd9e775947b6,1,Volkswagen,"Dolor qui suscipit vel nesciunt autem ipsum. Dignissimos facilis voluptatum enim reiciendis.
Nobis mollitia iste enim praesentium numquam. Placeat molestias beatae minus cum aliquid.",2020-04-30,11:20:51
"Xaver-Fuhr-Straße 101, 68163 Mannheim",2ab60824-b539-4a1f-ae1a-f7d94d2d55bb,2020-04-04,19:00:00,19309,b49fc544-a3c2-47d2-ae70-6da59ae84d0d,c820909f-0576-413e-a282-b3d1bd5398cf,2,Chevrolet,"Hic porro laudantium aliquid iste officiis. Sit veritatis vel ab praesentium nostrum placeat. Velit unde reiciendis.
Occaecati perspiciatis numquam sit. Quisquam necessitatibus debitis alias ipsa.",2020-04-04,08:43:56
"Xaver-Fuhr-Straße 101, 68163 Mannheim",2ab60824-b539-4a1f-ae1a-f7d94d2d55bb,2020-04-04,19:00:00,16307,da6217c3-d4a0-4969-b1c3-884928fce8aa,cbcf2690-9ea0-4fe2-a933-93916281ee37,3,Volkswagen,Suscipit quae sed minus labore. Aut excepturi hic eaque ut sint. Quam blanditiis ipsam consectetur cupiditate ipsa ad.,2020-04-04,04:42:46
"Mörfelder Landstraße 362, 60528 Frankfurt am Main",e6930b99-e8ca-49f8-9583-89f54366dc14,2020-06-05,20:00:00,76770,2187e1a2-ed3c-4fea-874b-8895134b791e,2ee667d6-0abb-491b-8bfd-ef1dd9385896,3,SsangYong,"Deleniti earum eligendi occaecati possimus modi.
Illum ex blanditiis sed. Quia veniam maxime cupiditate. Libero suscipit possimus molestiae sint laudantium.",2020-06-05,13:41:56
"Otto-Flimm-Straße, 53520 Nürburg",eff7e9ae-9c58-42e1-8835-0d51c33dc480,2020-06-05,12:00:00,24241,eb785f3e-2342-4495-97a4-e253cfa84322,00190975-619c-4235-a23a-8936f43ae96a,1,McLaren,"Rerum voluptatum quisquam dolores eos itaque illum.
Rerum vel perspiciatis vel nesciunt. Blanditiis non laudantium.",2020-06-05,10:49:13
"Xaver-Fuhr-Straße 101, 68163 Mannheim",2ab60824-b539-4a1f-ae1a-f7d94d2d55bb,2020-04-04,19:00:00,45968,af6ae583-d2af-4b91-809f-687ffe7be169,421db949-ae67-4534-b953-8ea248f337bf,3,Lexus,"Dignissimos at rem minus veritatis ratione.
Molestiae laudantium fugiat rerum eligendi eum atque. Nobis ullam nesciunt deserunt alias pariatur.",2020-04-04,10:31:01
"Otto-Flimm-Straße, 53520 Nürburg",eff7e9ae-9c58-42e1-8835-0d51c33dc480,2020-06-05,12:00:00,3205,e9c1c37e-dc93-41a3-ad3e-0738a134f544,13e8f4a3-e9bc-49f6-9d5d-b77e279b862a,1,Mini,At exercitationem aspernatur nisi non. Ipsum eligendi itaque non facere. Reprehenderit non expedita molestiae explicabo voluptatibus. Sapiente earum hic aut.,2020-06-05,04:32:32
"Mörfelder Landstraße 362, 60528 Frankfurt am Main",e6930b99-e8ca-49f8-9583-89f54366dc14,2020-06-05,20:00:00,99762,0a3ceb74-068c-4e58-befd-e63b756a58c3,d0635d57-07d4-4ec6-b02a-af64440ccc97,4,SsangYong,Fugit provident quasi laudantium praesentium veritatis rem. Est fugiat possimus assumenda ullam adipisci eos magnam.,2020-06-05,12:09:59
"Otto-Flimm-Straße, 53520 Nürburg",eff7e9ae-9c58-42e1-8835-0d51c33dc480,2020-06-05,12:00:00,18569,a58ad0a2-93fc-4194-8aaf-7c9708d42460,bdf85686-0dd0-40d2-bcb3-730212eb9643,3,Landwind,"Commodi animi qui autem repellat. Minima nesciunt deleniti magnam aperiam at culpa. Perspiciatis dolore reiciendis commodi eum quibusdam labore.
In assumenda suscipit eius placeat.",2020-06-05,17:37:20
"Mörfelder Landstraße 362, 60528 Frankfurt am Main",e6930b99-e8ca-49f8-9583-89f54366dc14,2020-06-05,20:00:00,25554,9b49f405-1570-4944-880c-7b11e52344e8,89f99970-2c72-4e7a-9848-d938bbadb0e7,3,Lada,"Et magni magni rem officiis unde eveniet. Placeat quas facilis voluptatum dolore minima dolorem.
Iusto illum rem numquam facere labore. Aspernatur ipsa mollitia illum porro.",2020-06-05,13:44:36
"Otto-Flimm-Straße, 53520 Nürburg",eff7e9ae-9c58-42e1-8835-0d51c33dc480,2020-06-05,12:00:00,30880,12161938-5870-452f-a7b1-a20c8ee4e67d,c2338a33-2395-4d93-8972-b71402c034e8,2,Lotus,"Suscipit porro ullam earum itaque quas. Debitis animi eaque delectus sapiente aspernatur qui.
Est in doloremque iusto occaecati eveniet. Cum nobis dolorum mollitia odit velit qui.",2020-06-05,08:57:34
"Mörfelder Landstraße 362, 60528 Frankfurt am Main",e6930b99-e8ca-49f8-9583-89f54366dc14,2020-06-05,20:00:00,15890,457a1681-cf3a-4324-b80d-f14d31d7e6c7,8a110f8d-c703-42d1-a8fd-ef107a7c4374,4,Jeep,Blanditiis dolorem praesentium distinctio ea eligendi. Totam aliquid id fugit aliquam aperiam. Ea earum sit sint dignissimos sit consequuntur.,2020-06-05,06:17:06
"Xaver-Fuhr-Straße 101, 68163 Mannheim",2ab60824-b539-4a1f-ae1a-f7d94d2d55bb,2020-04-04,19:00:00,39539,7e465889-2af8-43ad-95e7-dee5719d442b,13bdafb5-a70b-4ab9-a912-67360b0abb8e,2,Hummer,Inventore commodi minima cupiditate explicabo. Soluta cupiditate eos consequuntur.,2020-04-04,03:12:32
"Rheinlanddamm 200, 44139 Dortmund",7be626b0-c1cd-4a26-a111-60afb13ba940,2020-04-30,17:00:00,25821,0553f8b8-233a-4507-bab9-36d7e0b58ed8,c5f645a9-67a9-450c-b89f-c003c00dff84,4,Lexus,Vel mollitia neque perferendis in. Quasi debitis aperiam explicabo. Cum officia modi nisi totam eveniet est voluptatum.,2020-04-30,00:43:08
"Xaver-Fuhr-Straße 101, 68163 Mannheim",2ab60824-b539-4a1f-ae1a-f7d94d2d55bb,2020-04-04,19:00:00,88279,534db7fe-5988-4bc8-8061-b398b75090b8,40cb1890-9766-4a67-99a4-9c930eeebb5b,2,Iveco,Aut voluptate non possimus porro. Doloribus unde doloremque incidunt non. Impedit non voluptas quam doloribus delectus sit. Minus ullam rerum soluta iusto quis.,2020-04-04,03:03:22
"Otto-Flimm-Straße, 53520 Nürburg",eff7e9ae-9c58-42e1-8835-0d51c33dc480,2020-06-05,12:00:00,76857,5380a651-b7c3-4509-96b0-57b840c9474b,6eddcd2f-2ce7-427e-9ea3-53bcc56b5bd8,2,Lexus,Numquam itaque veniam minima maxime. At veniam perferendis quidem. Cupiditate sit esse perspiciatis doloribus at accusamus.,2020-06-05,10:59:55
"Mörfelder Landstraße 362, 60528 Frankfurt am Main",e6930b99-e8ca-49f8-9583-89f54366dc14,2020-06-05,20:00:00,19288,3ef5c93b-c710-43ba-ae0d-6ef1480edbf5,492001b2-61fd-4675-8d66-df73990c92bb,5,Chevrolet,"Harum odit earum maxime. Adipisci amet dignissimos officiis.
Totam placeat provident molestiae cupiditate ratione. Nihil aspernatur culpa assumenda.",2020-06-05,12:50:53
"Rheinlanddamm 200, 44139 Dortmund",7be626b0-c1cd-4a26-a111-60afb13ba940,2020-04-30,17:00:00,19079,8c9ae442-f783-4c0b-b016-460c422b4f1c,144940c5-f09a-47e6-94c2-cdae2dda2d84,1,Saab,"Ea deserunt dolorum asperiores quas. Dolorum quod tenetur ex.
Quae occaecati quos porro ipsum. Sunt quis velit harum eveniet natus et.",2020-04-30,21:12:51
"Otto-Flimm-Straße, 53520 Nürburg",eff7e9ae-9c58-42e1-8835-0d51c33dc480,2020-06-05,12:00:00,8499,418cff41-c967-4be5-b466-86b98ee23bbb,d44b586d-2ce8-4006-9124-ecd911de8eb2,4,Chrysler,Quidem omnis nesciunt suscipit facilis aspernatur aliquid. Soluta ab quaerat excepturi tempore. Quos necessitatibus fugiat sapiente ipsum.,2020-06-05,10:57:16
"Mörfelder Landstraße 362, 60528 Frankfurt am Main",e6930b99-e8ca-49f8-9583-89f54366dc14,2020-06-05,20:00:00,64289,7420515d-69fd-446f-90b6-221ed7034c1f,67f09e46-8b3d-4ebb-9c09-6365f27fe9d8,3,Cadillac,Quos molestias eum delectus autem autem. Officiis ullam quae sit esse. Nisi laboriosam nemo officia aperiam aliquid voluptatum.,2020-06-05,13:55:11
"Mörfelder Landstraße 362, 60528 Frankfurt am Main",e6930b99-e8ca-49f8-9583-89f54366dc14,2020-06-05,20:00:00,93466,5e129ab2-e487-419f-bcd4-2b00402f0345,995e1292-151b-4a42-ac36-5514715abd04,1,Lancia,Nemo eligendi excepturi iste. Ut est aperiam magni facilis unde.,2020-06-05,11:20:07
"Otto-Flimm-Straße, 53520 Nürburg",eff7e9ae-9c58-42e1-8835-0d51c33dc480,2020-06-05,12:00:00,14715,457a1681-cf3a-4324-b80d-f14d31d7e6c7,977b32d8-28be-4019-96ad-76e9fdbaced8,3,Mitsubishi,Exercitationem sapiente aspernatur recusandae praesentium incidunt necessitatibus. Magnam sed similique asperiores. Tempora quidem impedit distinctio facere.,2020-06-05,02:28:30
"Rheinlanddamm 200, 44139 Dortmund",7be626b0-c1cd-4a26-a111-60afb13ba940,2020-04-30,17:00:00,16259,589e66c7-bfaa-46d6-8e96-0433a159324b,818dbe6e-903f-403d-87b9-eea441c0a104,2,Honda,Cupiditate reiciendis illum sunt rem qui explicabo. Aliquam porro vel molestiae cumque voluptas explicabo.,2020-04-30,18:09:10
"Xaver-Fuhr-Straße 101, 68163 Mannheim",2ab60824-b539-4a1f-ae1a-f7d94d2d55bb,2020-04-04,19:00:00,99195,418cff41-c967-4be5-b466-86b98ee23bbb,337ba185-4711-4ca5-9504-3dd5f2dd20f1,4,Jaguar,Ex repellendus delectus aut voluptate veniam itaque eaque. Veniam iusto error sequi libero nostrum enim. Itaque ducimus exercitationem consequuntur neque accusamus voluptate unde.,2020-04-04,21:25:50
"Mörfelder Landstraße 362, 60528 Frankfurt am Main",e6930b99-e8ca-49f8-9583-89f54366dc14,2020-06-05,20:00:00,49479,12161938-5870-452f-a7b1-a20c8ee4e67d,1ac3d3ab-eb77-4647-88dd-f39d817f8f7a,2,Mazda,"Quibusdam cupiditate corporis minus explicabo in. Nisi quia rem incidunt ab id.
Maiores voluptate quo maxime at saepe. Eius distinctio voluptatem alias modi corrupti sint.",2020-06-05,06:54:11
"Xaver-Fuhr-Straße 101, 68163 Mannheim",2ab60824-b539-4a1f-ae1a-f7d94d2d55bb,2020-04-04,19:00:00,35745,c1b97171-b295-45aa-83a5-195a51e337d3,b81522c8-c33b-475f-a389-d41fde83f46a,2,Porsche,Totam perferendis esse corrupti. Occaecati dolorem molestiae eum laborum consectetur. Sapiente vel ad ipsa.,2020-04-04,08:52:50
"Rheinlanddamm 200, 44139 Dortmund",7be626b0-c1cd-4a26-a111-60afb13ba940,2020-04-30,17:00:00,54668,6efdb7a1-f789-4434-a1a3-c4739eb6481d,34d1a15b-95f9-4741-bdda-89e7a6cadc89,2,Land Rover,Numquam dolores iure iure dignissimos. Itaque debitis et suscipit magnam nisi occaecati eum. Cum magnam vero ex veniam expedita aliquid.,2020-04-30,15:12:21
"Rheinlanddamm 200, 44139 Dortmund",7be626b0-c1cd-4a26-a111-60afb13ba940,2020-04-30,17:00:00,44791,24574fdb-c314-44b6-a9a1-8e9acdfd6343,6be6fda9-fe5f-468d-8606-f189ae5b94f0,4,Ford,"Ratione reprehenderit eligendi deleniti inventore cumque est. Consectetur totam numquam animi.
Expedita nisi sed illum perferendis. Officia quia laudantium at totam.",2020-04-30,05:53:12
"Xaver-Fuhr-Straße 101, 68163 Mannheim",2ab60824-b539-4a1f-ae1a-f7d94d2d55bb,2020-04-04,19:00:00,54413,7e465889-2af8-43ad-95e7-dee5719d442b,7afffdb7-7623-485c-af30-e9e0a3056817,2,Ferrari,"Aut in temporibus. Numquam necessitatibus deserunt suscipit voluptatem cum aliquam consequuntur.
Facere laborum corrupti. Adipisci praesentium aperiam quasi mollitia odio cum incidunt.",2020-04-04,04:29:40
"Mörfelder Landstraße 362, 60528 Frankfurt am Main",e6930b99-e8ca-49f8-9583-89f54366dc14,2020-06-05,20:00:00,36433,eb785f3e-2342-4495-97a4-e253cfa84322,35d4edf4-b34c-479c-bf83-4b8e8fb54335,3,Lancia,"Error omnis voluptatibus harum ullam. Deserunt accusantium magni.
Animi quod officiis ipsa incidunt iste. Quos ex natus dolor.",2020-06-05,23:23:29
"Mörfelder Landstraße 362, 60528 Frankfurt am Main",e6930b99-e8ca-49f8-9583-89f54366dc14,2020-06-05,20:00:00,14552,6c2d4155-3b6f-4de3-8e5c-3651d10ab1d2,1f182b95-0512-4415-aa3f-3f15476243e8,2,Jeep,"Assumenda at illum sit nulla ullam. Eligendi excepturi cumque. Vel omnis enim quos doloribus.
Quidem sit voluptate eaque. Maxime commodi doloremque blanditiis officiis enim debitis est.",2020-06-05,17:40:22
"Mörfelder Landstraße 362, 60528 Frankfurt am Main",e6930b99-e8ca-49f8-9583-89f54366dc14,2020-06-05,20:00:00,99713,a13c233a-2e0d-495e-a360-775e956efba5,f2a95899-3694-4a92-9599-3b5a71362a0b,4,Volkswagen,"Beatae similique quae sunt ipsa labore. Harum eaque rerum laboriosam veniam eius sint. Libero quasi molestiae distinctio consequuntur eius odit.
Molestias nobis numquam nemo asperiores nostrum.",2020-06-05,12:09:59
"Otto-Flimm-Straße, 53520 Nürburg",eff7e9ae-9c58-42e1-8835-0d51c33dc480,2020-06-05,12:00:00,65552,c918388b-f728-4800-adcc-b084df27397f,3af0f14a-d8cf-4645-917d-9fc91d10e3ca,4,Maybach,Accusantium harum animi molestiae officiis voluptates accusantium. Culpa minus architecto quod id. Omnis magni magnam dolores voluptate. Deserunt maiores earum eum eum delectus.,2020-06-05,01:17:25
"Rheinlanddamm 200, 44139 Dortmund",7be626b0-c1cd-4a26-a111-60afb13ba940,2020-04-30,17:00:00,89415,3ef5c93b-c710-43ba-ae0d-6ef1480edbf5,635b9b4a-f225-46ab-9236-ad1450f7e9b7,3,Morgan,"Occaecati modi quidem reiciendis quas quod.
Distinctio ut dolorum autem deserunt temporibus. Doloremque odit dolorum rerum quas possimus. Commodi autem enim cum vel similique inventore.",2020-04-30,03:41:16
"Xaver-Fuhr-Straße 101, 68163 Mannheim",2ab60824-b539-4a1f-ae1a-f7d94d2d55bb,2020-04-04,19:00:00,99198,3898dff3-273f-4336-9015-7cfa53472e55,cb3567d3-a2fe-435e-b8b9-4f9edb340a38,1,Mazda,"Beatae eum corrupti impedit fugit. Nisi consequuntur veniam non ratione magni.
Rerum nisi culpa vel sapiente veritatis. Tempora voluptate qui minima quaerat molestiae tempora.",2020-04-04,13:08:36
"Otto-Flimm-Straße, 53520 Nürburg",eff7e9ae-9c58-42e1-8835-0d51c33dc480,2020-06-05,12:00:00,94542,137d8112-8ab7-4a2d-beb0-0967949a8ccf,abf04dbc-3a94-4406-a935-0a0334a8eea9,5,Volvo,"Neque esse recusandae.
Laborum assumenda necessitatibus officia doloribus iusto. Sequi libero exercitationem quibusdam veritatis beatae. Veritatis numquam voluptates accusamus distinctio.",2020-06-05,08:01:38
"Otto-Flimm-Straße, 53520 Nürburg",eff7e9ae-9c58-42e1-8835-0d51c33dc480,2020-06-05,12:00:00,27442,14b87cf2-c595-4e2f-84d1-40cafcf9dd76,9a55b047-441c-40a2-9203-08c9ce069997,5,Suzuki,Culpa fugit quam autem magni amet. Iusto cum doloremque natus. Animi impedit aut nulla asperiores quasi.,2020-06-05,11:45:05
"Rheinlanddamm 200, 44139 Dortmund",7be626b0-c1cd-4a26-a111-60afb13ba940,2020-04-30,17:00:00,16775,2187e1a2-ed3c-4fea-874b-8895134b791e,85801c36-257a-4461-82a2-780da55d2dc3,5,Saab,Quaerat non nulla distinctio impedit optio iusto. Aspernatur magnam soluta sapiente dicta unde voluptatem.,2020-04-30,11:06:51
"Rheinlanddamm 200, 44139 Dortmund",7be626b0-c1cd-4a26-a111-60afb13ba940,2020-04-30,17:00:00,54617,c9f42e65-48b5-410d-b07e-78aad9bbf7ca,c5970c9e-774b-45d3-b09a-3d8f687fac63,1,Bugatti,Quasi quos iure accusantium nostrum placeat odio. Quisquam magnam numquam sunt officiis odit dolorem. Maxime nobis ut dolore at esse. Vel tempore consequuntur ratione voluptas hic repellendus amet.,2020-04-30,23:46:34
"Xaver-Fuhr-Straße 101, 68163 Mannheim",2ab60824-b539-4a1f-ae1a-f7d94d2d55bb,2020-04-04,19:00:00,55483,5875c038-ddef-46d6-8b9c-50ff77a18009,0d8b3497-ec0d-44a4-903a-b63580980d47,5,Kia,A at ad. Nam voluptatem nostrum vero at. Cupiditate nemo mollitia reprehenderit ut perspiciatis eum.,2020-04-04,20:17:52
"Xaver-Fuhr-Straße 101, 68163 Mannheim",2ab60824-b539-4a1f-ae1a-f7d94d2d55bb,2020-04-04,19:00:00,25582,2448380d-cfe7-4e57-86dd-1f87c65a154f,3ab0649a-db46-47e1-a9d3-67c4e7d21896,5,Mazda,Omnis saepe dolor neque. Occaecati corporis quaerat numquam dolores iusto aliquid. Quas quae suscipit aliquid id.,2020-04-04,09:50:02
"Xaver-Fuhr-Straße 101, 68163 Mannheim",2ab60824-b539-4a1f-ae1a-f7d94d2d55bb,2020-04-04,19:00:00,38889,137d8112-8ab7-4a2d-beb0-0967949a8ccf,2db3770a-24c1-4bc0-83f9-738416875f8f,2,Aston Martin,Accusantium nemo pariatur quo nesciunt sunt eius. Soluta incidunt iusto et. Asperiores architecto sapiente explicabo omnis hic accusamus.,2020-04-04,02:25:23
"Xaver-Fuhr-Straße 101, 68163 Mannheim",2ab60824-b539-4a1f-ae1a-f7d94d2d55bb,2020-04-04,19:00:00,24799,4ed2661a-ec90-435f-8f06-673084062c63,5fc04689-49c9-4a55-b6e3-1632efdbc38a,4,Smart,"Id nostrum dolor occaecati. Optio doloribus officia facilis.
Ex laborum consequuntur repudiandae. Necessitatibus enim cumque dicta.",2020-04-04,12:40:29
"Otto-Flimm-Straße, 53520 Nürburg",eff7e9ae-9c58-42e1-8835-0d51c33dc480,2020-06-05,12:00:00,99195,f7ac044a-3dde-4ebf-8d15-bf69e7305b68,647030ea-16ec-47c0-bf03-e0ce1b0fdde1,5,Chevrolet,"Libero culpa veritatis quaerat iste consectetur iusto asperiores. Aperiam natus provident ipsam necessitatibus quidem sequi ex.
Sit at molestias. Animi voluptas nisi quaerat.",2020-06-05,02:11:44
"Mörfelder Landstraße 362, 60528 Frankfurt am Main",e6930b99-e8ca-49f8-9583-89f54366dc14,2020-06-05,20:00:00,92278,4ed2661a-ec90-435f-8f06-673084062c63,97d1c4ac-260d-48e1-93e5-ec3b2cef0631,4,Kia,"Quae pariatur voluptas. Minima ducimus officiis quis cumque vel cumque.
Eaque voluptatem expedita dolorum temporibus.",2020-06-05,00:56:11
"Rheinlanddamm 200, 44139 Dortmund",7be626b0-c1cd-4a26-a111-60afb13ba940,2020-04-30,17:00:00,31195,aa733821-e7fb-4c98-bca7-1875a66912fc,bfb41a11-8ad2-48c6-93a7-45bf06a00bc1,4,Lexus,"Quos ullam dignissimos.
Corrupti itaque reiciendis saepe. Perspiciatis ab amet earum officia. Cumque fugiat aperiam dignissimos hic tempora.",2020-04-30,18:43:35
"Otto-Flimm-Straße, 53520 Nürburg",eff7e9ae-9c58-42e1-8835-0d51c33dc480,2020-06-05,12:00:00,18276,494bcc9c-8a0b-4a64-aef4-4686aa65b0e1,d812a2d2-6808-463d-98e6-a20e9f571fa0,4,Lotus,"Reiciendis quas temporibus aliquid perferendis.
Repellat alias nemo maxime vero reiciendis. Vero eligendi sed fugiat accusantium.",2020-06-05,12:38:56
"Rheinlanddamm 200, 44139 Dortmund",7be626b0-c1cd-4a26-a111-60afb13ba940,2020-04-30,17:00:00,29413,3c8c8503-7bc9-4991-8dfd-c11ed29fecf1,9886b5ab-2aab-499b-b427-1f398601056f,4,Opel,"Voluptatem dolorem vero eligendi.
Deserunt cupiditate similique ipsa ipsum mollitia. Perferendis molestiae eos quia quasi enim odit.",2020-04-30,12:06:30
"Mörfelder Landstraße 362, 60528 Frankfurt am Main",e6930b99-e8ca-49f8-9583-89f54366dc14,2020-06-05,20:00:00,55469,3ef5c93b-c710-43ba-ae0d-6ef1480edbf5,2abd9097-9362-4cd3-8b9b-5cc3b90236c9,2,Alfa Romeo,"Voluptates blanditiis impedit corporis. Porro earum sed fuga beatae quisquam nobis.
Magnam blanditiis repudiandae modi veritatis. Illo aperiam recusandae.",2020-06-05,03:51:14
"Rheinlanddamm 200, 44139 Dortmund",7be626b0-c1cd-4a26-a111-60afb13ba940,2020-04-30,17:00:00,2627,5380a651-b7c3-4509-96b0-57b840c9474b,c39dfaaf-1343-4fc2-82b6-07dc68244dad,3,Land Rover,Aliquid totam neque repudiandae modi. Doloremque quis delectus labore perferendis.,2020-04-30,21:48:55
"Mörfelder Landstraße 362, 60528 Frankfurt am Main",e6930b99-e8ca-49f8-9583-89f54366dc14,2020-06-05,20:00:00,54646,362ed4b8-110a-436f-a9de-374110ab3fb7,c8bf04ad-1f09-47c8-9052-4eececb21313,3,Land Rover,Doloribus delectus voluptatum ut debitis. Nam quis reprehenderit magnam. At maxime tempora tenetur. Incidunt ratione praesentium exercitationem tempore praesentium.,2020-06-05,21:54:42
"Otto-Flimm-Straße, 53520 Nürburg",eff7e9ae-9c58-42e1-8835-0d51c33dc480,2020-06-05,12:00:00,25479,e4f6f74a-90e5-4659-b50e-f156a3452e56,24f6bbb1-1abe-4d76-b037-6f63a158325f,5,Nissan,"Reiciendis quod repellendus occaecati amet. Tenetur voluptates dolore maiores dolorem omnis. Sunt inventore assumenda.
Exercitationem veritatis necessitatibus ipsa architecto modi.",2020-06-05,05:21:26
"Otto-Flimm-Straße, 53520 Nürburg",eff7e9ae-9c58-42e1-8835-0d51c33dc480,2020-06-05,12:00:00,12685,f7ac044a-3dde-4ebf-8d15-bf69e7305b68,2ede62f9-67a6-40d9-aad6-bc6ec74e32bd,4,Saab,"Adipisci delectus fugiat sint. Quo veritatis nemo cumque aut.
Ex sunt nobis occaecati deleniti commodi.",2020-06-05,04:28:31
"Xaver-Fuhr-Straße 101, 68163 Mannheim",2ab60824-b539-4a1f-ae1a-f7d94d2d55bb,2020-04-04,19:00:00,24887,239afb50-63ac-4046-b247-cc603537df4d,1ac889a7-e30e-4f52-920a-dfe84ea74100,1,Nissan,"Quod nobis quisquam eveniet quis quaerat. Eos corporis blanditiis porro a molestias consequatur.
Ratione ex at sed debitis non. Doloribus aspernatur illo quam suscipit placeat quasi.",2020-04-04,08:40:59
"Mörfelder Landstraße 362, 60528 Frankfurt am Main",e6930b99-e8ca-49f8-9583-89f54366dc14,2020-06-05,20:00:00,7570,457a1681-cf3a-4324-b80d-f14d31d7e6c7,91a9e656-547f-45c0-aaa7-f973042e05d9,3,KTM,Unde mollitia voluptatibus voluptas. Eaque dolor deserunt accusantium itaque. Animi quasi fuga perspiciatis eveniet facilis.,2020-06-05,15:46:50
"Rheinlanddamm 200, 44139 Dortmund",7be626b0-c1cd-4a26-a111-60afb13ba940,2020-04-30,17:00:00,54687,eb785f3e-2342-4495-97a4-e253cfa84322,86ef1df2-2218-4403-bd60-a8b15bb87f10,1,Landwind,Repudiandae debitis architecto ut. Dicta et a soluta. Suscipit quod cum.,2020-04-30,03:18:15
"Xaver-Fuhr-Straße 101, 68163 Mannheim",2ab60824-b539-4a1f-ae1a-f7d94d2d55bb,2020-04-04,19:00:00,3058,b3a37c80-d6c5-4cd5-8623-17342d44c310,c0e48666-4d8a-4bd7-9cb4-3974ddfdb346,1,Lancia,"Doloribus laborum perferendis nisi. Earum assumenda aliquid vero enim temporibus. Dicta reprehenderit exercitationem.
Voluptas ex porro.",2020-04-04,15:34:10
"Rheinlanddamm 200, 44139 Dortmund",7be626b0-c1cd-4a26-a111-60afb13ba940,2020-04-30,17:00:00,23942,418cff41-c967-4be5-b466-86b98ee23bbb,a373700a-7245-491b-b114-34b7be9e2d2e,4,Daihatsu,Debitis laudantium quisquam quas tenetur reiciendis inventore. Reiciendis sit quisquam tempore molestiae dolore placeat provident. Cumque quia debitis totam.,2020-04-30,21:17:54
"Otto-Flimm-Straße, 53520 Nürburg",eff7e9ae-9c58-42e1-8835-0d51c33dc480,2020-06-05,12:00:00,97080,c1b97171-b295-45aa-83a5-195a51e337d3,89a18e7d-74bd-4ec4-b50f-f1c2449aac32,1,Volkswagen,"Deleniti odit voluptas repudiandae repellat debitis. Corrupti veritatis eos hic commodi a.
Suscipit ratione iusto ab velit in veniam dolores. Illum veritatis vel ea itaque ad consequatur.",2020-06-05,15:36:54
"Rheinlanddamm 200, 44139 Dortmund",7be626b0-c1cd-4a26-a111-60afb13ba940,2020-04-30,17:00:00,6869,8c9ae442-f783-4c0b-b016-460c422b4f1c,0226e3a7-2d34-4fb5-ab2b-98a2178d1536,1,McLaren,Suscipit hic voluptate harum sapiente architecto commodi. Et quaerat repellendus iusto ipsam recusandae consectetur occaecati.,2020-04-30,00:18:46
"Xaver-Fuhr-Straße 101, 68163 Mannheim",2ab60824-b539-4a1f-ae1a-f7d94d2d55bb,2020-04-04,19:00:00,55494,362ed4b8-110a-436f-a9de-374110ab3fb7,1e727fa5-bb33-4a99-a5ce-ba3164f96bda,2,Lotus,Labore fugit et asperiores voluptate provident. Culpa quo sunt eaque beatae. Optio doloremque culpa in nam. Rem veritatis quam officia.,2020-04-04,12:02:38
"Otto-Flimm-Straße, 53520 Nürburg",eff7e9ae-9c58-42e1-8835-0d51c33dc480,2020-06-05,12:00:00,1594,b49fc544-a3c2-47d2-ae70-6da59ae84d0d,d3a5ea9d-4fe6-4c53-ad5c-0019261f65dd,3,Volvo,Sed aliquam eveniet quod dignissimos blanditiis incidunt. Iusto blanditiis soluta dolores aliquam consequuntur. Laborum in voluptas facilis non aliquid.,2020-06-05,17:22:56
