event_address,event_id,event_start_date,event_start_time,pickup_zip_code,user_id,journey_id,journey_empty_spaces,journey_car,journey_text,journey_date,journey_start_time
"Xaver-Fuhr-Straße 101, 68163 Mannheim",2ab60824-b539-4a1f-ae1a-f7d94d2d55bb,2020-04-04,19:00:00,64579,239afb50-63ac-4046-b247-cc603537df4d,544d8404-ba3d-4d7e-929c-02be1b208309,1,Maserati,Voluptatibus sunt nemo labore. Pariatur assumenda aspernatur fuga. Ea harum reprehenderit aliquam accusamus doloribus.,2020-04-04,06:00:15
"Mörfelder Landstraße 362, 60528 Frankfurt am Main",e6930b99-e8ca-49f8-9583-89f54366dc14,2020-06-05,20:00:00,26897,9b49f405-1570-4944-880c-7b11e52344e8,0d2766c5-0d53-47d3-94e4-eaf5ec823b43,3,Rolls-Royce,Illo rem veniam cupiditate ratione delectus nesciunt.,2020-06-05,20:35:37
"Xaver-Fuhr-Straße 101, 68163 Mannheim",2ab60824-b539-4a1f-ae1a-f7d94d2d55bb,2020-04-04,19:00:00,41836,3c8c8503-7bc9-4991-8dfd-c11ed29fecf1,2bcb47bf-2960-434f-a221-01ca99004782,3,Alfa Romeo,Libero enim consectetur dolore a quis vitae. Quia dicta consequuntur. Error dolorem dolorem ipsam ipsa mollitia.,2020-04-04,20:37:09
"Otto-Flimm-Straße, 53520 Nürburg",eff7e9ae-9c58-42e1-8835-0d51c33dc480,2020-06-05,12:00:00,14548,39276af3-6366-430d-bc34-e7f7ce5622fe,f4af1907-6265-413a-8ebd-b631aeac526b,4,Skoda,Corporis itaque consequuntur. Minima harum sapiente deserunt impedit eos recusandae. Modi ex magnam sapiente earum neque.,2020-06-05,19:17:38
"Mörfelder Landstraße 362, 60528 Frankfurt am Main",e6930b99-e8ca-49f8-9583-89f54366dc14,2020-06-05,20:00:00,36419,0a3ceb74-068c-4e58-befd-e63b756a58c3,d171af25-6c71-4c4b-80a9-62fce061290c,5,Infiniti,"Et aperiam commodi corrupti quo. Error inventore nihil velit.
Dicta nesciunt amet culpa voluptates minus occaecati. Perferendis vero autem ab excepturi blanditiis.",2020-06-05,06:20:11
"Otto-Flimm-Straße, 53520 Nürburg",eff7e9ae-9c58-42e1-8835-0d51c33dc480,2020-06-05,12:00:00,67705,93685f30-f13a-4d7c-9d17-67f75ed1fa6a,4b077dfc-3aaa-4103-bce7-213bb77efc2f,5,Fiat,Ea doloribus unde dignissimos occaecati. Minima magni cupiditate cumque quibusdam reiciendis. Recusandae quas alias autem.,2020-06-05,18:31:07
"Mörfelder Landstraße 362, 60528 Frankfurt am Main",e6930b99-e8ca-49f8-9583-89f54366dc14,2020-06-05,20:00:00,96049,8c9ae442-f783-4c0b-b016-460c422b4f1c,2ee5561d-ab51-4e43-a54a-d182a12099d0,1,MG,"Repudiandae ducimus asperiores perspiciatis ad. Excepturi asperiores quidem aspernatur assumenda. Eligendi possimus officiis assumenda.
Totam beatae quam fuga dolore et.",2020-06-05,09:45:45
"Xaver-Fuhr-Straße 101, 68163 Mannheim",2ab60824-b539-4a1f-ae1a-f7d94d2d55bb,2020-04-04,19:00:00,23970,b3a37c80-d6c5-4cd5-8623-17342d44c310,1c19e381-91cd-49b9-b6e5-f49f54266fef,4,Lexus,Similique nostrum ratione dolore occaecati fuga quasi. Minima dolorem error porro voluptates autem alias. Nostrum ipsam porro quo maiores quisquam doloremque. Cum quaerat natus error asperiores quos.,2020-04-04,22:43:01
"Rheinlanddamm 200, 44139 Dortmund",7be626b0-c1cd-4a26-a111-60afb13ba940,2020-04-30,17:00:00,21762,17fe9abb-941d-40b0-9557-170a5c74fcb2,f2c9ee35-167a-48b3-b5c6-3a5eb2342fe9,3,Lada,Omnis unde dicta ad laboriosam possimus cum. Nostrum fuga velit voluptatum dolore. Totam quas distinctio odio consequatur eaque.,2020-04-30,03:29:00
"Otto-Flimm-Straße, 53520 Nürburg",eff7e9ae-9c58-42e1-8835-0d51c33dc480,2020-06-05,12:00:00,24250,24574fdb-c314-44b6-a9a1-8e9acdfd6343,5509e4e2-7b8e-4af0-b356-b3d081f19cf7,5,Mazda,Necessitatibus facere voluptas nemo. Animi accusamus laudantium incidunt blanditiis occaecati rerum quae. Eos at nihil voluptas officia aliquid quia.,2020-06-05,05:14:27
"Mörfelder Landstraße 362, 60528 Frankfurt am Main",e6930b99-e8ca-49f8-9583-89f54366dc14,2020-06-05,20:00:00,23869,98776c4f-0b70-403a-972e-da3df6cc26c8,75f9b71d-72fd-4ef0-a86e-0c7a99b01169,2,Bugatti,Saepe modi autem in. Ullam magnam delectus voluptas nobis eos totam earum. Culpa autem facilis doloremque quibusdam totam.,2020-06-05,19:37:35
"Otto-Flimm-Straße, 53520 Nürburg",eff7e9ae-9c58-42e1-8835-0d51c33dc480,2020-06-05,12:00:00,83364,137d8112-8ab7-4a2d-beb0-0967949a8ccf,02cd0b21-4f45-4521-aa25-1bf473ff3999,5,Hyundai,Recusandae libero excepturi voluptate veniam harum nam et. Cumque rerum cum nemo eaque. Debitis esse id tempore ea. Temporibus qui debitis iusto tempore.,2020-06-05,01:11:19
"Xaver-Fuhr-Straße 101, 68163 Mannheim",2ab60824-b539-4a1f-ae1a-f7d94d2d55bb,2020-04-04,19:00:00,85625,239afb50-63ac-4046-b247-cc603537df4d,8dab9385-d791-4589-8d22-5955021daaf2,1,Iveco,"Doloremque quas sint. Consequuntur praesentium doloribus exercitationem sit minima.
Velit veniam cupiditate culpa nobis explicabo voluptatibus. Facere tenetur magni aut iusto.",2020-04-04,05:51:29
"Rheinlanddamm 200, 44139 Dortmund",7be626b0-c1cd-4a26-a111-60afb13ba940,2020-04-30,17:00:00,16798,59f930a1-5582-449e-8b7d-edda5ffd6573,c9e5254e-6324-4a78-a3e6-197c01decc42,5,Skoda,Temporibus sit et. Nulla quidem distinctio aliquid ratione. Eaque nostrum molestias illo blanditiis deleniti.,2020-04-30,18:52:19
"Otto-Flimm-Straße, 53520 Nürburg",eff7e9ae-9c58-42e1-8835-0d51c33dc480,2020-06-05,12:00:00,95508,362ed4b8-110a-436f-a9de-374110ab3fb7,8c8163f2-80fd-4e28-a477-9ef8bb44ab5f,2,KTM,Voluptatibus amet error vero alias alias aliquid dignissimos. Delectus facilis nulla ab optio repudiandae culpa. Laudantium quidem unde asperiores illo. Perferendis autem deserunt.,2020-06-05,22:59:54
"Mörfelder Landstraße 362, 60528 Frankfurt am Main",e6930b99-e8ca-49f8-9583-89f54366dc14,2020-06-05,20:00:00,15898,597ec9e0-a095-48c4-83fb-05ff9601c398,2f102be2-2338-4dcb-af68-66e5132a7799,5,Fisker,Nostrum eos in ut beatae. Quae repellendus eius voluptas. Voluptatem ex quidem odio vero asperiores.,2020-06-05,21:36:53
"Mörfelder Landstraße 362, 60528 Frankfurt am Main",e6930b99-e8ca-49f8-9583-89f54366dc14,2020-06-05,20:00:00,18276,14b87cf2-c595-4e2f-84d1-40cafcf9dd76,e9df3ebf-512b-43cb-b55a-1cd985c5c1a8,5,Lada,Porro aperiam veritatis tempore. Animi consequatur at natus quo. Repellendus fugit minus.,2020-06-05,15:36:51
"Otto-Flimm-Straße, 53520 Nürburg",eff7e9ae-9c58-42e1-8835-0d51c33dc480,2020-06-05,12:00:00,23992,12161938-5870-452f-a7b1-a20c8ee4e67d,d0464fb5-ac80-4019-a8b8-bd1780835c38,3,Tesla,Recusandae distinctio incidunt doloremque corrupti. Distinctio quam accusantium. Commodi inventore eveniet dignissimos earum temporibus perspiciatis adipisci.,2020-06-05,13:55:23
"Otto-Flimm-Straße, 53520 Nürburg",eff7e9ae-9c58-42e1-8835-0d51c33dc480,2020-06-05,12:00:00,27367,9b49f405-1570-4944-880c-7b11e52344e8,2bd76366-5e38-4fc1-a74b-c266ac5c5f82,1,Porsche,Beatae corporis quidem alias adipisci tenetur. Hic sed delectus assumenda quaerat unde. Commodi voluptatum fugit magnam.,2020-06-05,11:14:00
"Rheinlanddamm 200, 44139 Dortmund",7be626b0-c1cd-4a26-a111-60afb13ba940,2020-04-30,17:00:00,16230,e532d7bb-12e9-4762-8b90-5ed7da27a848,c2b566a7-0e1f-4cdc-ab30-200b8e977a4c,4,Abarth,"Eos laboriosam enim nobis dolorum dignissimos dolor. Voluptatibus esse dignissimos dignissimos. Est quia fugiat et.
Aliquid id amet optio. Qui est officia atque.",2020-04-30,21:18:43
"Xaver-Fuhr-Straße 101, 68163 Mannheim",2ab60824-b539-4a1f-ae1a-f7d94d2d55bb,2020-04-04,19:00:00,99510,6dc96739-a869-48b7-8ddc-59de818437b5,72e9c2d6-1ece-4eab-9c01-2899c435c833,3,Lotus,Ipsa cupiditate tempora voluptates odio. Consequuntur eum laborum veniam ex nobis ullam recusandae. Voluptatem repudiandae ab deleniti corporis. Veniam placeat deleniti quaerat hic magni cupiditate.,2020-04-04,06:27:56
"Otto-Flimm-Straße, 53520 Nürburg",eff7e9ae-9c58-42e1-8835-0d51c33dc480,2020-06-05,12:00:00,14662,17fe9abb-941d-40b0-9557-170a5c74fcb2,718791df-7b74-4a85-bae5-71a67dccc297,4,MG,Tenetur doloremque quia totam suscipit doloremque consectetur fugit. Quibusdam quibusdam tenetur.,2020-06-05,09:58:21
"Otto-Flimm-Straße, 53520 Nürburg",eff7e9ae-9c58-42e1-8835-0d51c33dc480,2020-06-05,12:00:00,16248,5447ef80-d3c7-4752-8224-2e062978205e,cb690c86-f22f-4413-a555-f595b77313a0,2,Cadillac,Molestias repellat tempora rem voluptatum possimus. Voluptates et soluta minima harum expedita maxime. Earum corrupti expedita reprehenderit sapiente molestiae.,2020-06-05,11:57:27
"Rheinlanddamm 200, 44139 Dortmund",7be626b0-c1cd-4a26-a111-60afb13ba940,2020-04-30,17:00:00,39175,494bcc9c-8a0b-4a64-aef4-4686aa65b0e1,ae03b38e-cf0a-4dec-afa6-f10d88162871,5,Jeep,Veniam atque beatae sunt eius deserunt. Quaerat inventore ea consectetur dignissimos. Saepe eum pariatur molestias fugiat.,2020-04-30,14:37:39
"Otto-Flimm-Straße, 53520 Nürburg",eff7e9ae-9c58-42e1-8835-0d51c33dc480,2020-06-05,12:00:00,58256,aa733821-e7fb-4c98-bca7-1875a66912fc,ff478901-52f8-4276-a843-bcd554eb4053,3,Bentley,Commodi cum vero officia rem facere nobis. Dolores animi enim aperiam tempore adipisci. Dignissimos magnam eligendi odio suscipit veritatis repellat eius.,2020-06-05,14:29:37
"Mörfelder Landstraße 362, 60528 Frankfurt am Main",e6930b99-e8ca-49f8-9583-89f54366dc14,2020-06-05,20:00:00,39649,6c2d4155-3b6f-4de3-8e5c-3651d10ab1d2,5f5122d6-f24b-4654-b385-a123c94dacc1,3,Morgan,Illum vel accusamus eaque ratione. Perspiciatis nam beatae incidunt nihil. Necessitatibus minima exercitationem vitae eos numquam doloremque.,2020-06-05,23:38:11
"Otto-Flimm-Straße, 53520 Nürburg",eff7e9ae-9c58-42e1-8835-0d51c33dc480,2020-06-05,12:00:00,73492,3d539ac2-7f2b-4341-b683-9314769c66e1,b89dd867-7d2d-4eb7-9819-e6c0e7b5ddb6,5,Lamborghini,"Deleniti mollitia enim cupiditate nostrum delectus.
Blanditiis aut rerum. Numquam enim ipsum cum quos.",2020-06-05,05:06:01
"Xaver-Fuhr-Straße 101, 68163 Mannheim",2ab60824-b539-4a1f-ae1a-f7d94d2d55bb,2020-04-04,19:00:00,20357,338e482b-5a91-4386-8a56-0e81bfb7ed91,a55b385f-636c-449d-aeb7-6a3e0bafa71f,2,Dodge,"Accusamus ducimus quod laudantium. Illum eum explicabo architecto.
Ex architecto fugiat libero tempora saepe perferendis. Ipsum iste dolorum voluptatibus tempora.",2020-04-04,20:23:31
"Xaver-Fuhr-Straße 101, 68163 Mannheim",2ab60824-b539-4a1f-ae1a-f7d94d2d55bb,2020-04-04,19:00:00,83700,077ee531-2537-4734-bae6-89c998da89cc,48131c62-c07b-4da1-add7-e7f7cbc09201,5,Saab,"Eos possimus esse dignissimos. Veritatis iste commodi aspernatur consequuntur distinctio officiis cumque.
Provident sequi eum quibusdam. Sint voluptatibus at aliquid dolor.",2020-04-04,00:01:02
"Mörfelder Landstraße 362, 60528 Frankfurt am Main",e6930b99-e8ca-49f8-9583-89f54366dc14,2020-06-05,20:00:00,39615,5380a651-b7c3-4509-96b0-57b840c9474b,4a2e9923-e480-482e-81ed-846f71208e7c,1,Jeep,Et ex error dolorem ipsam adipisci at. Amet dolorem esse voluptas soluta nisi harum.,2020-06-05,12:41:08
"Otto-Flimm-Straße, 53520 Nürburg",eff7e9ae-9c58-42e1-8835-0d51c33dc480,2020-06-05,12:00:00,37242,00b06e3a-71ba-4ea4-ad23-c8805e014951,634d8cfe-eeae-42d0-b149-60e162779847,3,Daihatsu,"Nostrum optio cum odio. Inventore qui quia esse assumenda tenetur natus. Magni amet velit perspiciatis.
Earum similique consectetur sed blanditiis reiciendis. Quidem dicta porro atque.",2020-06-05,22:54:24
"Xaver-Fuhr-Straße 101, 68163 Mannheim",2ab60824-b539-4a1f-ae1a-f7d94d2d55bb,2020-04-04,19:00:00,93333,534db7fe-5988-4bc8-8061-b398b75090b8,b436059a-4baf-412b-9301-a0c6a4c5a6d4,3,Morgan,Voluptas voluptatibus quae labore dicta. Nihil iusto rerum asperiores maiores cupiditate dolorum. Necessitatibus molestias ratione non perspiciatis ab.,2020-04-04,09:48:11
"Xaver-Fuhr-Straße 101, 68163 Mannheim",2ab60824-b539-4a1f-ae1a-f7d94d2d55bb,2020-04-04,19:00:00,23936,f3d07804-cd4e-4239-80ad-79b88a622d6f,05eccd1c-7893-4ae0-97f7-f408b8cf1b12,4,Tesla,"Voluptatum voluptas corrupti cumque dolore sequi beatae quia.
Accusantium cum ut. Ex minus harum. Quisquam accusantium mollitia incidunt alias quia iusto.",2020-04-04,01:59:57
"Otto-Flimm-Straße, 53520 Nürburg",eff7e9ae-9c58-42e1-8835-0d51c33dc480,2020-06-05,12:00:00,54689,c918388b-f728-4800-adcc-b084df27397f,59cec936-92df-40ac-95be-8aa674d409d3,3,SsangYong,Placeat maiores a dolore tempore reiciendis. Ullam vel fugit rem quas illum. Commodi veniam laudantium veniam eaque dolorum officiis odio. Ad aliquid aliquid qui excepturi ratione.,2020-06-05,09:14:20
"Mörfelder Landstraße 362, 60528 Frankfurt am Main",e6930b99-e8ca-49f8-9583-89f54366dc14,2020-06-05,20:00:00,39606,597ec9e0-a095-48c4-83fb-05ff9601c398,dacc91f3-1b41-45f4-abc2-5c3b84a76635,2,Ferrari,Quae iste numquam repudiandae. Dolor odio minima officia repudiandae. Repellendus fugiat natus cum unde.,2020-06-05,22:53:41
"Otto-Flimm-Straße, 53520 Nürburg",eff7e9ae-9c58-42e1-8835-0d51c33dc480,2020-06-05,12:00:00,25488,418cff41-c967-4be5-b466-86b98ee23bbb,3a021d67-5d54-4c5a-95ed-a9202d677a0a,3,Chrysler,Sint quis perspiciatis veritatis et voluptates. Blanditiis tempora ducimus. Facere neque cum aliquam possimus repellendus aperiam. Maiores repudiandae repellendus quos eligendi iusto nisi.,2020-06-05,21:51:06
"Rheinlanddamm 200, 44139 Dortmund",7be626b0-c1cd-4a26-a111-60afb13ba940,2020-04-30,17:00:00,6116,c2cebae5-6200-4421-b9eb-55b098cfb1a7,49ce1e8b-7330-41d2-8d4c-838b216b05b5,5,McLaren,Sequi occaecati molestiae quidem hic tempora quisquam.,2020-04-30,09:48:41
"Xaver-Fuhr-Straße 101, 68163 Mannheim",2ab60824-b539-4a1f-ae1a-f7d94d2d55bb,2020-04-04,19:00:00,82432,3ef5c93b-c710-43ba-ae0d-6ef1480edbf5,78cff8b8-99bf-446a-a29c-47718122f02b,5,Honda,"Enim ex aspernatur. Amet illum optio occaecati harum dignissimos. Impedit repellat omnis sapiente maiores.
Itaque earum ab distinctio. Temporibus porro occaecati corrupti alias explicabo nam.",2020-04-04,10:17:30
"Mörfelder Landstraße 362, 60528 Frankfurt am Main",e6930b99-e8ca-49f8-9583-89f54366dc14,2020-06-05,20:00:00,39291,4ecb03d7-c0f8-4494-98d4-86662953908a,fd21efc3-4274-444d-85f1-4d8ce020ea1e,2,Mini,"Optio quod esse doloribus minus error. Beatae assumenda in iure asperiores.
Maxime voluptatem optio iste. Molestiae alias optio nesciunt.",2020-06-05,14:35:40
"Otto-Flimm-Straße, 53520 Nürburg",eff7e9ae-9c58-42e1-8835-0d51c33dc480,2020-06-05,12:00:00,25764,362ed4b8-110a-436f-a9de-374110ab3fb7,f13c8ec4-feb1-437e-878a-3fd7c1314a63,5,Smart,Repellendus praesentium quas impedit commodi in iste omnis. Incidunt dolorem vel sapiente quam impedit voluptate. Nam quidem possimus unde consequuntur possimus.,2020-06-05,05:23:31
"Xaver-Fuhr-Straße 101, 68163 Mannheim",2ab60824-b539-4a1f-ae1a-f7d94d2d55bb,2020-04-04,19:00:00,67806,457a1681-cf3a-4324-b80d-f14d31d7e6c7,56e45d23-2f4d-4e69-90e7-d018c6af023f,1,Donkervoort,Atque tenetur deserunt veritatis error repudiandae placeat. Possimus quod architecto at ducimus quaerat quaerat explicabo. Vel adipisci fugit assumenda.,2020-04-04,23:30:16
"Rheinlanddamm 200, 44139 Dortmund",7be626b0-c1cd-4a26-a111-60afb13ba940,2020-04-30,17:00:00,19243,d144ef4c-5bbe-49c2-a2ad-5ad7a37f113e,53a2639f-6e28-47c4-a656-b1b73efc7fdb,1,Lotus,"Consequatur aspernatur dolorum aliquid minima sint repellendus. Quo quia fugiat quibusdam quaerat laborum pariatur. Vitae porro quidem rem tempora.
Veritatis blanditiis nisi odit nostrum.",2020-04-30,07:42:14
"Mörfelder Landstraße 362, 60528 Frankfurt am Main",e6930b99-e8ca-49f8-9583-89f54366dc14,2020-06-05,20:00:00,95652,a5c245ef-f903-44ae-9252-4619eb7bd52d,e1a85e10-6bf5-4de3-894f-7d72c108819b,2,MG,"Dolorem at reiciendis nostrum soluta illo voluptates.
Enim quia unde nihil nisi laborum. Hic fugit dolor tenetur.",2020-06-05,09:34:59
"Rheinlanddamm 200, 44139 Dortmund",7be626b0-c1cd-4a26-a111-60afb13ba940,2020-04-30,17:00:00,15859,de6890e2-e3fa-4776-bf10-a9cfedbee9c0,4918018d-e9af-48ad-8a4f-286390721864,5,Smart,"Ducimus molestias ipsam tenetur. At voluptatibus eligendi soluta illum dolorem neque laborum.
Ad excepturi natus labore voluptate ducimus cumque. Voluptatem dolore quisquam ipsa.",2020-04-30,19:14:43
"Otto-Flimm-Straße, 53520 Nürburg",eff7e9ae-9c58-42e1-8835-0d51c33dc480,2020-06-05,12:00:00,44388,f3d07804-cd4e-4239-80ad-79b88a622d6f,027e2879-0b1f-4414-8796-b186f61a33d9,5,MG,Omnis facilis eos corrupti blanditiis deserunt. Animi eveniet quo ullam amet corporis aliquam. Possimus dolores et sapiente veniam totam distinctio hic.,2020-06-05,08:00:33
"Rheinlanddamm 200, 44139 Dortmund",7be626b0-c1cd-4a26-a111-60afb13ba940,2020-04-30,17:00:00,2747,2187e1a2-ed3c-4fea-874b-8895134b791e,11af402e-3bf1-4b2f-8119-aea12279d08c,4,Hyundai,"Alias reprehenderit quos harum sed reiciendis. Et explicabo quas. Natus a totam harum debitis.
Expedita officiis nisi incidunt ea. A cum veniam asperiores esse facilis debitis necessitatibus.",2020-04-30,06:11:05
"Xaver-Fuhr-Straße 101, 68163 Mannheim",2ab60824-b539-4a1f-ae1a-f7d94d2d55bb,2020-04-04,19:00:00,74229,ce28b945-9289-49c7-bb33-b18809568242,b21c6790-0c36-4d1e-8010-bcbe7860725b,3,Donkervoort,Accusantium voluptates vero delectus atque. Labore praesentium quasi aliquid ea illum. Voluptates laboriosam non dolorem sequi deleniti consectetur.,2020-04-04,11:32:35
"Rheinlanddamm 200, 44139 Dortmund",7be626b0-c1cd-4a26-a111-60afb13ba940,2020-04-30,17:00:00,23883,5380a651-b7c3-4509-96b0-57b840c9474b,20863ee3-5df9-4b2e-8adc-1e8838253857,2,BMW,Facilis ab aspernatur fugiat nesciunt. Ullam facilis dicta aperiam.,2020-04-30,05:45:59
"Rheinlanddamm 200, 44139 Dortmund",7be626b0-c1cd-4a26-a111-60afb13ba940,2020-04-30,17:00:00,39638,e532d7bb-12e9-4762-8b90-5ed7da27a848,13f20bf8-5f00-4450-af21-50c7c5176d7e,2,Suzuki,"Nulla impedit velit ea corporis non. Fuga modi voluptatibus sint. Doloribus in explicabo.
Molestiae explicabo eum vero. Eos repellendus eligendi.",2020-04-30,08:49:17
"Xaver-Fuhr-Straße 101, 68163 Mannheim",2ab60824-b539-4a1f-ae1a-f7d94d2d55bb,2020-04-04,19:00:00,98716,7b3ae5fd-286e-40d1-a73f-24dcaa036fff,d163a902-c7a3-43da-9a43-436f96d09fa4,3,Mitsubishi,"Cupiditate ipsam omnis sed omnis dolor. Repudiandae quisquam tempora unde quod illo sed.
Beatae in a totam ab officia. Mollitia debitis autem voluptas tempora vitae.",2020-04-04,08:30:54
"Otto-Flimm-Straße, 53520 Nürburg",eff7e9ae-9c58-42e1-8835-0d51c33dc480,2020-06-05,12:00:00,23936,597ec9e0-a095-48c4-83fb-05ff9601c398,53f825b4-681f-4a81-906a-c07c6d75a407,2,Bentley,Accusantium architecto quos iure. Corrupti reiciendis dolorem eius nesciunt dolorum eum vel.,2020-06-05,10:42:44
"Otto-Flimm-Straße, 53520 Nürburg",eff7e9ae-9c58-42e1-8835-0d51c33dc480,2020-06-05,12:00:00,17209,f3d07804-cd4e-4239-80ad-79b88a622d6f,bece4cf2-2499-4ae2-b767-53442cb234a4,5,Ferrari,"Natus minima officia. Fuga dolores ipsam nam quaerat.
Voluptatum commodi blanditiis explicabo porro. Ducimus numquam officia atque eligendi quod laborum dignissimos.",2020-06-05,06:28:04
"Otto-Flimm-Straße, 53520 Nürburg",eff7e9ae-9c58-42e1-8835-0d51c33dc480,2020-06-05,12:00:00,97537,457a1681-cf3a-4324-b80d-f14d31d7e6c7,1f17f2f0-4379-40aa-b36e-7eee499c8832,2,MG,Adipisci necessitatibus numquam est facilis quis. Eligendi distinctio eveniet vitae aperiam.,2020-06-05,10:13:50
"Mörfelder Landstraße 362, 60528 Frankfurt am Main",e6930b99-e8ca-49f8-9583-89f54366dc14,2020-06-05,20:00:00,7407,9b49f405-1570-4944-880c-7b11e52344e8,1ad47579-a837-463f-8b4f-d63199e8a5e6,5,Mitsubishi,"Tempora sunt aspernatur saepe.
Numquam quidem ut corporis id sapiente. Dolorum facere tenetur adipisci aspernatur. Mollitia itaque nesciunt quasi.",2020-06-05,02:20:53
"Xaver-Fuhr-Straße 101, 68163 Mannheim",2ab60824-b539-4a1f-ae1a-f7d94d2d55bb,2020-04-04,19:00:00,20537,6c2d4155-3b6f-4de3-8e5c-3651d10ab1d2,6c76d2e8-1439-4b7f-a477-474ee9991215,1,Jaguar,Nobis amet eveniet ratione. Accusantium commodi porro quidem blanditiis. Provident nulla voluptatibus.,2020-04-04,16:02:55
"Mörfelder Landstraße 362, 60528 Frankfurt am Main",e6930b99-e8ca-49f8-9583-89f54366dc14,2020-06-05,20:00:00,94330,0a3ceb74-068c-4e58-befd-e63b756a58c3,1db4f32b-d6d4-45c1-b8e4-976bf1c875cd,5,Mini,"Sunt recusandae ea aspernatur eum quis. Debitis quae doloremque sit sint laudantium nihil doloribus.
Pariatur cumque sequi mollitia architecto tempore mollitia. Nobis dolorem alias impedit cum vero.",2020-06-05,08:13:49
"Mörfelder Landstraße 362, 60528 Frankfurt am Main",e6930b99-e8ca-49f8-9583-89f54366dc14,2020-06-05,20:00:00,93095,12161938-5870-452f-a7b1-a20c8ee4e67d,de9b8fd7-d6fe-4532-8c31-02c1f118a281,5,Rover,"Deleniti possimus quia aspernatur.
Quibusdam quaerat placeat voluptatibus. Commodi aliquid quod vel.
Culpa doloribus ad ab culpa suscipit dolorem eveniet. Perspiciatis fugit minima fugit ab facilis.",2020-06-05,15:24:42
"Otto-Flimm-Straße, 53520 Nürburg",eff7e9ae-9c58-42e1-8835-0d51c33dc480,2020-06-05,12:00:00,39291,2187e1a2-ed3c-4fea-874b-8895134b791e,be80a196-264d-4d23-b175-cff8d29cc402,4,Volvo,Magnam natus suscipit quaerat ut delectus. Rerum optio nobis doloribus saepe maxime. Nostrum voluptatum fugit sequi iure ad.,2020-06-05,12:41:20
"Xaver-Fuhr-Straße 101, 68163 Mannheim",2ab60824-b539-4a1f-ae1a-f7d94d2d55bb,2020-04-04,19:00:00,16348,af6ae583-d2af-4b91-809f-687ffe7be169,b79fb6d0-7b65-4e89-b228-f28316a8250f,5,Aston Martin,Deleniti quis dicta quos odio. Nulla quod voluptatem quod corporis. Rerum suscipit maiores ut officia.,2020-04-04,03:57:55
"Otto-Flimm-Straße, 53520 Nürburg",eff7e9ae-9c58-42e1-8835-0d51c33dc480,2020-06-05,12:00:00,94065,7e465889-2af8-43ad-95e7-dee5719d442b,42f6bc95-3977-4b85-a33f-7a312c09057d,3,Mazda,"Ipsa ratione nisi repudiandae. Iste quibusdam possimus assumenda. Cum quidem et delectus qui blanditiis.
Veritatis praesentium laborum. Nam repudiandae eius id.",2020-06-05,02:07:22
"Xaver-Fuhr-Straße 101, 68163 Mannheim",2ab60824-b539-4a1f-ae1a-f7d94d2d55bb,2020-04-04,19:00:00,98596,98776c4f-0b70-403a-972e-da3df6cc26c8,a05057c4-b04b-446c-9600-4399a1d0805b,5,Alfa Romeo,"Alias sunt alias accusamus magni. Sapiente eligendi voluptatem consequuntur dolore repudiandae nesciunt.
Corporis eius consequuntur ab aliquam ut quod. Nisi quas quos accusamus ratione enim.",2020-04-04,21:31:36
"Otto-Flimm-Straße, 53520 Nürburg",eff7e9ae-9c58-42e1-8835-0d51c33dc480,2020-06-05,12:00:00,36404,55c7a81d-2e4e-4356-be03-82034b2edbaf,4293a1ce-0204-4fd4-bc3d-4834530338e5,4,Volkswagen,Eius ex inventore ab eaque. Saepe occaecati fuga sit aliquid id optio. Explicabo quasi mollitia molestiae molestias praesentium molestiae.,2020-06-05,07:30:20
"Otto-Flimm-Straße, 53520 Nürburg",eff7e9ae-9c58-42e1-8835-0d51c33dc480,2020-06-05,12:00:00,7338,24574fdb-c314-44b6-a9a1-8e9acdfd6343,b1311d51-4049-4c15-b67e-333fbca336e7,5,Ford,Recusandae voluptates nemo quod id. Esse suscipit aperiam alias.,2020-06-05,21:33:23
"Mörfelder Landstraße 362, 60528 Frankfurt am Main",e6930b99-e8ca-49f8-9583-89f54366dc14,2020-06-05,20:00:00,16766,24574fdb-c314-44b6-a9a1-8e9acdfd6343,9f694402-2c08-433c-8438-2e331f2c7d62,5,Chevrolet,Expedita libero fugiat corporis iure ullam inventore. Illum voluptas quae aliquid laudantium eaque.,2020-06-05,00:06:08
"Mörfelder Landstraße 362, 60528 Frankfurt am Main",e6930b99-e8ca-49f8-9583-89f54366dc14,2020-06-05,20:00:00,75397,c7ce6359-822e-4faa-be69-071c445e7c36,c495334e-deef-4f36-9cef-4af43ed63329,2,Peugeot,"Odio recusandae ipsam non. Delectus expedita animi saepe nihil laudantium ipsa amet. Est sunt eius unde dolorem architecto.
Sunt provident laborum commodi eum facere natus. Deserunt deserunt cumque.",2020-06-05,18:41:57
"Xaver-Fuhr-Straße 101, 68163 Mannheim",2ab60824-b539-4a1f-ae1a-f7d94d2d55bb,2020-04-04,19:00:00,88361,fb645b0e-2b94-485e-8723-74654c5f7c4f,20610ec3-cdc6-471e-94f2-935c2baff899,1,Chrysler,Illum velit sequi similique reiciendis veniam expedita dolorum. Sunt atque consectetur.,2020-04-04,19:32:11
"Mörfelder Landstraße 362, 60528 Frankfurt am Main",e6930b99-e8ca-49f8-9583-89f54366dc14,2020-06-05,20:00:00,1945,39276af3-6366-430d-bc34-e7f7ce5622fe,431a75d2-e8c3-4133-a7eb-16b219c207c1,2,Toyota,Delectus nulla repellat sunt aperiam. Minima blanditiis omnis odit dolorum fuga. Aperiam cumque tempore rem neque.,2020-06-05,11:28:20
"Otto-Flimm-Straße, 53520 Nürburg",eff7e9ae-9c58-42e1-8835-0d51c33dc480,2020-06-05,12:00:00,30539,af6ae583-d2af-4b91-809f-687ffe7be169,57f55aa8-15a4-47d6-b631-e4e347112c45,4,Lada,Fuga est odio mollitia omnis at. Quasi officiis illum odio sit. Laboriosam ad ab excepturi reiciendis.,2020-06-05,15:54:50
"Xaver-Fuhr-Straße 101, 68163 Mannheim",2ab60824-b539-4a1f-ae1a-f7d94d2d55bb,2020-04-04,19:00:00,66871,d96bdc9e-aa2b-4157-976a-06bad3ba4855,15820320-4ab5-4946-be07-92b215a4fd13,1,Mitsubishi,Voluptate consectetur ipsum voluptates quisquam laudantium adipisci. Consectetur aperiam vitae vitae odit laborum. Aut voluptates aliquam odio quas cupiditate consequuntur beatae.,2020-04-04,17:22:45
"Otto-Flimm-Straße, 53520 Nürburg",eff7e9ae-9c58-42e1-8835-0d51c33dc480,2020-06-05,12:00:00,56290,f0158fac-4fba-4fbd-915f-5ff92f9b082e,b0cbc77f-0c09-4161-a1d1-7347642d305e,3,Fisker,"Iste ab nihil natus velit perferendis itaque. Eius perspiciatis iure perspiciatis.
Expedita quam quis quisquam.
Dolorem ipsum ex hic fuga hic nam. In inventore perspiciatis libero.",2020-06-05,19:50:04
"Otto-Flimm-Straße, 53520 Nürburg",eff7e9ae-9c58-42e1-8835-0d51c33dc480,2020-06-05,12:00:00,84385,7a6a5ab2-df22-4ebf-ac8b-df06c0fcc43d,acff0d37-6bb9-449b-a60f-1f4855a10bf5,1,Tesla,Libero debitis voluptatem eius ipsam. Accusantium asperiores iste omnis suscipit eaque illum vero. Magni accusantium deserunt enim repellendus.,2020-06-05,03:23:45
"Mörfelder Landstraße 362, 60528 Frankfurt am Main",e6930b99-e8ca-49f8-9583-89f54366dc14,2020-06-05,20:00:00,69207,6efdb7a1-f789-4434-a1a3-c4739eb6481d,ce241485-fa9e-4c93-ad0a-00eff2e4cd6f,2,Renault,"Eos alias nam vero. Molestiae temporibus earum saepe provident dolorum ipsam sunt.
Suscipit molestiae beatae. Hic ex perferendis adipisci.",2020-06-05,23:16:26
"Rheinlanddamm 200, 44139 Dortmund",7be626b0-c1cd-4a26-a111-60afb13ba940,2020-04-30,17:00:00,14823,e9c1c37e-dc93-41a3-ad3e-0738a134f544,523f0ada-6f1a-4144-acfb-660c288112d7,5,Lotus,"Inventore voluptatum vero optio at quaerat quod. Explicabo omnis alias illum id hic reiciendis.
Temporibus numquam assumenda quod. Doloribus est commodi laudantium sit tempore.",2020-04-30,18:57:22
