journey_id,reservation_requested_seats,journey_empty_spaces,reservation_text,user_id,journey_user_id
199d078e-4afb-4556-844f-e2b27593c5e2,3,5,"Minus id labore. Corporis reiciendis recusandae eligendi autem illo. Omnis minima dolor.
Laudantium hic porro nisi itaque fugiat. Cupiditate beatae molestias.",e928afc8-1e4d-49d0-8123-3b9f72122641,ba516a17-7aff-4080-b0ab-5e6da78aa02b
8b18113d-9dc3-4fde-b17b-4f7dc8c7e56f,1,4,"Animi error optio exercitationem perferendis recusandae. Mollitia harum accusamus molestias. Animi nam aut eveniet.
Assumenda quaerat natus explicabo iste ipsa exercitationem.",12406f81-487a-4996-806a-e3d18b5cca73,9b70d827-b5eb-4f1a-a22a-bfebe58a5b64
199d078e-4afb-4556-844f-e2b27593c5e2,5,5,"Optio sapiente non ea voluptas. Ea eum earum asperiores consectetur fugiat quibusdam.
Soluta adipisci in. Perspiciatis dignissimos illo eveniet. Minus repudiandae aliquid similique eligendi natus.",bd136f1e-88d4-4d56-a3b2-8522257d9564,ba516a17-7aff-4080-b0ab-5e6da78aa02b
7870a3f9-4b3f-4b57-b93d-da0b5be87a43,1,1,Deleniti tempore rem dolorum vel sed rem. Atque iusto ipsa vero totam. Ea vel quas ullam quibusdam.,090ecc33-f292-4626-a84e-86d83516ad76,58d96f87-c364-4582-8e54-76b099a96ccd
8b18113d-9dc3-4fde-b17b-4f7dc8c7e56f,5,4,"Sit cupiditate amet illo. Sunt exercitationem natus hic ipsa.
Necessitatibus vitae distinctio impedit id. A possimus iusto excepturi non ex. Perspiciatis labore atque unde a doloribus excepturi.",9668da27-59fb-4cf7-ac57-ba0257a45e4c,9b70d827-b5eb-4f1a-a22a-bfebe58a5b64
8b18113d-9dc3-4fde-b17b-4f7dc8c7e56f,5,4,Debitis unde porro eos totam optio officia. Quaerat veniam adipisci perspiciatis. Debitis ut debitis dolore laborum reprehenderit.,b6f9add8-297e-4886-9550-21a1275f4598,9b70d827-b5eb-4f1a-a22a-bfebe58a5b64
8b18113d-9dc3-4fde-b17b-4f7dc8c7e56f,4,4,Tempore ab ducimus ipsam accusamus adipisci recusandae. Iusto doloremque corrupti repudiandae tempore aut neque.,26e23de3-b63f-4fa5-b1b8-841506960a64,9b70d827-b5eb-4f1a-a22a-bfebe58a5b64
7870a3f9-4b3f-4b57-b93d-da0b5be87a43,5,1,Suscipit hic sapiente laborum suscipit corporis veniam. Quod odit occaecati laboriosam. Voluptas distinctio praesentium vel.,314934b5-f928-46e9-93c5-c209a90cc582,58d96f87-c364-4582-8e54-76b099a96ccd
199d078e-4afb-4556-844f-e2b27593c5e2,5,5,Itaque ipsam dolores nihil officia quos quis. Doloremque est laboriosam consequuntur id.,e7dade02-1b46-4a60-aac4-c3fff40fe63f,ba516a17-7aff-4080-b0ab-5e6da78aa02b
596a49a7-766d-4166-aebd-9d2551443543,5,5,Soluta reprehenderit explicabo veritatis similique suscipit. Architecto ab omnis consequuntur. Voluptas eum occaecati sint unde porro tempore minus.,b05427f0-049f-4c63-b6f7-4274f229ecdd,60a3bcf6-1480-41e2-9c6f-eec7642a0f60
199d078e-4afb-4556-844f-e2b27593c5e2,4,5,Corporis illum libero impedit. Animi fugiat sed consectetur quasi laboriosam in. Alias sunt quaerat doloremque culpa expedita.,39142fc1-1c6d-4778-b091-40975831c5d9,ba516a17-7aff-4080-b0ab-5e6da78aa02b
199d078e-4afb-4556-844f-e2b27593c5e2,4,5,Repudiandae accusamus aliquid earum delectus accusamus ipsum. Error cumque recusandae odit minima nisi.,5c0e8357-2b51-44e4-8d43-38f58166be37,ba516a17-7aff-4080-b0ab-5e6da78aa02b
7870a3f9-4b3f-4b57-b93d-da0b5be87a43,1,1,"Architecto repellat quidem doloribus ad inventore. Vero omnis dolor beatae qui. Quod aliquid sapiente facere.
Vel porro eum saepe quam.
Praesentium facere officia. Ea ipsam ad totam nesciunt.",b88ab42a-3129-4916-9442-c310695c80d9,58d96f87-c364-4582-8e54-76b099a96ccd
596a49a7-766d-4166-aebd-9d2551443543,1,5,"Delectus cum atque explicabo.
Rerum perspiciatis recusandae neque quaerat impedit. Quibusdam delectus placeat sint exercitationem architecto tempora. Nemo suscipit est cumque aliquid natus delectus.",b29c8cb6-696d-44e7-a17b-208f0778f68a,60a3bcf6-1480-41e2-9c6f-eec7642a0f60
199d078e-4afb-4556-844f-e2b27593c5e2,1,5,Rem commodi pariatur accusamus. Quaerat esse veritatis commodi sapiente minima. Necessitatibus eveniet vero explicabo perferendis. Ab consectetur debitis minus deleniti.,39142fc1-1c6d-4778-b091-40975831c5d9,ba516a17-7aff-4080-b0ab-5e6da78aa02b
7870a3f9-4b3f-4b57-b93d-da0b5be87a43,2,1,Unde voluptate porro temporibus dolorem. Magnam quasi officiis maxime aut perferendis. Omnis eum ex pariatur delectus illo quasi.,80b798bb-488b-479a-bd6c-472a886ac3f3,58d96f87-c364-4582-8e54-76b099a96ccd
8b18113d-9dc3-4fde-b17b-4f7dc8c7e56f,1,4,Libero eveniet provident animi laudantium distinctio deserunt. Cumque vitae ad porro distinctio.,bd136f1e-88d4-4d56-a3b2-8522257d9564,9b70d827-b5eb-4f1a-a22a-bfebe58a5b64
8b18113d-9dc3-4fde-b17b-4f7dc8c7e56f,4,4,Esse eveniet illo fuga quo recusandae expedita. Accusantium delectus quia soluta provident accusamus error. Nulla sint a inventore veritatis dicta eius.,182d0a76-8ecf-40e1-b8ce-38f414952c77,9b70d827-b5eb-4f1a-a22a-bfebe58a5b64
7870a3f9-4b3f-4b57-b93d-da0b5be87a43,4,1,"Nemo sit ipsum fugit. Unde sint nobis qui laboriosam eos dolor totam. Ducimus quo quae ab blanditiis eaque perferendis.
Quis ipsam dolore dicta animi. Similique distinctio fugit ipsum.",b05427f0-049f-4c63-b6f7-4274f229ecdd,58d96f87-c364-4582-8e54-76b099a96ccd
8b18113d-9dc3-4fde-b17b-4f7dc8c7e56f,5,4,"Rem illo minus quod.
Odio ex distinctio sequi velit illo delectus earum. Dolorem sequi enim odit. Dolorum mollitia a quaerat totam veniam necessitatibus.",e7dade02-1b46-4a60-aac4-c3fff40fe63f,9b70d827-b5eb-4f1a-a22a-bfebe58a5b64
199d078e-4afb-4556-844f-e2b27593c5e2,4,5,Porro ea iure impedit suscipit. Consequatur dolorum tempora optio quod dolores.,f9d82ec4-5acb-4d22-a1fe-8e08e09a56b6,ba516a17-7aff-4080-b0ab-5e6da78aa02b
8b18113d-9dc3-4fde-b17b-4f7dc8c7e56f,2,4,Nobis eius minus enim esse quidem. Dolorum aliquid quos perferendis autem. Harum quas excepturi architecto occaecati. Aut labore exercitationem ad.,b66e4a54-1509-44a2-a52a-84450710780e,9b70d827-b5eb-4f1a-a22a-bfebe58a5b64
7870a3f9-4b3f-4b57-b93d-da0b5be87a43,2,1,Illo perspiciatis reiciendis. Harum blanditiis sed magni veniam sequi. Sint sit ratione laudantium laudantium minima iure. Quod eos nostrum ratione eligendi.,df1ce7a6-f079-400d-81b1-4ddcc15351a3,58d96f87-c364-4582-8e54-76b099a96ccd
8b18113d-9dc3-4fde-b17b-4f7dc8c7e56f,4,4,Voluptatem maxime praesentium exercitationem nostrum illum velit quos. Velit tenetur dolores. Optio vero omnis optio eligendi exercitationem.,a7cd15c9-dda8-486d-ba50-48e7c24bf994,9b70d827-b5eb-4f1a-a22a-bfebe58a5b64
596a49a7-766d-4166-aebd-9d2551443543,1,5,"Ut vitae deleniti temporibus eligendi repellat. Velit aut magni.
Reiciendis ut fugit voluptas mollitia delectus hic. Optio laborum inventore officiis. Possimus sapiente id fugiat expedita.",021077ae-9dea-4f86-9487-8df8c19c7344,60a3bcf6-1480-41e2-9c6f-eec7642a0f60
596a49a7-766d-4166-aebd-9d2551443543,4,5,Labore architecto impedit dolores itaque officiis repellendus. Sunt omnis ratione dignissimos unde quaerat asperiores.,2ae683b1-9546-49a9-af9f-6d9a87f166fe,60a3bcf6-1480-41e2-9c6f-eec7642a0f60
199d078e-4afb-4556-844f-e2b27593c5e2,3,5,Impedit pariatur dolorem tenetur esse exercitationem vel. Fuga blanditiis vitae beatae.,7a0b396b-6dd5-4c46-8cb1-1759be881956,ba516a17-7aff-4080-b0ab-5e6da78aa02b
7870a3f9-4b3f-4b57-b93d-da0b5be87a43,1,1,"Vero quia odio sapiente. Praesentium autem libero assumenda sapiente suscipit sunt nobis.
Perspiciatis ratione cum. Commodi adipisci perferendis eius.",370ce4eb-971c-4cab-86ba-dbea8d7fe270,58d96f87-c364-4582-8e54-76b099a96ccd
7870a3f9-4b3f-4b57-b93d-da0b5be87a43,5,1,"Eaque error quia temporibus debitis distinctio. Earum cupiditate odio quam tenetur. Dignissimos eveniet culpa.
Eos quam dicta. Totam quis architecto quaerat.",776220f0-c0f9-4800-9c14-e1fdcfebe78f,58d96f87-c364-4582-8e54-76b099a96ccd
199d078e-4afb-4556-844f-e2b27593c5e2,5,5,Sunt natus fuga occaecati ad assumenda. Ratione voluptates corrupti quia asperiores voluptatibus cum. Hic fugit laborum ducimus.,eef254dc-831a-42ef-9d85-d8e3dff5b720,ba516a17-7aff-4080-b0ab-5e6da78aa02b
596a49a7-766d-4166-aebd-9d2551443543,2,5,"Id quae doloribus dolor corporis amet. Hic laborum quasi aspernatur.
Similique quae dolorum quod voluptates voluptate illum.",a431eba4-7b68-4761-b82b-100acf19f6e8,60a3bcf6-1480-41e2-9c6f-eec7642a0f60
8b18113d-9dc3-4fde-b17b-4f7dc8c7e56f,3,4,"Rerum eius et minus totam temporibus. Laboriosam perferendis tempora molestias magni.
Doloribus doloremque veniam occaecati minima. Accusamus omnis dicta illum.",d2bece4a-3b80-4a61-9c19-053938f4ce94,9b70d827-b5eb-4f1a-a22a-bfebe58a5b64
7870a3f9-4b3f-4b57-b93d-da0b5be87a43,4,1,Laborum ullam rerum neque ad saepe vero.,2050b9dc-7990-4304-a614-26192c3498f9,58d96f87-c364-4582-8e54-76b099a96ccd
596a49a7-766d-4166-aebd-9d2551443543,3,5,Dignissimos perspiciatis quae voluptatibus illo dolor. Natus voluptas consectetur nisi vel quae. Id molestiae totam libero sed delectus.,1fc167cc-80a0-469f-ac7a-0ceb811c3203,60a3bcf6-1480-41e2-9c6f-eec7642a0f60
8b18113d-9dc3-4fde-b17b-4f7dc8c7e56f,4,4,Temporibus dolorem exercitationem molestias. Necessitatibus esse rerum modi sunt molestiae. Officiis quam ducimus quo modi eaque atque facilis.,734a2fb2-f740-4d9f-945d-6360dd1ac6c6,9b70d827-b5eb-4f1a-a22a-bfebe58a5b64
199d078e-4afb-4556-844f-e2b27593c5e2,2,5,Ipsam quia dolore voluptatem adipisci saepe ipsa. Distinctio explicabo provident magni architecto sunt. Magni placeat quisquam quidem pariatur.,58d96f87-c364-4582-8e54-76b099a96ccd,ba516a17-7aff-4080-b0ab-5e6da78aa02b
7870a3f9-4b3f-4b57-b93d-da0b5be87a43,1,1,"Labore impedit eligendi alias minima. Ullam dicta sint vel fugiat harum. Velit aliquid nam repudiandae dolores.
Consequuntur tempore illum consectetur molestiae.",182d0a76-8ecf-40e1-b8ce-38f414952c77,58d96f87-c364-4582-8e54-76b099a96ccd
199d078e-4afb-4556-844f-e2b27593c5e2,1,5,Perferendis at fugiat similique id aspernatur accusantium enim. Voluptatibus dolores quia alias ad voluptatum et.,a929aea5-946c-4d96-8db4-43600d2d95eb,ba516a17-7aff-4080-b0ab-5e6da78aa02b
596a49a7-766d-4166-aebd-9d2551443543,1,5,Quod dolore praesentium repellat doloremque. Atque cupiditate animi voluptatibus commodi expedita. Necessitatibus qui unde dignissimos.,5d68cdca-0448-479c-ad78-ad2c989d7c9c,60a3bcf6-1480-41e2-9c6f-eec7642a0f60
199d078e-4afb-4556-844f-e2b27593c5e2,3,5,Quia recusandae adipisci architecto voluptatum rem. Voluptate nulla laboriosam laboriosam sit excepturi.,60a3bcf6-1480-41e2-9c6f-eec7642a0f60,ba516a17-7aff-4080-b0ab-5e6da78aa02b
8b18113d-9dc3-4fde-b17b-4f7dc8c7e56f,3,4,"Consectetur accusamus ipsum error rerum. Commodi reiciendis eligendi reiciendis id porro cupiditate. Accusamus sit beatae possimus a quis.
Cupiditate blanditiis ea officia hic.",05bd2767-62ae-4992-a1b9-b339b6e37a59,9b70d827-b5eb-4f1a-a22a-bfebe58a5b64
596a49a7-766d-4166-aebd-9d2551443543,3,5,Doloremque officia culpa libero maiores. Deserunt cumque enim esse perspiciatis magni perferendis hic.,ba516a17-7aff-4080-b0ab-5e6da78aa02b,60a3bcf6-1480-41e2-9c6f-eec7642a0f60
7870a3f9-4b3f-4b57-b93d-da0b5be87a43,3,1,Possimus commodi numquam quidem aliquid sapiente natus quibusdam. Est amet velit ab vero fugit alias. Labore consequatur non consequatur similique.,40088021-f844-457a-98ce-b9fa89eedbf7,58d96f87-c364-4582-8e54-76b099a96ccd
7870a3f9-4b3f-4b57-b93d-da0b5be87a43,5,1,Deserunt alias impedit ratione illum. Magni ut ab consequuntur soluta veniam.,ff65592c-fd29-4d18-a1e2-f5398ab4192d,58d96f87-c364-4582-8e54-76b099a96ccd
199d078e-4afb-4556-844f-e2b27593c5e2,5,5,Temporibus consequuntur dolore repellendus repudiandae. Dignissimos provident aliquam officiis aliquam unde nihil.,26e23de3-b63f-4fa5-b1b8-841506960a64,ba516a17-7aff-4080-b0ab-5e6da78aa02b
199d078e-4afb-4556-844f-e2b27593c5e2,5,5,"Architecto alias asperiores modi recusandae ad suscipit.
Non hic corrupti adipisci. Esse dolores ducimus nostrum hic excepturi dignissimos.",52040252-4a30-4c6f-bc62-044870129808,ba516a17-7aff-4080-b0ab-5e6da78aa02b
199d078e-4afb-4556-844f-e2b27593c5e2,1,5,Illo quam modi expedita iure. Eligendi quae nihil nisi nulla tenetur quia vero. Necessitatibus cum rem veniam ab. Distinctio nemo cupiditate dolore reiciendis nostrum.,df1ce7a6-f079-400d-81b1-4ddcc15351a3,ba516a17-7aff-4080-b0ab-5e6da78aa02b
199d078e-4afb-4556-844f-e2b27593c5e2,1,5,Aperiam incidunt quisquam aliquid exercitationem minus. Ea distinctio voluptates ratione mollitia quisquam. Nam nesciunt quam voluptate dolorum repudiandae similique.,b123a906-4877-4bb1-93ec-309ede18c44d,ba516a17-7aff-4080-b0ab-5e6da78aa02b
596a49a7-766d-4166-aebd-9d2551443543,1,5,"Vitae architecto modi voluptates ullam reiciendis nobis. Consequuntur consectetur minus veniam dolorem.
Dolorum ducimus ea nemo modi mollitia consequatur.",16ab5725-c530-40a7-ab8d-91e679e02fc2,60a3bcf6-1480-41e2-9c6f-eec7642a0f60
8b18113d-9dc3-4fde-b17b-4f7dc8c7e56f,4,4,"Vel sapiente fugit animi in nemo. Esse deleniti suscipit dignissimos. Eius possimus eaque possimus eum eum veniam dolores.
Quas nemo facere. Eligendi amet ipsa vero amet perferendis.",0e2ef53a-7b77-4852-abb1-5a7e63c05c1c,9b70d827-b5eb-4f1a-a22a-bfebe58a5b64
596a49a7-766d-4166-aebd-9d2551443543,3,5,"Tempore corrupti odit quaerat sed.
Delectus sunt accusantium eveniet occaecati vero excepturi. Nihil asperiores optio eveniet non fugit.
Unde saepe qui animi alias illo. Magnam corporis laboriosam.",182d0a76-8ecf-40e1-b8ce-38f414952c77,60a3bcf6-1480-41e2-9c6f-eec7642a0f60
8b18113d-9dc3-4fde-b17b-4f7dc8c7e56f,2,4,Eius non voluptatem eius deleniti. Soluta aut consequuntur perferendis quaerat. Non eaque deserunt iure. Officiis assumenda amet quod voluptatum amet harum.,9bedea62-c758-4268-b279-22934532de30,9b70d827-b5eb-4f1a-a22a-bfebe58a5b64
199d078e-4afb-4556-844f-e2b27593c5e2,5,5,Accusantium non beatae aperiam aspernatur vitae. Commodi dolorum labore beatae magnam sunt. Minima error voluptatem magni laudantium.,ba516a17-7aff-4080-b0ab-5e6da78aa02b,ba516a17-7aff-4080-b0ab-5e6da78aa02b
596a49a7-766d-4166-aebd-9d2551443543,5,5,"Ea iste qui dignissimos nostrum.
Dolore quae voluptates aperiam. Numquam assumenda assumenda nostrum alias odit. Sit ipsum beatae.",04399bf4-784c-4ef0-81ce-60afa5b31621,60a3bcf6-1480-41e2-9c6f-eec7642a0f60
596a49a7-766d-4166-aebd-9d2551443543,5,5,"Quod dolorum quia. Neque vitae iste sequi corrupti illum alias.
Assumenda neque minima odio excepturi pariatur. Quae ullam error.",20d10ad9-dbcc-4f9d-beee-a9bc17e2c89c,60a3bcf6-1480-41e2-9c6f-eec7642a0f60
596a49a7-766d-4166-aebd-9d2551443543,4,5,"Nisi officia illum eos facilis vel cumque ipsum. Fugit esse a accusamus earum impedit aliquam.
Dignissimos natus eaque inventore. Quisquam iusto iure ea.",ba516a17-7aff-4080-b0ab-5e6da78aa02b,60a3bcf6-1480-41e2-9c6f-eec7642a0f60
199d078e-4afb-4556-844f-e2b27593c5e2,1,5,"Ex dicta magni quaerat rerum mollitia eligendi. Sit ullam laboriosam.
Qui consequatur explicabo alias omnis quia.",b6f9add8-297e-4886-9550-21a1275f4598,ba516a17-7aff-4080-b0ab-5e6da78aa02b
596a49a7-766d-4166-aebd-9d2551443543,3,5,Mollitia delectus nostrum nemo architecto. Culpa laboriosam corrupti nam tempora dolore porro fugiat. Rerum laboriosam impedit fuga consectetur eligendi error consequatur.,2f887a39-08f5-4829-b810-627c22b9d722,60a3bcf6-1480-41e2-9c6f-eec7642a0f60
596a49a7-766d-4166-aebd-9d2551443543,2,5,"Alias cumque facilis fugit nemo reiciendis. Rerum ipsum quasi quasi quasi nostrum. Sunt temporibus quis a ex cumque.
Culpa odit nostrum eius ab dolore. Voluptate sunt ullam ipsam nisi aliquam sint.",169653d0-3004-408b-9063-6bab9fac213c,60a3bcf6-1480-41e2-9c6f-eec7642a0f60
8b18113d-9dc3-4fde-b17b-4f7dc8c7e56f,5,4,"Quibusdam eius quidem temporibus labore libero. Odio officiis id nam. Dolor laboriosam non suscipit ab.
Soluta odio quae omnis officiis nisi. Perferendis mollitia ex voluptatum quas.",7a0b396b-6dd5-4c46-8cb1-1759be881956,9b70d827-b5eb-4f1a-a22a-bfebe58a5b64
199d078e-4afb-4556-844f-e2b27593c5e2,3,5,Doloribus quidem nisi. Deserunt nemo eius adipisci nesciunt ea. Expedita optio delectus.,c9c73437-2299-4f90-9104-c078dd6f3cc4,ba516a17-7aff-4080-b0ab-5e6da78aa02b
8b18113d-9dc3-4fde-b17b-4f7dc8c7e56f,5,4,"Magnam nobis architecto ut velit. Nemo facilis odit fugiat eveniet enim voluptatem.
Et fuga quidem maxime fugit. Soluta aliquid iste architecto magni.",55bbabb6-cffb-48f1-8f89-0abb11d5f9d1,9b70d827-b5eb-4f1a-a22a-bfebe58a5b64
199d078e-4afb-4556-844f-e2b27593c5e2,5,5,Consectetur culpa maxime aperiam. Quod corrupti et earum.,9cdeca80-ad09-415d-9c00-37eda03a913b,ba516a17-7aff-4080-b0ab-5e6da78aa02b
7870a3f9-4b3f-4b57-b93d-da0b5be87a43,2,1,Officia cum impedit iure esse. Aliquid voluptatibus dolorum ad incidunt. Sit alias repellendus voluptates ad cum.,05bd2767-62ae-4992-a1b9-b339b6e37a59,58d96f87-c364-4582-8e54-76b099a96ccd
596a49a7-766d-4166-aebd-9d2551443543,2,5,Maiores nobis labore quod adipisci et libero. Sapiente libero ea nihil sint suscipit consequatur odio. Unde dolores itaque consequuntur.,16ab5725-c530-40a7-ab8d-91e679e02fc2,60a3bcf6-1480-41e2-9c6f-eec7642a0f60
8b18113d-9dc3-4fde-b17b-4f7dc8c7e56f,1,4,Ipsa animi libero quos officiis ullam harum. Consequuntur inventore velit consequatur in ex vero iste. Ab consequatur occaecati numquam qui quos. Nam cum aperiam facilis nostrum odio ullam magni.,05bd2767-62ae-4992-a1b9-b339b6e37a59,9b70d827-b5eb-4f1a-a22a-bfebe58a5b64
8b18113d-9dc3-4fde-b17b-4f7dc8c7e56f,2,4,Ratione maxime labore veniam quos amet vel. Quisquam esse odit. Corporis libero deleniti fugiat nihil facilis omnis.,1f8c5827-0431-4997-bfb7-0be678defd4d,9b70d827-b5eb-4f1a-a22a-bfebe58a5b64
199d078e-4afb-4556-844f-e2b27593c5e2,4,5,Molestiae quasi error officiis officia neque. Nemo hic eius minima numquam tempora necessitatibus.,bd9c78bf-7db1-49d5-8479-59bdd48a93bf,ba516a17-7aff-4080-b0ab-5e6da78aa02b
199d078e-4afb-4556-844f-e2b27593c5e2,5,5,Accusamus totam alias architecto eius et. Magnam fuga soluta blanditiis. Consequuntur placeat nisi facilis consequatur.,2ae683b1-9546-49a9-af9f-6d9a87f166fe,ba516a17-7aff-4080-b0ab-5e6da78aa02b
8b18113d-9dc3-4fde-b17b-4f7dc8c7e56f,5,4,Fugit deserunt nemo dolore. Minus autem consectetur vero minus nisi. Placeat tenetur repudiandae veritatis deserunt mollitia totam quam.,c9c73437-2299-4f90-9104-c078dd6f3cc4,9b70d827-b5eb-4f1a-a22a-bfebe58a5b64
596a49a7-766d-4166-aebd-9d2551443543,3,5,Alias distinctio itaque tempore dicta mollitia voluptate omnis. Magnam eum velit similique dignissimos temporibus ex.,826d2a12-3191-47ea-aa51-eb8b437132d5,60a3bcf6-1480-41e2-9c6f-eec7642a0f60
596a49a7-766d-4166-aebd-9d2551443543,4,5,Tempora sequi soluta adipisci quas nihil. Pariatur totam eum. Rem est similique corporis adipisci quia.,49011016-fd7f-431b-a7b4-f7bbf91367a8,60a3bcf6-1480-41e2-9c6f-eec7642a0f60
8b18113d-9dc3-4fde-b17b-4f7dc8c7e56f,2,4,Tempore eum assumenda incidunt. Quia ut sapiente. Alias dolorem quaerat molestias maxime placeat quo.,3a66417f-7d7f-4513-bcfc-b37da3c65740,9b70d827-b5eb-4f1a-a22a-bfebe58a5b64
596a49a7-766d-4166-aebd-9d2551443543,2,5,"Similique qui fugiat. Officia tempore quo aspernatur optio soluta.
Esse quam soluta. Ipsam perferendis magnam a quos.
In assumenda quos quaerat.",b67b9d85-7d42-4d46-8b00-b01fc0238909,60a3bcf6-1480-41e2-9c6f-eec7642a0f60
7870a3f9-4b3f-4b57-b93d-da0b5be87a43,5,1,Cupiditate consequuntur quo hic id. Perferendis eum expedita voluptatibus voluptatibus eos. Ut accusantium aspernatur porro libero quaerat reprehenderit.,090ecc33-f292-4626-a84e-86d83516ad76,58d96f87-c364-4582-8e54-76b099a96ccd
199d078e-4afb-4556-844f-e2b27593c5e2,3,5,Sit quae molestiae quis eum facere rerum. Vitae architecto expedita distinctio distinctio a numquam.,de362257-35a5-427f-b5be-37f9e41a9d9c,ba516a17-7aff-4080-b0ab-5e6da78aa02b
596a49a7-766d-4166-aebd-9d2551443543,2,5,Expedita asperiores perferendis corrupti laboriosam aspernatur. Soluta occaecati recusandae ad ducimus facilis. Enim blanditiis reiciendis error repudiandae.,9b70d827-b5eb-4f1a-a22a-bfebe58a5b64,60a3bcf6-1480-41e2-9c6f-eec7642a0f60
596a49a7-766d-4166-aebd-9d2551443543,1,5,Maiores id voluptatibus tempore ratione reiciendis magnam reiciendis. A minus iusto minima accusantium ratione reprehenderit. Aperiam doloribus at quidem.,df1ce7a6-f079-400d-81b1-4ddcc15351a3,60a3bcf6-1480-41e2-9c6f-eec7642a0f60
199d078e-4afb-4556-844f-e2b27593c5e2,2,5,"Ipsam tenetur consequatur vero. Fuga iure consectetur hic quas asperiores quasi. Natus dolores repellat.
Voluptatem magnam ratione vitae.",c9349e4d-cdcc-4c91-9685-b1728579a9a7,ba516a17-7aff-4080-b0ab-5e6da78aa02b
8b18113d-9dc3-4fde-b17b-4f7dc8c7e56f,3,4,Dolore consectetur tempore architecto tenetur. Deserunt nisi autem iste. Quas alias neque voluptatibus a.,cb014a0c-4a8c-4ffe-8c66-d92960571843,9b70d827-b5eb-4f1a-a22a-bfebe58a5b64
7870a3f9-4b3f-4b57-b93d-da0b5be87a43,4,1,Dolorem saepe magnam facere magnam porro adipisci. Nemo dolore eligendi tempora perferendis.,e77d26ba-472b-44d4-9dc0-e660461a28a2,58d96f87-c364-4582-8e54-76b099a96ccd
596a49a7-766d-4166-aebd-9d2551443543,5,5,Doloremque dicta dolorem dolorem atque. Accusantium earum quia quaerat libero quia. Pariatur ipsa asperiores cum suscipit necessitatibus consequuntur quos.,e77d26ba-472b-44d4-9dc0-e660461a28a2,60a3bcf6-1480-41e2-9c6f-eec7642a0f60
8b18113d-9dc3-4fde-b17b-4f7dc8c7e56f,1,4,Labore quo accusamus qui et adipisci. Dolore aliquam neque facilis cum quibusdam. Adipisci ea totam eligendi doloribus neque.,49011016-fd7f-431b-a7b4-f7bbf91367a8,9b70d827-b5eb-4f1a-a22a-bfebe58a5b64
199d078e-4afb-4556-844f-e2b27593c5e2,1,5,Dicta esse odit excepturi accusantium. Vel quidem cumque magni reiciendis corporis molestias. Officiis hic recusandae. Officiis ut possimus aliquid earum occaecati error.,5987dc9a-3176-449f-ad7d-20c942141cc5,ba516a17-7aff-4080-b0ab-5e6da78aa02b
199d078e-4afb-4556-844f-e2b27593c5e2,5,5,Voluptates odio nostrum est pariatur quam. Dignissimos et similique eveniet. Minus ipsam nemo maxime ipsum reiciendis. Ad dicta ipsum aliquam tenetur blanditiis voluptatum tempore.,8c65b6d5-831a-46c6-a72c-784141761a99,ba516a17-7aff-4080-b0ab-5e6da78aa02b
199d078e-4afb-4556-844f-e2b27593c5e2,2,5,Officia eveniet at ipsam earum deserunt. Occaecati nam repudiandae ad. Commodi minus asperiores iure.,40088021-f844-457a-98ce-b9fa89eedbf7,ba516a17-7aff-4080-b0ab-5e6da78aa02b
7870a3f9-4b3f-4b57-b93d-da0b5be87a43,1,1,"Molestias occaecati ad quidem culpa odio. Dolorum mollitia quidem enim similique nobis voluptates.
A vitae quam laborum. Esse doloribus libero quia. Quasi voluptas itaque amet eligendi.",6ad91709-19a5-4c97-9a4d-9151862eddde,58d96f87-c364-4582-8e54-76b099a96ccd
7870a3f9-4b3f-4b57-b93d-da0b5be87a43,4,1,Ipsum occaecati atque totam. Aliquid qui voluptas autem consequuntur.,ec2ced8a-770e-4a8a-b52c-7cfec55a59b4,58d96f87-c364-4582-8e54-76b099a96ccd
596a49a7-766d-4166-aebd-9d2551443543,2,5,Reiciendis natus repudiandae ducimus totam veritatis earum. Saepe commodi error incidunt iusto. Aut ipsum natus nulla unde quas.,ba516a17-7aff-4080-b0ab-5e6da78aa02b,60a3bcf6-1480-41e2-9c6f-eec7642a0f60
199d078e-4afb-4556-844f-e2b27593c5e2,3,5,"Dolor eaque voluptatibus corporis. Repellat velit unde nam. Suscipit dolor accusantium nisi mollitia ut.
Aut nostrum omnis. Delectus voluptates qui. Quibusdam at ipsam eius.",182d0a76-8ecf-40e1-b8ce-38f414952c77,ba516a17-7aff-4080-b0ab-5e6da78aa02b
7870a3f9-4b3f-4b57-b93d-da0b5be87a43,1,1,Sunt quae inventore id ea inventore. Numquam quaerat qui voluptates. Voluptatem maxime excepturi velit dolorem iure ea.,58d96f87-c364-4582-8e54-76b099a96ccd,58d96f87-c364-4582-8e54-76b099a96ccd
7870a3f9-4b3f-4b57-b93d-da0b5be87a43,3,1,Ullam quas distinctio necessitatibus officia. Magnam itaque earum repudiandae ea optio cupiditate laboriosam.,9bedea62-c758-4268-b279-22934532de30,58d96f87-c364-4582-8e54-76b099a96ccd
7870a3f9-4b3f-4b57-b93d-da0b5be87a43,4,1,Rerum laborum tenetur aut voluptates provident. Harum architecto quaerat magni.,9bedea62-c758-4268-b279-22934532de30,58d96f87-c364-4582-8e54-76b099a96ccd
199d078e-4afb-4556-844f-e2b27593c5e2,4,5,"Totam nisi quisquam impedit. Corrupti quibusdam quod. Minus odio tenetur quas.
Reiciendis distinctio iste pariatur porro eveniet molestias. Eveniet voluptatem eveniet vero.",8b314542-118f-4ffc-ae4b-bf6da186ecfb,ba516a17-7aff-4080-b0ab-5e6da78aa02b
596a49a7-766d-4166-aebd-9d2551443543,1,5,"Quam quae nesciunt doloremque.
In voluptatibus vel voluptas officiis quo expedita. Eos quisquam dolorum expedita ducimus. Aliquam recusandae soluta quaerat.",062a4cc0-8d3b-4618-aafc-787562f34e04,60a3bcf6-1480-41e2-9c6f-eec7642a0f60
596a49a7-766d-4166-aebd-9d2551443543,1,5,"Quibusdam optio quibusdam provident provident.
Neque tenetur iure atque minima dicta aliquid. Quam vel provident ipsum impedit tempora minus.",fae4fe41-3d63-4b32-8ea5-ca523fa8ea63,60a3bcf6-1480-41e2-9c6f-eec7642a0f60
7870a3f9-4b3f-4b57-b93d-da0b5be87a43,1,1,Dicta architecto impedit. Voluptate excepturi ad aliquam architecto eaque ducimus soluta. Voluptatibus ratione aliquid delectus.,24c57f2e-222d-4885-be3d-5e1330953e56,58d96f87-c364-4582-8e54-76b099a96ccd
596a49a7-766d-4166-aebd-9d2551443543,5,5,"Illum dolorem assumenda illo dicta quibusdam voluptatibus. Omnis neque dolorum occaecati doloribus.
Cupiditate tempore porro magni unde fugiat dicta. Incidunt nihil occaecati officia.",80b798bb-488b-479a-bd6c-472a886ac3f3,60a3bcf6-1480-41e2-9c6f-eec7642a0f60
7870a3f9-4b3f-4b57-b93d-da0b5be87a43,1,1,"Aspernatur repellendus in corrupti ut sunt.
Earum hic vel eius. Pariatur quibusdam eius.
Asperiores perspiciatis expedita. Laboriosam labore qui optio. Molestias nesciunt ipsa.",182d0a76-8ecf-40e1-b8ce-38f414952c77,58d96f87-c364-4582-8e54-76b099a96ccd
7870a3f9-4b3f-4b57-b93d-da0b5be87a43,4,1,Quis illo tempore eligendi accusamus nisi alias vitae. Dicta rem impedit sed earum quidem nostrum vitae. Temporibus tempore possimus maxime nam qui quos. Tenetur nostrum molestias aspernatur.,8400bce6-caec-4bd1-8eed-46bc73ebd4b2,58d96f87-c364-4582-8e54-76b099a96ccd
7870a3f9-4b3f-4b57-b93d-da0b5be87a43,5,1,"Rem in suscipit neque. Esse reprehenderit non maiores consequuntur quas at. Earum delectus assumenda.
Cum aspernatur consequuntur.",826d2a12-3191-47ea-aa51-eb8b437132d5,58d96f87-c364-4582-8e54-76b099a96ccd
